[INFO] Scanning for projects...
[INFO] ------------------------------------------------------------------------
[INFO] Detecting the operating system and CPU architecture
[INFO] ------------------------------------------------------------------------
[INFO] os.detected.name: linux
[INFO] os.detected.arch: x86_64
[INFO] os.detected.version: 5.4
[INFO] os.detected.version.major: 5
[INFO] os.detected.version.minor: 4
[INFO] os.detected.release: ubuntu
[INFO] os.detected.release.version: 18.04
[INFO] os.detected.release.like.ubuntu: true
[INFO] os.detected.release.like.debian: true
[INFO] os.detected.classifier: linux-x86_64
[INFO] ------------------------------------------------------------------------
[INFO] Reactor Build Order:
[INFO] 
[INFO] Apache Ozone Integration Tests                                     [jar]
[INFO] Apache Ozone Mini Ozone Chaos Tests                                [jar]
[INFO] 
[INFO] --------------< org.apache.ozone:ozone-integration-test >---------------
[INFO] Building Apache Ozone Integration Tests 1.3.0-SNAPSHOT             [1/2]
[INFO] --------------------------------[ jar ]---------------------------------
[INFO] 
[INFO] --- maven-antrun-plugin:1.3:run (create-testdirs) @ ozone-integration-test ---
[INFO] Executing tasks
[INFO] Executed tasks
[INFO] 
[INFO] --- jacoco-maven-plugin:0.8.5:prepare-agent (default-prepare-agent) @ ozone-integration-test ---
[WARNING] The artifact xml-apis:xml-apis:jar:2.0.2 has been relocated to xml-apis:xml-apis:jar:1.0.b2
[INFO] argLine set to -javaagent:/home/runner/.m2/repository/org/jacoco/org.jacoco.agent/0.8.5/org.jacoco.agent-0.8.5-runtime.jar=destfile=/home/runner/work/ozone/ozone/hadoop-ozone/integration-test/target/jacoco.exec,includes=org.apache.hadoop.hdds.*:org.apache.hadoop.ozone.*:org.apache.hadoop.fs.ozone.*
[INFO] 
[INFO] --- maven-remote-resources-plugin:1.5:process (default) @ ozone-integration-test ---
[INFO] 
[INFO] --- maven-resources-plugin:3.1.0:resources (default-resources) @ ozone-integration-test ---
[INFO] Using 'UTF-8' encoding to copy filtered resources.
[INFO] skip non existing resourceDirectory /home/runner/work/ozone/ozone/hadoop-ozone/integration-test/src/main/resources
[INFO] Copying 2 resources
[INFO] 
[INFO] --- maven-compiler-plugin:3.1:compile (default-compile) @ ozone-integration-test ---
[INFO] No sources to compile
[INFO] 
[INFO] --- maven-resources-plugin:3.1.0:testResources (default-testResources) @ ozone-integration-test ---
[INFO] Using 'UTF-8' encoding to copy filtered resources.
[INFO] Copying 21 resources
[INFO] Copying 2 resources
[INFO] 
[INFO] --- maven-compiler-plugin:3.1:testCompile (default-testCompile) @ ozone-integration-test ---
[INFO] Compiling 11 source files to /home/runner/work/ozone/ozone/hadoop-ozone/integration-test/target/test-classes
[INFO] 
[INFO] --- maven-surefire-plugin:3.0.0-M1:test (default-test) @ ozone-integration-test ---
[INFO] 
[INFO] -------------------------------------------------------
[INFO]  T E S T S
[INFO] -------------------------------------------------------
[INFO] Running org.apache.hadoop.ozone.parser.TestOzoneHARatisLogParser
[INFO] Tests run: 1, Failures: 0, Errors: 0, Skipped: 0, Time elapsed: 68.929 s - in org.apache.hadoop.ozone.parser.TestOzoneHARatisLogParser
[INFO] Running org.apache.hadoop.ozone.TestSecureOzoneCluster
[INFO] Tests run: 11, Failures: 0, Errors: 0, Skipped: 0, Time elapsed: 68.338 s - in org.apache.hadoop.ozone.TestSecureOzoneCluster
[INFO] Running org.apache.hadoop.ozone.freon.TestDataValidateWithDummyContainers
[INFO] Tests run: 2, Failures: 0, Errors: 0, Skipped: 0, Time elapsed: 66.093 s - in org.apache.hadoop.ozone.freon.TestDataValidateWithDummyContainers
[INFO] Running org.apache.hadoop.ozone.freon.TestHadoopNestedDirGenerator
[INFO] Tests run: 1, Failures: 0, Errors: 0, Skipped: 0, Time elapsed: 68.448 s - in org.apache.hadoop.ozone.freon.TestHadoopNestedDirGenerator
[INFO] Running org.apache.hadoop.ozone.freon.TestDataValidateWithUnsafeByteOperations
[INFO] Tests run: 2, Failures: 0, Errors: 0, Skipped: 0, Time elapsed: 79.499 s - in org.apache.hadoop.ozone.freon.TestDataValidateWithUnsafeByteOperations
[INFO] Running org.apache.hadoop.ozone.freon.TestHadoopDirTreeGeneratorWithFSO
[INFO] Tests run: 1, Failures: 0, Errors: 0, Skipped: 0, Time elapsed: 89.701 s - in org.apache.hadoop.ozone.freon.TestHadoopDirTreeGeneratorWithFSO
[INFO] Running org.apache.hadoop.ozone.freon.TestRandomKeyGenerator
[WARNING] Tests run: 7, Failures: 0, Errors: 0, Skipped: 1, Time elapsed: 183.937 s - in org.apache.hadoop.ozone.freon.TestRandomKeyGenerator
[INFO] Running org.apache.hadoop.ozone.freon.TestFreonWithPipelineDestroy
[INFO] Tests run: 1, Failures: 0, Errors: 0, Skipped: 0, Time elapsed: 70.335 s - in org.apache.hadoop.ozone.freon.TestFreonWithPipelineDestroy
[INFO] Running org.apache.hadoop.ozone.freon.TestFreonWithDatanodeFastRestart
[WARNING] Tests run: 1, Failures: 0, Errors: 0, Skipped: 1, Time elapsed: 0.008 s - in org.apache.hadoop.ozone.freon.TestFreonWithDatanodeFastRestart
[INFO] Running org.apache.hadoop.ozone.freon.TestHadoopDirTreeGenerator
[INFO] Tests run: 1, Failures: 0, Errors: 0, Skipped: 0, Time elapsed: 91.155 s - in org.apache.hadoop.ozone.freon.TestHadoopDirTreeGenerator
[INFO] Running org.apache.hadoop.ozone.freon.TestDataValidateWithSafeByteOperations
[INFO] Tests run: 2, Failures: 0, Errors: 0, Skipped: 0, Time elapsed: 78.668 s - in org.apache.hadoop.ozone.freon.TestDataValidateWithSafeByteOperations
[INFO] Running org.apache.hadoop.ozone.shell.TestOzoneDatanodeShell
[INFO] Tests run: 2, Failures: 0, Errors: 0, Skipped: 0, Time elapsed: 0.671 s - in org.apache.hadoop.ozone.shell.TestOzoneDatanodeShell
[INFO] Running org.apache.hadoop.ozone.shell.TestOzoneShellHA
[INFO] Tests run: 8, Failures: 0, Errors: 0, Skipped: 0, Time elapsed: 75.546 s - in org.apache.hadoop.ozone.shell.TestOzoneShellHA
[INFO] Running org.apache.hadoop.ozone.shell.TestScmAdminHA
[INFO] Tests run: 1, Failures: 0, Errors: 0, Skipped: 0, Time elapsed: 59.369 s - in org.apache.hadoop.ozone.shell.TestScmAdminHA
[INFO] Running org.apache.hadoop.ozone.shell.TestNSSummaryAdmin
[INFO] Tests run: 3, Failures: 0, Errors: 0, Skipped: 0, Time elapsed: 24.173 s - in org.apache.hadoop.ozone.shell.TestNSSummaryAdmin
[INFO] Running org.apache.hadoop.ozone.TestMiniOzoneCluster
[INFO] Tests run: 5, Failures: 0, Errors: 0, Skipped: 0, Time elapsed: 206.166 s - in org.apache.hadoop.ozone.TestMiniOzoneCluster
[INFO] Running org.apache.hadoop.ozone.TestContainerBalancerOperations
[WARNING] Tests run: 1, Failures: 0, Errors: 0, Skipped: 1, Time elapsed: 0.011 s - in org.apache.hadoop.ozone.TestContainerBalancerOperations
[INFO] Running org.apache.hadoop.ozone.dn.scrubber.TestDataScrubber
[INFO] Tests run: 1, Failures: 0, Errors: 0, Skipped: 0, Time elapsed: 54.262 s - in org.apache.hadoop.ozone.dn.scrubber.TestDataScrubber
[INFO] Running org.apache.hadoop.ozone.dn.ratis.TestDnRatisLogParser
[INFO] Tests run: 1, Failures: 0, Errors: 0, Skipped: 0, Time elapsed: 25.103 s - in org.apache.hadoop.ozone.dn.ratis.TestDnRatisLogParser
[INFO] Running org.apache.hadoop.ozone.dn.volume.TestDatanodeHddsVolumeFailureToleration
[INFO] Tests run: 1, Failures: 0, Errors: 0, Skipped: 0, Time elapsed: 49.994 s - in org.apache.hadoop.ozone.dn.volume.TestDatanodeHddsVolumeFailureToleration
[INFO] Running org.apache.hadoop.ozone.dn.volume.TestDatanodeHddsVolumeFailureDetection
[INFO] Tests run: 3, Failures: 0, Errors: 0, Skipped: 0, Time elapsed: 119.244 s - in org.apache.hadoop.ozone.dn.volume.TestDatanodeHddsVolumeFailureDetection
[INFO] Running org.apache.hadoop.ozone.TestStorageContainerManager
[INFO] Tests run: 12, Failures: 0, Errors: 0, Skipped: 0, Time elapsed: 504.18 s - in org.apache.hadoop.ozone.TestStorageContainerManager
[INFO] Running org.apache.hadoop.ozone.fsck.TestContainerMapper
[INFO] Tests run: 1, Failures: 0, Errors: 0, Skipped: 0, Time elapsed: 59.495 s - in org.apache.hadoop.ozone.fsck.TestContainerMapper
[INFO] Running org.apache.hadoop.ozone.om.TestOzoneManagerConfiguration
[INFO] Tests run: 9, Failures: 0, Errors: 0, Skipped: 0, Time elapsed: 122.422 s - in org.apache.hadoop.ozone.om.TestOzoneManagerConfiguration
[INFO] Running org.apache.hadoop.ozone.om.TestOzoneManagerRocksDBLogging
[INFO] Tests run: 1, Failures: 0, Errors: 0, Skipped: 0, Time elapsed: 52.334 s - in org.apache.hadoop.ozone.om.TestOzoneManagerRocksDBLogging
[INFO] Running org.apache.hadoop.ozone.om.TestOzoneManagerHAWithData
[WARNING] Tests run: 7, Failures: 0, Errors: 0, Skipped: 1, Time elapsed: 157.925 s - in org.apache.hadoop.ozone.om.TestOzoneManagerHAWithData
[INFO] Running org.apache.hadoop.ozone.om.TestOmInit
[INFO] Tests run: 1, Failures: 0, Errors: 0, Skipped: 0, Time elapsed: 49.96 s - in org.apache.hadoop.ozone.om.TestOmInit
[INFO] Running org.apache.hadoop.ozone.om.TestOmBlockVersioning
[INFO] Tests run: 2, Failures: 0, Errors: 0, Skipped: 0, Time elapsed: 51.828 s - in org.apache.hadoop.ozone.om.TestOmBlockVersioning
[INFO] Running org.apache.hadoop.ozone.om.TestOzoneManagerRestInterface
[INFO] Tests run: 1, Failures: 0, Errors: 0, Skipped: 0, Time elapsed: 50.373 s - in org.apache.hadoop.ozone.om.TestOzoneManagerRestInterface
[INFO] Running org.apache.hadoop.ozone.om.TestOzoneManagerHAWithFailover
[INFO] Tests run: 1, Failures: 0, Errors: 0, Skipped: 0, Time elapsed: 88.779 s - in org.apache.hadoop.ozone.om.TestOzoneManagerHAWithFailover
[INFO] Running org.apache.hadoop.ozone.om.TestRecursiveAclWithFSO
[INFO] Tests run: 1, Failures: 0, Errors: 0, Skipped: 0, Time elapsed: 52.511 s - in org.apache.hadoop.ozone.om.TestRecursiveAclWithFSO
[INFO] Running org.apache.hadoop.ozone.om.TestBucketOwner
[INFO] Tests run: 3, Failures: 0, Errors: 0, Skipped: 0, Time elapsed: 52.079 s - in org.apache.hadoop.ozone.om.TestBucketOwner
[INFO] Running org.apache.hadoop.ozone.om.TestContainerReportWithKeys
[INFO] Tests run: 1, Failures: 0, Errors: 0, Skipped: 0, Time elapsed: 52.366 s - in org.apache.hadoop.ozone.om.TestContainerReportWithKeys
[INFO] Running org.apache.hadoop.ozone.om.TestOMEpochForNonRatis
[INFO] Tests run: 2, Failures: 0, Errors: 0, Skipped: 0, Time elapsed: 56.664 s - in org.apache.hadoop.ozone.om.TestOMEpochForNonRatis
[INFO] Running org.apache.hadoop.ozone.om.TestSecureOzoneManager
[INFO] Tests run: 2, Failures: 0, Errors: 0, Skipped: 0, Time elapsed: 3.128 s - in org.apache.hadoop.ozone.om.TestSecureOzoneManager
[INFO] Running org.apache.hadoop.ozone.om.TestKeyPurging
[INFO] Tests run: 1, Failures: 0, Errors: 0, Skipped: 0, Time elapsed: 53.566 s - in org.apache.hadoop.ozone.om.TestKeyPurging
[INFO] Running org.apache.hadoop.ozone.om.TestOmAcls
[INFO] Tests run: 2, Failures: 0, Errors: 0, Skipped: 0, Time elapsed: 60.886 s - in org.apache.hadoop.ozone.om.TestOmAcls
[INFO] Running org.apache.hadoop.ozone.om.TestOzoneManagerHAWithACL
[INFO] Tests run: 1, Failures: 0, Errors: 0, Skipped: 0, Time elapsed: 59.593 s - in org.apache.hadoop.ozone.om.TestOzoneManagerHAWithACL
[INFO] Running org.apache.hadoop.ozone.om.TestObjectStoreWithFSO
[INFO] Tests run: 8, Failures: 0, Errors: 0, Skipped: 0, Time elapsed: 56.16 s - in org.apache.hadoop.ozone.om.TestObjectStoreWithFSO
[INFO] Running org.apache.hadoop.ozone.om.TestOzoneManagerHAMetadataOnly
[WARNING] Tests run: 10, Failures: 0, Errors: 0, Skipped: 2, Time elapsed: 111.039 s - in org.apache.hadoop.ozone.om.TestOzoneManagerHAMetadataOnly
[INFO] Running org.apache.hadoop.ozone.om.TestOmLDBCli
[INFO] Tests run: 1, Failures: 0, Errors: 0, Skipped: 0, Time elapsed: 0.969 s - in org.apache.hadoop.ozone.om.TestOmLDBCli
[INFO] Running org.apache.hadoop.ozone.om.TestObjectStore
[INFO] Tests run: 4, Failures: 0, Errors: 0, Skipped: 0, Time elapsed: 51.736 s - in org.apache.hadoop.ozone.om.TestObjectStore
[INFO] Running org.apache.hadoop.ozone.om.TestOmMetrics
[INFO] Tests run: 5, Failures: 0, Errors: 0, Skipped: 0, Time elapsed: 162.862 s - in org.apache.hadoop.ozone.om.TestOmMetrics
[INFO] Running org.apache.hadoop.ozone.om.TestOMRatisSnapshots
[INFO] Tests run: 3, Failures: 0, Errors: 0, Skipped: 0, Time elapsed: 193.112 s - in org.apache.hadoop.ozone.om.TestOMRatisSnapshots
[INFO] Running org.apache.hadoop.ozone.om.TestKeyManagerImpl
[INFO] Tests run: 20, Failures: 0, Errors: 0, Skipped: 0, Time elapsed: 17.996 s - in org.apache.hadoop.ozone.om.TestKeyManagerImpl
[INFO] Running org.apache.hadoop.ozone.om.TestOmStartupSlvLessThanMlv
[INFO] Tests run: 1, Failures: 0, Errors: 0, Skipped: 0, Time elapsed: 11.019 s - in org.apache.hadoop.ozone.om.TestOmStartupSlvLessThanMlv
[INFO] Running org.apache.hadoop.ozone.om.TestOzoneManagerRestart
[INFO] Tests run: 3, Failures: 0, Errors: 0, Skipped: 0, Time elapsed: 77.209 s - in org.apache.hadoop.ozone.om.TestOzoneManagerRestart
[INFO] Running org.apache.hadoop.ozone.om.TestOzoneManagerListVolumes
[INFO] Tests run: 6, Failures: 0, Errors: 0, Skipped: 0, Time elapsed: 32.536 s - in org.apache.hadoop.ozone.om.TestOzoneManagerListVolumes
[INFO] Running org.apache.hadoop.ozone.om.ratis.TestOzoneManagerRatisRequest
[INFO] Tests run: 1, Failures: 0, Errors: 0, Skipped: 0, Time elapsed: 3.562 s - in org.apache.hadoop.ozone.om.ratis.TestOzoneManagerRatisRequest
[INFO] Running org.apache.hadoop.ozone.om.TestOMStartupWithBucketLayout
[INFO] Tests run: 2, Failures: 0, Errors: 0, Skipped: 0, Time elapsed: 43.437 s - in org.apache.hadoop.ozone.om.TestOMStartupWithBucketLayout
[INFO] Running org.apache.hadoop.ozone.om.TestScmSafeMode
[WARNING] Tests run: 1, Failures: 0, Errors: 0, Skipped: 1, Time elapsed: 0.002 s - in org.apache.hadoop.ozone.om.TestScmSafeMode
[INFO] Running org.apache.hadoop.ozone.om.TestAddRemoveOzoneManager
[INFO] Tests run: 4, Failures: 0, Errors: 0, Skipped: 0, Time elapsed: 260.573 s - in org.apache.hadoop.ozone.om.TestAddRemoveOzoneManager
[INFO] Running org.apache.hadoop.ozone.om.TestOzoneManagerHAKeyDeletion
[INFO] Tests run: 1, Failures: 0, Errors: 0, Skipped: 0, Time elapsed: 79.301 s - in org.apache.hadoop.ozone.om.TestOzoneManagerHAKeyDeletion
[INFO] Running org.apache.hadoop.ozone.om.TestOMUpgradeFinalization
[WARNING] Tests run: 2, Failures: 0, Errors: 0, Skipped: 2, Time elapsed: 0.102 s - in org.apache.hadoop.ozone.om.TestOMUpgradeFinalization
[INFO] Running org.apache.hadoop.ozone.om.snapshot.TestOzoneManagerSnapshotProvider
[INFO] Tests run: 1, Failures: 0, Errors: 0, Skipped: 0, Time elapsed: 52.643 s - in org.apache.hadoop.ozone.om.snapshot.TestOzoneManagerSnapshotProvider
[INFO] Running org.apache.hadoop.ozone.om.TestOzoneManagerPrepare
[ERROR] Tests run: 6, Failures: 0, Errors: 1, Skipped: 1, Time elapsed: 291.644 s <<< FAILURE! - in org.apache.hadoop.ozone.om.TestOzoneManagerPrepare
[ERROR] testPrepareWithMultipleThreads  Time elapsed: 126.122 s  <<< ERROR!
java.util.concurrent.TimeoutException: timeout: after 120000 millis
	at org.apache.ozone.test.LambdaTestUtils$GenerateTimeout.evaluate(LambdaTestUtils.java:677)
	at org.apache.ozone.test.LambdaTestUtils.await(LambdaTestUtils.java:154)
	at org.apache.ozone.test.LambdaTestUtils.await(LambdaTestUtils.java:192)
	at org.apache.hadoop.ozone.om.TestOzoneManagerPrepare.assertRatisLogsCleared(TestOzoneManagerPrepare.java:510)
	at org.apache.hadoop.ozone.om.TestOzoneManagerPrepare.assertRatisLogsCleared(TestOzoneManagerPrepare.java:504)
	at org.apache.hadoop.ozone.om.TestOzoneManagerPrepare.testPrepareWithMultipleThreads(TestOzoneManagerPrepare.java:263)
	at sun.reflect.NativeMethodAccessorImpl.invoke0(Native Method)
	at sun.reflect.NativeMethodAccessorImpl.invoke(NativeMethodAccessorImpl.java:62)
	at sun.reflect.DelegatingMethodAccessorImpl.invoke(DelegatingMethodAccessorImpl.java:43)
	at java.lang.reflect.Method.invoke(Method.java:498)
	at org.junit.runners.model.FrameworkMethod$1.runReflectiveCall(FrameworkMethod.java:59)
	at org.junit.internal.runners.model.ReflectiveCallable.run(ReflectiveCallable.java:12)
	at org.junit.runners.model.FrameworkMethod.invokeExplosively(FrameworkMethod.java:56)
	at org.junit.internal.runners.statements.InvokeMethod.evaluate(InvokeMethod.java:17)
	at org.junit.internal.runners.statements.RunBefores.evaluate(RunBefores.java:26)
	at org.junit.internal.runners.statements.RunAfters.evaluate(RunAfters.java:27)
	at org.junit.rules.ExpectedException$ExpectedExceptionStatement.evaluate(ExpectedException.java:258)
	at org.junit.internal.runners.statements.FailOnTimeout$CallableStatement.call(FailOnTimeout.java:288)
	at org.junit.internal.runners.statements.FailOnTimeout$CallableStatement.call(FailOnTimeout.java:282)
	at java.util.concurrent.FutureTask.run(FutureTask.java:266)
	at java.lang.Thread.run(Thread.java:748)

[INFO] Running org.apache.hadoop.ozone.om.TestOMDbCheckpointServlet
[INFO] Tests run: 3, Failures: 0, Errors: 0, Skipped: 0, Time elapsed: 63.684 s - in org.apache.hadoop.ozone.om.TestOMDbCheckpointServlet
[INFO] Running org.apache.hadoop.ozone.TestDelegationToken
[INFO] Tests run: 1, Failures: 0, Errors: 0, Skipped: 0, Time elapsed: 15.907 s - in org.apache.hadoop.ozone.TestDelegationToken
[INFO] Running org.apache.hadoop.ozone.scm.TestCloseContainer
[INFO] Tests run: 1, Failures: 0, Errors: 0, Skipped: 0, Time elapsed: 61.772 s - in org.apache.hadoop.ozone.scm.TestCloseContainer
[INFO] Running org.apache.hadoop.ozone.scm.node.TestDecommissionAndMaintenance
[INFO] Tests run: 8, Failures: 0, Errors: 0, Skipped: 0, Time elapsed: 356.351 s - in org.apache.hadoop.ozone.scm.node.TestDecommissionAndMaintenance
[INFO] Running org.apache.hadoop.ozone.scm.node.TestQueryNode
[WARNING] Tests run: 1, Failures: 0, Errors: 0, Skipped: 1, Time elapsed: 0.001 s - in org.apache.hadoop.ozone.scm.node.TestQueryNode
[INFO] Running org.apache.hadoop.ozone.scm.TestFailoverWithSCMHA
[INFO] Tests run: 2, Failures: 0, Errors: 0, Skipped: 0, Time elapsed: 134.396 s - in org.apache.hadoop.ozone.scm.TestFailoverWithSCMHA
[INFO] Running org.apache.hadoop.ozone.scm.TestContainerSmallFile
[INFO] Tests run: 4, Failures: 0, Errors: 0, Skipped: 0, Time elapsed: 50.969 s - in org.apache.hadoop.ozone.scm.TestContainerSmallFile
[INFO] Running org.apache.hadoop.ozone.scm.TestSCMMXBean
[INFO] Tests run: 2, Failures: 0, Errors: 0, Skipped: 0, Time elapsed: 50.876 s - in org.apache.hadoop.ozone.scm.TestSCMMXBean
[INFO] Running org.apache.hadoop.ozone.scm.TestSCMInstallSnapshotWithHA
[INFO] Tests run: 3, Failures: 0, Errors: 0, Skipped: 0, Time elapsed: 203.509 s - in org.apache.hadoop.ozone.scm.TestSCMInstallSnapshotWithHA
[INFO] Running org.apache.hadoop.ozone.scm.TestXceiverClientGrpc
[INFO] Tests run: 4, Failures: 0, Errors: 0, Skipped: 0, Time elapsed: 2.114 s - in org.apache.hadoop.ozone.scm.TestXceiverClientGrpc
[INFO] Running org.apache.hadoop.ozone.scm.pipeline.TestPipelineManagerMXBean
[INFO] Tests run: 1, Failures: 0, Errors: 0, Skipped: 0, Time elapsed: 61.059 s - in org.apache.hadoop.ozone.scm.pipeline.TestPipelineManagerMXBean
[INFO] Running org.apache.hadoop.ozone.scm.pipeline.TestSCMPipelineMetrics
[INFO] Tests run: 3, Failures: 0, Errors: 0, Skipped: 0, Time elapsed: 153.712 s - in org.apache.hadoop.ozone.scm.pipeline.TestSCMPipelineMetrics
[INFO] Running org.apache.hadoop.ozone.scm.pipeline.TestSCMPipelineBytesWrittenMetrics
[INFO] Tests run: 1, Failures: 0, Errors: 0, Skipped: 0, Time elapsed: 64.89 s - in org.apache.hadoop.ozone.scm.pipeline.TestSCMPipelineBytesWrittenMetrics
[INFO] Running org.apache.hadoop.ozone.scm.TestSCMContainerPlacementPolicyMetrics
[WARNING] Tests run: 1, Failures: 0, Errors: 0, Skipped: 1, Time elapsed: 0.002 s - in org.apache.hadoop.ozone.scm.TestSCMContainerPlacementPolicyMetrics
[INFO] Running org.apache.hadoop.ozone.scm.TestAllocateContainer
[INFO] Tests run: 2, Failures: 0, Errors: 0, Skipped: 0, Time elapsed: 50.464 s - in org.apache.hadoop.ozone.scm.TestAllocateContainer
[INFO] Running org.apache.hadoop.ozone.scm.TestXceiverClientManager
[INFO] Tests run: 4, Failures: 0, Errors: 0, Skipped: 0, Time elapsed: 55.715 s - in org.apache.hadoop.ozone.scm.TestXceiverClientManager
[INFO] Running org.apache.hadoop.ozone.scm.TestXceiverClientMetrics
[INFO] Tests run: 1, Failures: 0, Errors: 0, Skipped: 0, Time elapsed: 58.606 s - in org.apache.hadoop.ozone.scm.TestXceiverClientMetrics
[INFO] Running org.apache.hadoop.ozone.scm.TestSCMNodeManagerMXBean
[INFO] Tests run: 2, Failures: 0, Errors: 0, Skipped: 0, Time elapsed: 50.741 s - in org.apache.hadoop.ozone.scm.TestSCMNodeManagerMXBean
[INFO] Running org.apache.hadoop.ozone.scm.TestStorageContainerManagerHA
[INFO] Tests run: 3, Failures: 0, Errors: 0, Skipped: 0, Time elapsed: 191.499 s - in org.apache.hadoop.ozone.scm.TestStorageContainerManagerHA
[INFO] Running org.apache.hadoop.ozone.scm.TestGetCommittedBlockLengthAndPutKey
[INFO] Tests run: 3, Failures: 0, Errors: 0, Skipped: 0, Time elapsed: 51.86 s - in org.apache.hadoop.ozone.scm.TestGetCommittedBlockLengthAndPutKey
[INFO] Running org.apache.hadoop.ozone.recon.TestReconWithOzoneManagerHA
[INFO] Tests run: 1, Failures: 0, Errors: 0, Skipped: 0, Time elapsed: 44.824 s - in org.apache.hadoop.ozone.recon.TestReconWithOzoneManagerHA
[INFO] Running org.apache.hadoop.ozone.recon.TestReconScmSnapshot
[INFO] Tests run: 1, Failures: 0, Errors: 0, Skipped: 0, Time elapsed: 56.865 s - in org.apache.hadoop.ozone.recon.TestReconScmSnapshot
[INFO] Running org.apache.hadoop.ozone.recon.TestReconScmHASnapshot
[INFO] Tests run: 1, Failures: 0, Errors: 0, Skipped: 0, Time elapsed: 57.387 s - in org.apache.hadoop.ozone.recon.TestReconScmHASnapshot
[INFO] Running org.apache.hadoop.ozone.recon.TestReconWithOzoneManager
[INFO] Tests run: 1, Failures: 0, Errors: 0, Skipped: 0, Time elapsed: 39.22 s - in org.apache.hadoop.ozone.recon.TestReconWithOzoneManager
[INFO] Running org.apache.hadoop.ozone.recon.TestReconTasks
[INFO] Tests run: 1, Failures: 0, Errors: 0, Skipped: 0, Time elapsed: 100.661 s - in org.apache.hadoop.ozone.recon.TestReconTasks
[INFO] Running org.apache.hadoop.ozone.recon.TestReconWithOzoneManagerFSO
[INFO] Tests run: 1, Failures: 0, Errors: 0, Skipped: 0, Time elapsed: 55.291 s - in org.apache.hadoop.ozone.recon.TestReconWithOzoneManagerFSO
[INFO] Running org.apache.hadoop.ozone.recon.TestReconAsPassiveScm
[INFO] Tests run: 2, Failures: 0, Errors: 0, Skipped: 0, Time elapsed: 118.759 s - in org.apache.hadoop.ozone.recon.TestReconAsPassiveScm
[INFO] Running org.apache.hadoop.ozone.TestContainerStateMachineIdempotency
[INFO] Tests run: 1, Failures: 0, Errors: 0, Skipped: 0, Time elapsed: 51.993 s - in org.apache.hadoop.ozone.TestContainerStateMachineIdempotency
[INFO] Running org.apache.hadoop.ozone.TestOzoneConfigurationFields
[INFO] Tests run: 4, Failures: 0, Errors: 0, Skipped: 0, Time elapsed: 0.395 s - in org.apache.hadoop.ozone.TestOzoneConfigurationFields
[INFO] Running org.apache.hadoop.ozone.container.server.TestSecureContainerServer
[INFO] Tests run: 2, Failures: 0, Errors: 0, Skipped: 0, Time elapsed: 27.359 s - in org.apache.hadoop.ozone.container.server.TestSecureContainerServer
[INFO] Running org.apache.hadoop.ozone.container.server.TestContainerServer
[WARNING] Tests run: 1, Failures: 0, Errors: 0, Skipped: 1, Time elapsed: 0.002 s - in org.apache.hadoop.ozone.container.server.TestContainerServer
[INFO] Running org.apache.hadoop.ozone.container.TestContainerReplication
[INFO] Tests run: 3, Failures: 0, Errors: 0, Skipped: 0, Time elapsed: 194.1 s - in org.apache.hadoop.ozone.container.TestContainerReplication
[INFO] Running org.apache.hadoop.ozone.container.metrics.TestContainerMetrics
[INFO] Tests run: 1, Failures: 0, Errors: 0, Skipped: 0, Time elapsed: 9.983 s - in org.apache.hadoop.ozone.container.metrics.TestContainerMetrics
[INFO] Running org.apache.hadoop.ozone.container.ozoneimpl.TestOzoneContainerWithTLS
[WARNING] Tests run: 1, Failures: 0, Errors: 0, Skipped: 1, Time elapsed: 0.002 s - in org.apache.hadoop.ozone.container.ozoneimpl.TestOzoneContainerWithTLS
[INFO] Running org.apache.hadoop.ozone.container.ozoneimpl.TestOzoneContainer
[WARNING] Tests run: 1, Failures: 0, Errors: 0, Skipped: 1, Time elapsed: 0.003 s - in org.apache.hadoop.ozone.container.ozoneimpl.TestOzoneContainer
[INFO] Running org.apache.hadoop.ozone.container.ozoneimpl.TestSecureOzoneContainer
[INFO] Tests run: 5, Failures: 0, Errors: 0, Skipped: 0, Time elapsed: 18.25 s - in org.apache.hadoop.ozone.container.ozoneimpl.TestSecureOzoneContainer
[INFO] Running org.apache.hadoop.ozone.container.common.statemachine.commandhandler.TestDeleteContainerHandler
[INFO] Tests run: 2, Failures: 0, Errors: 0, Skipped: 0, Time elapsed: 58.971 s - in org.apache.hadoop.ozone.container.common.statemachine.commandhandler.TestDeleteContainerHandler
[INFO] Running org.apache.hadoop.ozone.container.common.statemachine.commandhandler.TestBlockDeletion
[INFO] Tests run: 3, Failures: 0, Errors: 0, Skipped: 0, Time elapsed: 198.432 s - in org.apache.hadoop.ozone.container.common.statemachine.commandhandler.TestBlockDeletion
[INFO] Running org.apache.hadoop.ozone.container.common.statemachine.commandhandler.TestCloseContainerHandler
[INFO] Tests run: 1, Failures: 0, Errors: 0, Skipped: 0, Time elapsed: 47.576 s - in org.apache.hadoop.ozone.container.common.statemachine.commandhandler.TestCloseContainerHandler
[INFO] Running org.apache.hadoop.ozone.container.common.statemachine.commandhandler.TestCloseContainerByPipeline
[WARNING] Tests run: 1, Failures: 0, Errors: 0, Skipped: 1, Time elapsed: 0.002 s - in org.apache.hadoop.ozone.container.common.statemachine.commandhandler.TestCloseContainerByPipeline
[INFO] Running org.apache.hadoop.ozone.container.common.transport.server.ratis.TestCSMMetrics
[INFO] Tests run: 1, Failures: 0, Errors: 0, Skipped: 0, Time elapsed: 14.602 s - in org.apache.hadoop.ozone.container.common.transport.server.ratis.TestCSMMetrics
[INFO] Running org.apache.hadoop.ozone.TestMiniOzoneOMHACluster
[INFO] Tests run: 1, Failures: 0, Errors: 0, Skipped: 0, Time elapsed: 61.152 s - in org.apache.hadoop.ozone.TestMiniOzoneOMHACluster
[INFO] Running org.apache.hadoop.ozone.TestContainerOperations
[INFO] Tests run: 2, Failures: 0, Errors: 0, Skipped: 0, Time elapsed: 51.679 s - in org.apache.hadoop.ozone.TestContainerOperations
[INFO] 
[INFO] Results:
[INFO] 
[ERROR] Errors: 
[ERROR]   TestOzoneManagerPrepare.testPrepareWithMultipleThreads:263->assertRatisLogsCleared:504->assertRatisLogsCleared:510 » Timeout
[INFO] 
[ERROR] Tests run: 271, Failures: 0, Errors: 1, Skipped: 16
[INFO] 
[INFO] 
[INFO] ------------------------------------------------------------------------
[INFO] Skipping Apache Ozone Mini Ozone Chaos Tests
[INFO] This project has been banned from the build due to previous failures.
[INFO] ------------------------------------------------------------------------
[INFO] ------------------------------------------------------------------------
[INFO] Reactor Summary for Apache Ozone Integration Tests 1.3.0-SNAPSHOT:
[INFO] 
[INFO] Apache Ozone Integration Tests ..................... FAILURE [  02:05 h]
[INFO] Apache Ozone Mini Ozone Chaos Tests ................ SKIPPED
[INFO] ------------------------------------------------------------------------
[INFO] BUILD FAILURE
[INFO] ------------------------------------------------------------------------
[INFO] Total time:  02:05 h
[INFO] Finished at: 2022-02-09T14:58:37Z
[INFO] ------------------------------------------------------------------------
[ERROR] Failed to execute goal org.apache.maven.plugins:maven-surefire-plugin:3.0.0-M1:test (default-test) on project ozone-integration-test: There are test failures.
[ERROR] 
[ERROR] Please refer to /home/runner/work/ozone/ozone/hadoop-ozone/integration-test/target/surefire-reports for the individual test results.
[ERROR] Please refer to dump files (if any exist) [date].dump, [date]-jvmRun[N].dump and [date].dumpstream.
[ERROR] -> [Help 1]
[ERROR] 
[ERROR] To see the full stack trace of the errors, re-run Maven with the -e switch.
[ERROR] Re-run Maven using the -X switch to enable full debug logging.
[ERROR] 
[ERROR] For more information about the errors and possible solutions, please read the following articles:
[ERROR] [Help 1] http://cwiki.apache.org/confluence/display/MAVEN/MojoFailureException
