[INFO] Scanning for projects...
[INFO] ------------------------------------------------------------------------
[INFO] Detecting the operating system and CPU architecture
[INFO] ------------------------------------------------------------------------
[INFO] os.detected.name: linux
[INFO] os.detected.arch: x86_64
[INFO] os.detected.version: 5.4
[INFO] os.detected.version.major: 5
[INFO] os.detected.version.minor: 4
[INFO] os.detected.release: ubuntu
[INFO] os.detected.release.version: 18.04
[INFO] os.detected.release.like.ubuntu: true
[INFO] os.detected.release.like.debian: true
[INFO] os.detected.classifier: linux-x86_64
[INFO] ------------------------------------------------------------------------
[INFO] Reactor Build Order:
[INFO] 
[INFO] Apache Ozone Integration Tests                                     [jar]
[INFO] Apache Ozone Mini Ozone Chaos Tests                                [jar]
[INFO] 
[INFO] --------------< org.apache.ozone:ozone-integration-test >---------------
[INFO] Building Apache Ozone Integration Tests 1.3.0-SNAPSHOT             [1/2]
[INFO] --------------------------------[ jar ]---------------------------------
[INFO] 
[INFO] --- maven-antrun-plugin:1.3:run (create-testdirs) @ ozone-integration-test ---
[INFO] Executing tasks
[INFO] Executed tasks
[INFO] 
[INFO] --- jacoco-maven-plugin:0.8.5:prepare-agent (default-prepare-agent) @ ozone-integration-test ---
[INFO] argLine set to -javaagent:/home/runner/.m2/repository/org/jacoco/org.jacoco.agent/0.8.5/org.jacoco.agent-0.8.5-runtime.jar=destfile=/home/runner/work/ozone/ozone/hadoop-ozone/integration-test/target/jacoco.exec,includes=org.apache.hadoop.hdds.*:org.apache.hadoop.ozone.*:org.apache.hadoop.fs.ozone.*
[INFO] 
[INFO] --- maven-remote-resources-plugin:1.5:process (default) @ ozone-integration-test ---
[INFO] 
[INFO] --- maven-resources-plugin:3.1.0:resources (default-resources) @ ozone-integration-test ---
[INFO] Using 'UTF-8' encoding to copy filtered resources.
[INFO] skip non existing resourceDirectory /home/runner/work/ozone/ozone/hadoop-ozone/integration-test/src/main/resources
[INFO] Copying 2 resources
[INFO] 
[INFO] --- maven-compiler-plugin:3.1:compile (default-compile) @ ozone-integration-test ---
[INFO] No sources to compile
[INFO] 
[INFO] --- maven-resources-plugin:3.1.0:testResources (default-testResources) @ ozone-integration-test ---
[INFO] Using 'UTF-8' encoding to copy filtered resources.
[INFO] Copying 21 resources
[INFO] Copying 2 resources
[INFO] 
[INFO] --- maven-compiler-plugin:3.1:testCompile (default-testCompile) @ ozone-integration-test ---
[INFO] Compiling 12 source files to /home/runner/work/ozone/ozone/hadoop-ozone/integration-test/target/test-classes
[INFO] 
[INFO] --- maven-surefire-plugin:3.0.0-M5:test (default-test) @ ozone-integration-test ---
[INFO] 
[INFO] -------------------------------------------------------
[INFO]  T E S T S
[INFO] -------------------------------------------------------
[INFO] Running org.apache.hadoop.ozone.TestContainerOperations
[INFO] Tests run: 3, Failures: 0, Errors: 0, Skipped: 0, Time elapsed: 43.092 s - in org.apache.hadoop.ozone.TestContainerOperations
[INFO] Running org.apache.hadoop.ozone.dn.scrubber.TestDataScrubber
[INFO] Tests run: 1, Failures: 0, Errors: 0, Skipped: 0, Time elapsed: 48.901 s - in org.apache.hadoop.ozone.dn.scrubber.TestDataScrubber
[INFO] Running org.apache.hadoop.ozone.dn.volume.TestDatanodeHddsVolumeFailureDetection
[INFO] Tests run: 3, Failures: 0, Errors: 0, Skipped: 0, Time elapsed: 93.374 s - in org.apache.hadoop.ozone.dn.volume.TestDatanodeHddsVolumeFailureDetection
[INFO] Running org.apache.hadoop.ozone.dn.volume.TestDatanodeHddsVolumeFailureToleration
[INFO] Tests run: 1, Failures: 0, Errors: 0, Skipped: 0, Time elapsed: 44.144 s - in org.apache.hadoop.ozone.dn.volume.TestDatanodeHddsVolumeFailureToleration
[INFO] Running org.apache.hadoop.ozone.dn.ratis.TestDnRatisLogParser
[INFO] Tests run: 1, Failures: 0, Errors: 0, Skipped: 0, Time elapsed: 26.238 s - in org.apache.hadoop.ozone.dn.ratis.TestDnRatisLogParser
[INFO] Running org.apache.hadoop.ozone.TestMiniOzoneCluster
[INFO] Tests run: 4, Failures: 0, Errors: 0, Skipped: 0, Time elapsed: 89.881 s - in org.apache.hadoop.ozone.TestMiniOzoneCluster
[INFO] Running org.apache.hadoop.ozone.recon.TestReconAsPassiveScm
[INFO] Tests run: 2, Failures: 0, Errors: 0, Skipped: 0, Time elapsed: 99.89 s - in org.apache.hadoop.ozone.recon.TestReconAsPassiveScm
[INFO] Running org.apache.hadoop.ozone.recon.TestReconTasks
[INFO] Tests run: 1, Failures: 0, Errors: 0, Skipped: 0, Time elapsed: 70.201 s - in org.apache.hadoop.ozone.recon.TestReconTasks
[INFO] Running org.apache.hadoop.ozone.recon.TestReconScmHASnapshot
[INFO] Tests run: 1, Failures: 0, Errors: 0, Skipped: 0, Time elapsed: 57.73 s - in org.apache.hadoop.ozone.recon.TestReconScmHASnapshot
[INFO] Running org.apache.hadoop.ozone.recon.TestReconWithOzoneManagerHA
[INFO] Tests run: 1, Failures: 0, Errors: 0, Skipped: 0, Time elapsed: 46.844 s - in org.apache.hadoop.ozone.recon.TestReconWithOzoneManagerHA
[INFO] Running org.apache.hadoop.ozone.recon.TestReconWithOzoneManager
[INFO] Tests run: 1, Failures: 0, Errors: 0, Skipped: 0, Time elapsed: 33.85 s - in org.apache.hadoop.ozone.recon.TestReconWithOzoneManager
[INFO] Running org.apache.hadoop.ozone.recon.TestReconWithOzoneManagerFSO
[INFO] Tests run: 1, Failures: 0, Errors: 0, Skipped: 0, Time elapsed: 45.08 s - in org.apache.hadoop.ozone.recon.TestReconWithOzoneManagerFSO
[INFO] Running org.apache.hadoop.ozone.recon.TestReconScmSnapshot
[INFO] Tests run: 1, Failures: 0, Errors: 0, Skipped: 0, Time elapsed: 48.031 s - in org.apache.hadoop.ozone.recon.TestReconScmSnapshot
[INFO] Running org.apache.hadoop.ozone.TestMiniOzoneOMHACluster
[INFO] Tests run: 1, Failures: 0, Errors: 0, Skipped: 0, Time elapsed: 49.942 s - in org.apache.hadoop.ozone.TestMiniOzoneOMHACluster
[INFO] Running org.apache.hadoop.ozone.TestOzoneConfigurationFields
[INFO] Tests run: 4, Failures: 0, Errors: 0, Skipped: 0, Time elapsed: 0.445 s - in org.apache.hadoop.ozone.TestOzoneConfigurationFields
[INFO] Running org.apache.hadoop.ozone.TestDelegationToken
[INFO] Tests run: 1, Failures: 0, Errors: 0, Skipped: 0, Time elapsed: 17.695 s - in org.apache.hadoop.ozone.TestDelegationToken
[INFO] Running org.apache.hadoop.ozone.TestContainerStateMachineIdempotency
[INFO] Tests run: 1, Failures: 0, Errors: 0, Skipped: 0, Time elapsed: 48.606 s - in org.apache.hadoop.ozone.TestContainerStateMachineIdempotency
[INFO] Running org.apache.hadoop.ozone.TestSecureOzoneCluster
[INFO] Tests run: 11, Failures: 0, Errors: 0, Skipped: 0, Time elapsed: 69.213 s - in org.apache.hadoop.ozone.TestSecureOzoneCluster
[INFO] Running org.apache.hadoop.ozone.container.server.TestSecureContainerServer
[INFO] Tests run: 2, Failures: 0, Errors: 0, Skipped: 0, Time elapsed: 29.284 s - in org.apache.hadoop.ozone.container.server.TestSecureContainerServer
[INFO] Running org.apache.hadoop.ozone.container.ozoneimpl.TestOzoneContainer
[INFO] Tests run: 7, Failures: 0, Errors: 0, Skipped: 0, Time elapsed: 128.61 s - in org.apache.hadoop.ozone.container.ozoneimpl.TestOzoneContainer
[INFO] Running org.apache.hadoop.ozone.container.ozoneimpl.TestSecureOzoneContainer
[INFO] Tests run: 5, Failures: 0, Errors: 0, Skipped: 0, Time elapsed: 18.482 s - in org.apache.hadoop.ozone.container.ozoneimpl.TestSecureOzoneContainer
[INFO] Running org.apache.hadoop.ozone.container.common.statemachine.commandhandler.TestCloseContainerHandler
[INFO] Tests run: 1, Failures: 0, Errors: 0, Skipped: 0, Time elapsed: 42.393 s - in org.apache.hadoop.ozone.container.common.statemachine.commandhandler.TestCloseContainerHandler
[INFO] Running org.apache.hadoop.ozone.container.common.statemachine.commandhandler.TestDeleteContainerHandler
[INFO] Tests run: 2, Failures: 0, Errors: 0, Skipped: 0, Time elapsed: 53.279 s - in org.apache.hadoop.ozone.container.common.statemachine.commandhandler.TestDeleteContainerHandler
[INFO] Running org.apache.hadoop.ozone.container.common.statemachine.commandhandler.TestRefreshVolumeUsageHandler
[INFO] Tests run: 1, Failures: 0, Errors: 0, Skipped: 0, Time elapsed: 39.022 s - in org.apache.hadoop.ozone.container.common.statemachine.commandhandler.TestRefreshVolumeUsageHandler
[INFO] Running org.apache.hadoop.ozone.container.common.statemachine.commandhandler.TestBlockDeletion
[INFO] Tests run: 3, Failures: 0, Errors: 0, Skipped: 0, Time elapsed: 249.19 s - in org.apache.hadoop.ozone.container.common.statemachine.commandhandler.TestBlockDeletion
[INFO] Running org.apache.hadoop.ozone.container.common.transport.server.ratis.TestCSMMetrics
[INFO] Tests run: 1, Failures: 0, Errors: 0, Skipped: 0, Time elapsed: 14.297 s - in org.apache.hadoop.ozone.container.common.transport.server.ratis.TestCSMMetrics
[INFO] Running org.apache.hadoop.ozone.container.metrics.TestContainerMetrics
[INFO] Tests run: 1, Failures: 0, Errors: 0, Skipped: 0, Time elapsed: 9.79 s - in org.apache.hadoop.ozone.container.metrics.TestContainerMetrics
[INFO] Running org.apache.hadoop.ozone.container.TestECContainerRecovery
[INFO] Tests run: 1, Failures: 0, Errors: 0, Skipped: 0, Time elapsed: 145.794 s - in org.apache.hadoop.ozone.container.TestECContainerRecovery
[INFO] Running org.apache.hadoop.ozone.container.TestContainerReplication
[INFO] Tests run: 3, Failures: 0, Errors: 0, Skipped: 0, Time elapsed: 203.991 s - in org.apache.hadoop.ozone.container.TestContainerReplication
[INFO] Running org.apache.hadoop.ozone.fsck.TestContainerMapper
[INFO] Tests run: 1, Failures: 0, Errors: 0, Skipped: 0, Time elapsed: 57.065 s - in org.apache.hadoop.ozone.fsck.TestContainerMapper
[INFO] Running org.apache.hadoop.ozone.freon.TestFreonWithPipelineDestroy
[INFO] Tests run: 1, Failures: 0, Errors: 0, Skipped: 0, Time elapsed: 57.4 s - in org.apache.hadoop.ozone.freon.TestFreonWithPipelineDestroy
[INFO] Running org.apache.hadoop.ozone.freon.TestDataValidateWithDummyContainers
[INFO] Tests run: 2, Failures: 0, Errors: 0, Skipped: 0, Time elapsed: 63.467 s - in org.apache.hadoop.ozone.freon.TestDataValidateWithDummyContainers
[INFO] Running org.apache.hadoop.ozone.freon.TestDataValidateWithSafeByteOperations
[INFO] Tests run: 2, Failures: 0, Errors: 0, Skipped: 0, Time elapsed: 69.289 s - in org.apache.hadoop.ozone.freon.TestDataValidateWithSafeByteOperations
[INFO] Running org.apache.hadoop.ozone.freon.TestDataValidateWithUnsafeByteOperations
[INFO] Tests run: 2, Failures: 0, Errors: 0, Skipped: 0, Time elapsed: 84.857 s - in org.apache.hadoop.ozone.freon.TestDataValidateWithUnsafeByteOperations
[INFO] Running org.apache.hadoop.ozone.freon.TestFreonWithDatanodeFastRestart
[WARNING] Tests run: 1, Failures: 0, Errors: 0, Skipped: 1, Time elapsed: 0.015 s - in org.apache.hadoop.ozone.freon.TestFreonWithDatanodeFastRestart
[INFO] Running org.apache.hadoop.ozone.freon.TestHadoopNestedDirGenerator
[INFO] Tests run: 1, Failures: 0, Errors: 0, Skipped: 0, Time elapsed: 69.922 s - in org.apache.hadoop.ozone.freon.TestHadoopNestedDirGenerator
[INFO] Running org.apache.hadoop.ozone.freon.TestOmBucketReadWriteKeyOps
[INFO] Tests run: 1, Failures: 0, Errors: 0, Skipped: 0, Time elapsed: 72.529 s - in org.apache.hadoop.ozone.freon.TestOmBucketReadWriteKeyOps
[INFO] Running org.apache.hadoop.ozone.freon.TestRandomKeyGenerator
[INFO] Tests run: 7, Failures: 0, Errors: 0, Skipped: 0, Time elapsed: 174.491 s - in org.apache.hadoop.ozone.freon.TestRandomKeyGenerator
[INFO] Running org.apache.hadoop.ozone.freon.TestOmBucketReadWriteFileOps
[INFO] Tests run: 1, Failures: 0, Errors: 0, Skipped: 0, Time elapsed: 73.253 s - in org.apache.hadoop.ozone.freon.TestOmBucketReadWriteFileOps
[INFO] Running org.apache.hadoop.ozone.freon.TestHadoopDirTreeGeneratorWithFSO
[INFO] Tests run: 1, Failures: 0, Errors: 0, Skipped: 0, Time elapsed: 79.268 s - in org.apache.hadoop.ozone.freon.TestHadoopDirTreeGeneratorWithFSO
[INFO] Running org.apache.hadoop.ozone.freon.TestHadoopDirTreeGenerator
[INFO] Tests run: 1, Failures: 0, Errors: 0, Skipped: 0, Time elapsed: 84.076 s - in org.apache.hadoop.ozone.freon.TestHadoopDirTreeGenerator
[INFO] Running org.apache.hadoop.ozone.parser.TestOzoneHARatisLogParser
[ERROR] Tests run: 1, Failures: 0, Errors: 1, Skipped: 0, Time elapsed: 74.961 s <<< FAILURE! - in org.apache.hadoop.ozone.parser.TestOzoneHARatisLogParser
[ERROR] org.apache.hadoop.ozone.parser.TestOzoneHARatisLogParser.testRatisLogParsing  Time elapsed: 74.888 s  <<< ERROR!
java.util.concurrent.TimeoutException: 
Timed out waiting for condition. Thread diagnostics:
Timestamp: 2022-07-21 06:25:23,525

"Datanode ReportManager Thread - 3" daemon prio=5 tid=870 in Object.wait()
java.lang.Thread.State: WAITING (on object monitor)
        at sun.misc.Unsafe.park(Native Method)
        at java.util.concurrent.locks.LockSupport.park(LockSupport.java:175)
        at java.util.concurrent.locks.AbstractQueuedSynchronizer$ConditionObject.await(AbstractQueuedSynchronizer.java:2039)
        at java.util.concurrent.ScheduledThreadPoolExecutor$DelayedWorkQueue.take(ScheduledThreadPoolExecutor.java:1088)
        at java.util.concurrent.ScheduledThreadPoolExecutor$DelayedWorkQueue.take(ScheduledThreadPoolExecutor.java:809)
        at java.util.concurrent.ThreadPoolExecutor.getTask(ThreadPoolExecutor.java:1074)
        at java.util.concurrent.ThreadPoolExecutor.runWorker(ThreadPoolExecutor.java:1134)
        at java.util.concurrent.ThreadPoolExecutor$Worker.run(ThreadPoolExecutor.java:624)
        at java.lang.Thread.run(Thread.java:750)
"ExpiredContainerReplicaOpScrubberThread" daemon prio=5 tid=385 timed_waiting
java.lang.Thread.State: TIMED_WAITING
        at java.lang.Object.wait(Native Method)
        at org.apache.hadoop.hdds.scm.ha.BackgroundSCMService.run(BackgroundSCMService.java:105)
        at org.apache.hadoop.hdds.scm.ha.BackgroundSCMService$$Lambda$668/1691551744.run(Unknown Source)
        at java.lang.Thread.run(Thread.java:750)
"Datanode ReportManager Thread - 0" daemon prio=5 tid=841 timed_waiting
java.lang.Thread.State: TIMED_WAITING
        at sun.misc.Unsafe.park(Native Method)
        at java.util.concurrent.locks.LockSupport.parkNanos(LockSupport.java:215)
        at java.util.concurrent.locks.AbstractQueuedSynchronizer$ConditionObject.awaitNanos(AbstractQueuedSynchronizer.java:2078)
        at java.util.concurrent.ScheduledThreadPoolExecutor$DelayedWorkQueue.take(ScheduledThreadPoolExecutor.java:1093)
        at java.util.concurrent.ScheduledThreadPoolExecutor$DelayedWorkQueue.take(ScheduledThreadPoolExecutor.java:809)
        at java.util.concurrent.ThreadPoolExecutor.getTask(ThreadPoolExecutor.java:1074)
        at java.util.concurrent.ThreadPoolExecutor.runWorker(ThreadPoolExecutor.java:1134)
        at java.util.concurrent.ThreadPoolExecutor$Worker.run(ThreadPoolExecutor.java:624)
        at java.lang.Thread.run(Thread.java:750)
"process reaper" daemon prio=10 tid=13 timed_waiting
java.lang.Thread.State: TIMED_WAITING
        at sun.misc.Unsafe.park(Native Method)
        at java.util.concurrent.locks.LockSupport.parkNanos(LockSupport.java:215)
        at java.util.concurrent.SynchronousQueue$TransferStack.awaitFulfill(SynchronousQueue.java:460)
        at java.util.concurrent.SynchronousQueue$TransferStack.transfer(SynchronousQueue.java:362)
        at java.util.concurrent.SynchronousQueue.poll(SynchronousQueue.java:941)
        at java.util.concurrent.ThreadPoolExecutor.getTask(ThreadPoolExecutor.java:1073)
        at java.util.concurrent.ThreadPoolExecutor.runWorker(ThreadPoolExecutor.java:1134)
        at java.util.concurrent.ThreadPoolExecutor$Worker.run(ThreadPoolExecutor.java:624)
        at java.lang.Thread.run(Thread.java:750)
"EndpointStateMachine task thread for /127.0.0.1:40299 - 0 "  prio=5 tid=922 blocked
java.lang.Thread.State: BLOCKED
        at org.apache.hadoop.ipc.Client$Connection.addCall(Client.java:522)
        at org.apache.hadoop.ipc.Client$Connection.access$3700(Client.java:414)
        at org.apache.hadoop.ipc.Client.getConnection(Client.java:1634)
        at org.apache.hadoop.ipc.Client.call(Client.java:1463)
        at org.apache.hadoop.ipc.Client.call(Client.java:1416)
        at org.apache.hadoop.ipc.ProtobufRpcEngine$Invoker.invoke(ProtobufRpcEngine.java:236)
        at org.apache.hadoop.ipc.ProtobufRpcEngine$Invoker.invoke(ProtobufRpcEngine.java:123)
        at com.sun.proxy.$Proxy51.submitRequest(Unknown Source)
        at org.apache.hadoop.ozone.protocolPB.StorageContainerDatanodeProtocolClientSideTranslatorPB.submitRequest(StorageContainerDatanodeProtocolClientSideTranslatorPB.java:117)
        at org.apache.hadoop.ozone.protocolPB.StorageContainerDatanodeProtocolClientSideTranslatorPB.sendHeartbeat(StorageContainerDatanodeProtocolClientSideTranslatorPB.java:149)
        at org.apache.hadoop.ozone.container.common.states.endpoint.HeartbeatEndpointTask.call(HeartbeatEndpointTask.java:185)
        at org.apache.hadoop.ozone.container.common.states.endpoint.HeartbeatEndpointTask.call(HeartbeatEndpointTask.java:87)
        at java.util.concurrent.FutureTask.run(FutureTask.java:266)
        at java.util.concurrent.ThreadPoolExecutor.runWorker(ThreadPoolExecutor.java:1149)
        at java.util.concurrent.ThreadPoolExecutor$Worker.run(ThreadPoolExecutor.java:624)
        at java.lang.Thread.run(Thread.java:750)
"Datanode ReportManager Thread - 1" daemon prio=5 tid=842 in Object.wait()
java.lang.Thread.State: WAITING (on object monitor)
        at sun.misc.Unsafe.park(Native Method)
        at java.util.concurrent.locks.LockSupport.park(LockSupport.java:175)
        at java.util.concurrent.locks.AbstractQueuedSynchronizer$ConditionObject.await(AbstractQueuedSynchronizer.java:2039)
        at java.util.concurrent.ScheduledThreadPoolExecutor$DelayedWorkQueue.take(ScheduledThreadPoolExecutor.java:1088)
        at java.util.concurrent.ScheduledThreadPoolExecutor$DelayedWorkQueue.take(ScheduledThreadPoolExecutor.java:809)
        at java.util.concurrent.ThreadPoolExecutor.getTask(ThreadPoolExecutor.java:1074)
        at java.util.concurrent.ThreadPoolExecutor.runWorker(ThreadPoolExecutor.java:1134)
        at java.util.concurrent.ThreadPoolExecutor$Worker.run(ThreadPoolExecutor.java:624)
        at java.lang.Thread.run(Thread.java:750)
"Datanode ReportManager Thread - 0" daemon prio=5 tid=809 timed_waiting
java.lang.Thread.State: TIMED_WAITING
        at sun.misc.Unsafe.park(Native Method)
        at java.util.concurrent.locks.LockSupport.parkNanos(LockSupport.java:215)
        at java.util.concurrent.locks.AbstractQueuedSynchronizer$ConditionObject.awaitNanos(AbstractQueuedSynchronizer.java:2078)
        at java.util.concurrent.ScheduledThreadPoolExecutor$DelayedWorkQueue.take(ScheduledThreadPoolExecutor.java:1093)
        at java.util.concurrent.ScheduledThreadPoolExecutor$DelayedWorkQueue.take(ScheduledThreadPoolExecutor.java:809)
        at java.util.concurrent.ThreadPoolExecutor.getTask(ThreadPoolExecutor.java:1074)
        at java.util.concurrent.ThreadPoolExecutor.runWorker(ThreadPoolExecutor.java:1134)
        at java.util.concurrent.ThreadPoolExecutor$Worker.run(ThreadPoolExecutor.java:624)
        at java.lang.Thread.run(Thread.java:750)
"EndpointStateMachine task thread for /127.0.0.1:40299 - 0 "  prio=5 tid=940 blocked
java.lang.Thread.State: BLOCKED
        at org.apache.hadoop.ipc.Client$Connection.addCall(Client.java:522)
        at org.apache.hadoop.ipc.Client$Connection.access$3700(Client.java:414)
        at org.apache.hadoop.ipc.Client.getConnection(Client.java:1634)
        at org.apache.hadoop.ipc.Client.call(Client.java:1463)
        at org.apache.hadoop.ipc.Client.call(Client.java:1416)
        at org.apache.hadoop.ipc.ProtobufRpcEngine$Invoker.invoke(ProtobufRpcEngine.java:236)
        at org.apache.hadoop.ipc.ProtobufRpcEngine$Invoker.invoke(ProtobufRpcEngine.java:123)
        at com.sun.proxy.$Proxy51.submitRequest(Unknown Source)
        at org.apache.hadoop.ozone.protocolPB.StorageContainerDatanodeProtocolClientSideTranslatorPB.submitRequest(StorageContainerDatanodeProtocolClientSideTranslatorPB.java:117)
        at org.apache.hadoop.ozone.protocolPB.StorageContainerDatanodeProtocolClientSideTranslatorPB.sendHeartbeat(StorageContainerDatanodeProtocolClientSideTranslatorPB.java:149)
        at org.apache.hadoop.ozone.container.common.states.endpoint.HeartbeatEndpointTask.call(HeartbeatEndpointTask.java:185)
        at org.apache.hadoop.ozone.container.common.states.endpoint.HeartbeatEndpointTask.call(HeartbeatEndpointTask.java:87)
        at java.util.concurrent.FutureTask.run(FutureTask.java:266)
        at java.util.concurrent.ThreadPoolExecutor.runWorker(ThreadPoolExecutor.java:1149)
        at java.util.concurrent.ThreadPoolExecutor$Worker.run(ThreadPoolExecutor.java:624)
        at java.lang.Thread.run(Thread.java:750)
"org.apache.hadoop.ozone.container.common.statemachine.commandhandler.DeleteBlocksCommandHandler$DeleteCmdWorker@1e267249" daemon prio=5 tid=829 runnable
java.lang.Thread.State: RUNNABLE
        at java.lang.Thread.sleep(Native Method)
        at org.apache.hadoop.ozone.container.common.statemachine.commandhandler.DeleteBlocksCommandHandler$DeleteCmdWorker.run(DeleteBlocksCommandHandler.java:185)
        at java.lang.Thread.run(Thread.java:750)
"Datanode ReportManager Thread - 3" daemon prio=5 tid=844 in Object.wait()
java.lang.Thread.State: WAITING (on object monitor)
        at sun.misc.Unsafe.park(Native Method)
        at java.util.concurrent.locks.LockSupport.park(LockSupport.java:175)
        at java.util.concurrent.locks.AbstractQueuedSynchronizer$ConditionObject.await(AbstractQueuedSynchronizer.java:2039)
        at java.util.concurrent.ScheduledThreadPoolExecutor$DelayedWorkQueue.take(ScheduledThreadPoolExecutor.java:1088)
        at java.util.concurrent.ScheduledThreadPoolExecutor$DelayedWorkQueue.take(ScheduledThreadPoolExecutor.java:809)
        at java.util.concurrent.ThreadPoolExecutor.getTask(ThreadPoolExecutor.java:1074)
        at java.util.concurrent.ThreadPoolExecutor.runWorker(ThreadPoolExecutor.java:1134)
        at java.util.concurrent.ThreadPoolExecutor$Worker.run(ThreadPoolExecutor.java:624)
        at java.lang.Thread.run(Thread.java:750)
"IPC Parameter Sending Thread #0" daemon prio=5 tid=273 timed_waiting
java.lang.Thread.State: TIMED_WAITING
        at sun.misc.Unsafe.park(Native Method)
        at java.util.concurrent.locks.LockSupport.parkNanos(LockSupport.java:215)
        at java.util.concurrent.SynchronousQueue$TransferStack.awaitFulfill(SynchronousQueue.java:460)
        at java.util.concurrent.SynchronousQueue$TransferStack.transfer(SynchronousQueue.java:362)
        at java.util.concurrent.SynchronousQueue.poll(SynchronousQueue.java:941)
        at java.util.concurrent.ThreadPoolExecutor.getTask(ThreadPoolExecutor.java:1073)
        at java.util.concurrent.ThreadPoolExecutor.runWorker(ThreadPoolExecutor.java:1134)
        at java.util.concurrent.ThreadPoolExecutor$Worker.run(ThreadPoolExecutor.java:624)
        at java.lang.Thread.run(Thread.java:750)
"Datanode ReportManager Thread - 2" daemon prio=5 tid=843 in Object.wait()
java.lang.Thread.State: WAITING (on object monitor)
        at sun.misc.Unsafe.park(Native Method)
        at java.util.concurrent.locks.LockSupport.park(LockSupport.java:175)
        at java.util.concurrent.locks.AbstractQueuedSynchronizer$ConditionObject.await(AbstractQueuedSynchronizer.java:2039)
        at java.util.concurrent.ScheduledThreadPoolExecutor$DelayedWorkQueue.take(ScheduledThreadPoolExecutor.java:1088)
        at java.util.concurrent.ScheduledThreadPoolExecutor$DelayedWorkQueue.take(ScheduledThreadPoolExecutor.java:809)
        at java.util.concurrent.ThreadPoolExecutor.getTask(ThreadPoolExecutor.java:1074)
        at java.util.concurrent.ThreadPoolExecutor.runWorker(ThreadPoolExecutor.java:1134)
        at java.util.concurrent.ThreadPoolExecutor$Worker.run(ThreadPoolExecutor.java:624)
        at java.lang.Thread.run(Thread.java:750)
"Datanode ReportManager Thread - 2" daemon prio=5 tid=811 in Object.wait()
java.lang.Thread.State: WAITING (on object monitor)
        at sun.misc.Unsafe.park(Native Method)
        at java.util.concurrent.locks.LockSupport.park(LockSupport.java:175)
        at java.util.concurrent.locks.AbstractQueuedSynchronizer$ConditionObject.await(AbstractQueuedSynchronizer.java:2039)
        at java.util.concurrent.ScheduledThreadPoolExecutor$DelayedWorkQueue.take(ScheduledThreadPoolExecutor.java:1088)
        at java.util.concurrent.ScheduledThreadPoolExecutor$DelayedWorkQueue.take(ScheduledThreadPoolExecutor.java:809)
        at java.util.concurrent.ThreadPoolExecutor.getTask(ThreadPoolExecutor.java:1074)
        at java.util.concurrent.ThreadPoolExecutor.runWorker(ThreadPoolExecutor.java:1134)
        at java.util.concurrent.ThreadPoolExecutor$Worker.run(ThreadPoolExecutor.java:624)
        at java.lang.Thread.run(Thread.java:750)
"SSL Certificates Store Monitor" daemon prio=5 tid=609 in Object.wait()
java.lang.Thread.State: WAITING (on object monitor)
        at java.lang.Object.wait(Native Method)
        at java.lang.Object.wait(Object.java:502)
        at java.util.TimerThread.mainLoop(Timer.java:526)
        at java.util.TimerThread.run(Timer.java:505)
"EndpointStateMachine task thread for /127.0.0.1:44825 - 0 "  prio=5 tid=921 blocked
java.lang.Thread.State: BLOCKED
        at org.apache.hadoop.ipc.Client$Connection.addCall(Client.java:522)
        at org.apache.hadoop.ipc.Client$Connection.access$3700(Client.java:414)
        at org.apache.hadoop.ipc.Client.getConnection(Client.java:1634)
        at org.apache.hadoop.ipc.Client.call(Client.java:1463)
        at org.apache.hadoop.ipc.Client.call(Client.java:1416)
        at org.apache.hadoop.ipc.ProtobufRpcEngine$Invoker.invoke(ProtobufRpcEngine.java:236)
        at org.apache.hadoop.ipc.ProtobufRpcEngine$Invoker.invoke(ProtobufRpcEngine.java:123)
        at com.sun.proxy.$Proxy51.submitRequest(Unknown Source)
        at org.apache.hadoop.ozone.protocolPB.StorageContainerDatanodeProtocolClientSideTranslatorPB.submitRequest(StorageContainerDatanodeProtocolClientSideTranslatorPB.java:117)
        at org.apache.hadoop.ozone.protocolPB.StorageContainerDatanodeProtocolClientSideTranslatorPB.sendHeartbeat(StorageContainerDatanodeProtocolClientSideTranslatorPB.java:149)
        at org.apache.hadoop.ozone.container.common.states.endpoint.HeartbeatEndpointTask.call(HeartbeatEndpointTask.java:185)
        at org.apache.hadoop.ozone.container.common.states.endpoint.HeartbeatEndpointTask.call(HeartbeatEndpointTask.java:87)
        at java.util.concurrent.FutureTask.run(FutureTask.java:266)
        at java.util.concurrent.ThreadPoolExecutor.runWorker(ThreadPoolExecutor.java:1149)
        at java.util.concurrent.ThreadPoolExecutor$Worker.run(ThreadPoolExecutor.java:624)
        at java.lang.Thread.run(Thread.java:750)
"SSL Certificates Store Monitor" daemon prio=5 tid=722 in Object.wait()
java.lang.Thread.State: WAITING (on object monitor)
        at java.lang.Object.wait(Native Method)
        at java.lang.Object.wait(Object.java:502)
        at java.util.TimerThread.mainLoop(Timer.java:526)
        at java.util.TimerThread.run(Timer.java:505)
"Signal Dispatcher" daemon prio=9 tid=4 runnable
java.lang.Thread.State: RUNNABLE
"Reference Handler" daemon prio=10 tid=2 in Object.wait()
java.lang.Thread.State: WAITING (on object monitor)
        at java.lang.Object.wait(Native Method)
        at java.lang.Object.wait(Object.java:502)
        at java.lang.ref.Reference.tryHandlePending(Reference.java:191)
        at java.lang.ref.Reference$ReferenceHandler.run(Reference.java:153)
"FullTableCache Cleanup Thread - 0" daemon prio=5 tid=1142 in Object.wait()
java.lang.Thread.State: WAITING (on object monitor)
        at sun.misc.Unsafe.park(Native Method)
        at java.util.concurrent.locks.LockSupport.park(LockSupport.java:175)
        at java.util.concurrent.locks.AbstractQueuedSynchronizer$ConditionObject.await(AbstractQueuedSynchronizer.java:2039)
        at java.util.concurrent.LinkedBlockingQueue.take(LinkedBlockingQueue.java:442)
        at java.util.concurrent.ThreadPoolExecutor.getTask(ThreadPoolExecutor.java:1074)
        at java.util.concurrent.ThreadPoolExecutor.runWorker(ThreadPoolExecutor.java:1134)
        at java.util.concurrent.ThreadPoolExecutor$Worker.run(ThreadPoolExecutor.java:624)
        at java.lang.Thread.run(Thread.java:750)
"EndpointStateMachine task thread for /127.0.0.1:40299 - 0 "  prio=5 tid=897 timed_waiting
java.lang.Thread.State: TIMED_WAITING
        at java.lang.Thread.sleep(Native Method)
        at org.apache.hadoop.ipc.Client$Connection.handleConnectionFailure(Client.java:972)
        at org.apache.hadoop.ipc.Client$Connection.setupConnection(Client.java:724)
        at org.apache.hadoop.ipc.Client$Connection.setupIOstreams(Client.java:822)
        at org.apache.hadoop.ipc.Client$Connection.access$3800(Client.java:414)
        at org.apache.hadoop.ipc.Client.getConnection(Client.java:1647)
        at org.apache.hadoop.ipc.Client.call(Client.java:1463)
        at org.apache.hadoop.ipc.Client.call(Client.java:1416)
        at org.apache.hadoop.ipc.ProtobufRpcEngine$Invoker.invoke(ProtobufRpcEngine.java:236)
        at org.apache.hadoop.ipc.ProtobufRpcEngine$Invoker.invoke(ProtobufRpcEngine.java:123)
        at com.sun.proxy.$Proxy51.submitRequest(Unknown Source)
        at org.apache.hadoop.ozone.protocolPB.StorageContainerDatanodeProtocolClientSideTranslatorPB.submitRequest(StorageContainerDatanodeProtocolClientSideTranslatorPB.java:117)
        at org.apache.hadoop.ozone.protocolPB.StorageContainerDatanodeProtocolClientSideTranslatorPB.sendHeartbeat(StorageContainerDatanodeProtocolClientSideTranslatorPB.java:149)
        at org.apache.hadoop.ozone.container.common.states.endpoint.HeartbeatEndpointTask.call(HeartbeatEndpointTask.java:185)
        at org.apache.hadoop.ozone.container.common.states.endpoint.HeartbeatEndpointTask.call(HeartbeatEndpointTask.java:87)
        at java.util.concurrent.FutureTask.run(FutureTask.java:266)
        at java.util.concurrent.ThreadPoolExecutor.runWorker(ThreadPoolExecutor.java:1149)
        at java.util.concurrent.ThreadPoolExecutor$Worker.run(ThreadPoolExecutor.java:624)
        at java.lang.Thread.run(Thread.java:750)
"Datanode ReportManager Thread - 4" daemon prio=5 tid=845 in Object.wait()
java.lang.Thread.State: WAITING (on object monitor)
        at sun.misc.Unsafe.park(Native Method)
        at java.util.concurrent.locks.LockSupport.park(LockSupport.java:175)
        at java.util.concurrent.locks.AbstractQueuedSynchronizer$ConditionObject.await(AbstractQueuedSynchronizer.java:2039)
        at java.util.concurrent.ScheduledThreadPoolExecutor$DelayedWorkQueue.take(ScheduledThreadPoolExecutor.java:1088)
        at java.util.concurrent.ScheduledThreadPoolExecutor$DelayedWorkQueue.take(ScheduledThreadPoolExecutor.java:809)
        at java.util.concurrent.ThreadPoolExecutor.getTask(ThreadPoolExecutor.java:1074)
        at java.util.concurrent.ThreadPoolExecutor.runWorker(ThreadPoolExecutor.java:1134)
        at java.util.concurrent.ThreadPoolExecutor$Worker.run(ThreadPoolExecutor.java:624)
        at java.lang.Thread.run(Thread.java:750)
"surefire-forkedjvm-command-thread" daemon prio=5 tid=10 runnable
java.lang.Thread.State: RUNNABLE
        at java.io.FileInputStream.readBytes(Native Method)
        at java.io.FileInputStream.read(FileInputStream.java:255)
        at java.io.BufferedInputStream.read1(BufferedInputStream.java:284)
        at java.io.BufferedInputStream.read(BufferedInputStream.java:345)
        at java.io.BufferedInputStream.fill(BufferedInputStream.java:246)
        at java.io.BufferedInputStream.read1(BufferedInputStream.java:286)
        at java.io.BufferedInputStream.read(BufferedInputStream.java:345)
        at org.apache.maven.surefire.api.util.internal.Channels$3.readImpl(Channels.java:214)
        at org.apache.maven.surefire.api.util.internal.AbstractNoninterruptibleReadableChannel.read(AbstractNoninterruptibleReadableChannel.java:54)
        at org.apache.maven.surefire.booter.spi.LegacyMasterProcessChannelDecoder.decode(LegacyMasterProcessChannelDecoder.java:80)
        at org.apache.maven.surefire.booter.CommandReader$CommandRunnable.run(CommandReader.java:343)
        at java.lang.Thread.run(Thread.java:750)
"FullTableCache Cleanup Thread - 0" daemon prio=5 tid=1143 in Object.wait()
java.lang.Thread.State: WAITING (on object monitor)
        at sun.misc.Unsafe.park(Native Method)
        at java.util.concurrent.locks.LockSupport.park(LockSupport.java:175)
        at java.util.concurrent.locks.AbstractQueuedSynchronizer$ConditionObject.await(AbstractQueuedSynchronizer.java:2039)
        at java.util.concurrent.LinkedBlockingQueue.take(LinkedBlockingQueue.java:442)
        at java.util.concurrent.ThreadPoolExecutor.getTask(ThreadPoolExecutor.java:1074)
        at java.util.concurrent.ThreadPoolExecutor.runWorker(ThreadPoolExecutor.java:1134)
        at java.util.concurrent.ThreadPoolExecutor$Worker.run(ThreadPoolExecutor.java:624)
        at java.lang.Thread.run(Thread.java:750)
"ExpiredContainerReplicaOpScrubberThread" daemon prio=5 tid=499 timed_waiting
java.lang.Thread.State: TIMED_WAITING
        at java.lang.Object.wait(Native Method)
        at org.apache.hadoop.hdds.scm.ha.BackgroundSCMService.run(BackgroundSCMService.java:105)
        at org.apache.hadoop.hdds.scm.ha.BackgroundSCMService$$Lambda$668/1691551744.run(Unknown Source)
        at java.lang.Thread.run(Thread.java:750)
"ExpiredContainerReplicaOpScrubberThread" daemon prio=5 tid=36 timed_waiting
java.lang.Thread.State: TIMED_WAITING
        at java.lang.Object.wait(Native Method)
        at org.apache.hadoop.hdds.scm.ha.BackgroundSCMService.run(BackgroundSCMService.java:105)
        at org.apache.hadoop.hdds.scm.ha.BackgroundSCMService$$Lambda$668/1691551744.run(Unknown Source)
        at java.lang.Thread.run(Thread.java:750)
"IPC Parameter Sending Thread #2" daemon prio=5 tid=902 timed_waiting
java.lang.Thread.State: TIMED_WAITING
        at sun.misc.Unsafe.park(Native Method)
        at java.util.concurrent.locks.LockSupport.parkNanos(LockSupport.java:215)
        at java.util.concurrent.SynchronousQueue$TransferStack.awaitFulfill(SynchronousQueue.java:460)
        at java.util.concurrent.SynchronousQueue$TransferStack.transfer(SynchronousQueue.java:362)
        at java.util.concurrent.SynchronousQueue.poll(SynchronousQueue.java:941)
        at java.util.concurrent.ThreadPoolExecutor.getTask(ThreadPoolExecutor.java:1073)
        at java.util.concurrent.ThreadPoolExecutor.runWorker(ThreadPoolExecutor.java:1134)
        at java.util.concurrent.ThreadPoolExecutor$Worker.run(ThreadPoolExecutor.java:624)
        at java.lang.Thread.run(Thread.java:750)
"Datanode ReportManager Thread - 3" daemon prio=5 tid=812 in Object.wait()
java.lang.Thread.State: WAITING (on object monitor)
        at sun.misc.Unsafe.park(Native Method)
        at java.util.concurrent.locks.LockSupport.park(LockSupport.java:175)
        at java.util.concurrent.locks.AbstractQueuedSynchronizer$ConditionObject.await(AbstractQueuedSynchronizer.java:2039)
        at java.util.concurrent.ScheduledThreadPoolExecutor$DelayedWorkQueue.take(ScheduledThreadPoolExecutor.java:1088)
        at java.util.concurrent.ScheduledThreadPoolExecutor$DelayedWorkQueue.take(ScheduledThreadPoolExecutor.java:809)
        at java.util.concurrent.ThreadPoolExecutor.getTask(ThreadPoolExecutor.java:1074)
        at java.util.concurrent.ThreadPoolExecutor.runWorker(ThreadPoolExecutor.java:1134)
        at java.util.concurrent.ThreadPoolExecutor$Worker.run(ThreadPoolExecutor.java:624)
        at java.lang.Thread.run(Thread.java:750)
"org.apache.hadoop.ozone.container.common.statemachine.commandhandler.DeleteBlocksCommandHandler$DeleteCmdWorker@6a251aca" daemon prio=5 tid=797 runnable
java.lang.Thread.State: RUNNABLE
        at java.lang.Thread.sleep(Native Method)
        at org.apache.hadoop.ozone.container.common.statemachine.commandhandler.DeleteBlocksCommandHandler$DeleteCmdWorker.run(DeleteBlocksCommandHandler.java:185)
        at java.lang.Thread.run(Thread.java:750)
"main"  prio=5 tid=1 timed_waiting
java.lang.Thread.State: TIMED_WAITING
        at sun.misc.Unsafe.park(Native Method)
        at java.util.concurrent.locks.LockSupport.parkNanos(LockSupport.java:215)
        at java.util.concurrent.FutureTask.awaitDone(FutureTask.java:426)
        at java.util.concurrent.FutureTask.get(FutureTask.java:204)
        at org.junit.internal.runners.statements.FailOnTimeout.getResult(FailOnTimeout.java:156)
        at org.junit.internal.runners.statements.FailOnTimeout.evaluate(FailOnTimeout.java:129)
        at org.junit.runners.ParentRunner$3.evaluate(ParentRunner.java:306)
        at org.junit.runners.BlockJUnit4ClassRunner$1.evaluate(BlockJUnit4ClassRunner.java:100)
        at org.junit.runners.ParentRunner.runLeaf(ParentRunner.java:366)
        at org.junit.runners.BlockJUnit4ClassRunner.runChild(BlockJUnit4ClassRunner.java:103)
        at org.junit.runners.BlockJUnit4ClassRunner.runChild(BlockJUnit4ClassRunner.java:63)
        at org.junit.runners.ParentRunner$4.run(ParentRunner.java:331)
        at org.junit.runners.ParentRunner$1.schedule(ParentRunner.java:79)
        at org.junit.runners.ParentRunner.runChildren(ParentRunner.java:329)
        at org.junit.runners.ParentRunner.access$100(ParentRunner.java:66)
        at org.junit.runners.ParentRunner$2.evaluate(ParentRunner.java:293)
        at org.junit.runners.ParentRunner$3.evaluate(ParentRunner.java:306)
        at org.junit.runners.ParentRunner.run(ParentRunner.java:413)
        at org.junit.runner.JUnitCore.run(JUnitCore.java:137)
        at org.junit.runner.JUnitCore.run(JUnitCore.java:115)
        at org.junit.vintage.engine.execution.RunnerExecutor.execute(RunnerExecutor.java:42)
        at org.junit.vintage.engine.VintageTestEngine.executeAllChildren(VintageTestEngine.java:80)
        at org.junit.vintage.engine.VintageTestEngine.execute(VintageTestEngine.java:72)
        at org.junit.platform.launcher.core.EngineExecutionOrchestrator.execute(EngineExecutionOrchestrator.java:107)
        at org.junit.platform.launcher.core.EngineExecutionOrchestrator.execute(EngineExecutionOrchestrator.java:88)
        at org.junit.platform.launcher.core.EngineExecutionOrchestrator.lambda$execute$0(EngineExecutionOrchestrator.java:54)
        at org.junit.platform.launcher.core.EngineExecutionOrchestrator$$Lambda$188/896644936.accept(Unknown Source)
        at org.junit.platform.launcher.core.EngineExecutionOrchestrator.withInterceptedStreams(EngineExecutionOrchestrator.java:67)
        at org.junit.platform.launcher.core.EngineExecutionOrchestrator.execute(EngineExecutionOrchestrator.java:52)
        at org.junit.platform.launcher.core.DefaultLauncher.execute(DefaultLauncher.java:114)
        at org.junit.platform.launcher.core.DefaultLauncher.execute(DefaultLauncher.java:86)
        at org.junit.platform.launcher.core.DefaultLauncherSession$DelegatingLauncher.execute(DefaultLauncherSession.java:86)
        at org.junit.platform.launcher.core.SessionPerRequestLauncher.execute(SessionPerRequestLauncher.java:53)
        at org.apache.maven.surefire.junitplatform.JUnitPlatformProvider.execute(JUnitPlatformProvider.java:188)
        at org.apache.maven.surefire.junitplatform.JUnitPlatformProvider.invokeAllTests(JUnitPlatformProvider.java:154)
        at org.apache.maven.surefire.junitplatform.JUnitPlatformProvider.invoke(JUnitPlatformProvider.java:124)
        at org.apache.maven.surefire.booter.ForkedBooter.runSuitesInProcess(ForkedBooter.java:428)
        at org.apache.maven.surefire.booter.ForkedBooter.execute(ForkedBooter.java:162)
        at org.apache.maven.surefire.booter.ForkedBooter.run(ForkedBooter.java:562)
        at org.apache.maven.surefire.booter.ForkedBooter.main(ForkedBooter.java:548)
"UnderReplicatedQueueThreadThread" daemon prio=5 tid=501 timed_waiting
java.lang.Thread.State: TIMED_WAITING
        at java.lang.Object.wait(Native Method)
        at org.apache.hadoop.hdds.scm.ha.BackgroundSCMService.run(BackgroundSCMService.java:105)
        at org.apache.hadoop.hdds.scm.ha.BackgroundSCMService$$Lambda$668/1691551744.run(Unknown Source)
        at java.lang.Thread.run(Thread.java:750)
"Datanode ReportManager Thread - 0" daemon prio=5 tid=867 timed_waiting
java.lang.Thread.State: TIMED_WAITING
        at sun.misc.Unsafe.park(Native Method)
        at java.util.concurrent.locks.LockSupport.parkNanos(LockSupport.java:215)
        at java.util.concurrent.locks.AbstractQueuedSynchronizer$ConditionObject.awaitNanos(AbstractQueuedSynchronizer.java:2078)
        at java.util.concurrent.ScheduledThreadPoolExecutor$DelayedWorkQueue.take(ScheduledThreadPoolExecutor.java:1093)
        at java.util.concurrent.ScheduledThreadPoolExecutor$DelayedWorkQueue.take(ScheduledThreadPoolExecutor.java:809)
        at java.util.concurrent.ThreadPoolExecutor.getTask(ThreadPoolExecutor.java:1074)
        at java.util.concurrent.ThreadPoolExecutor.runWorker(ThreadPoolExecutor.java:1134)
        at java.util.concurrent.ThreadPoolExecutor$Worker.run(ThreadPoolExecutor.java:624)
        at java.lang.Thread.run(Thread.java:750)
"org.apache.hadoop.ozone.container.common.statemachine.commandhandler.DeleteBlocksCommandHandler$DeleteCmdWorker@2e75b942" daemon prio=5 tid=855 runnable
java.lang.Thread.State: RUNNABLE
        at java.lang.Thread.sleep(Native Method)
        at org.apache.hadoop.ozone.container.common.statemachine.commandhandler.DeleteBlocksCommandHandler$DeleteCmdWorker.run(DeleteBlocksCommandHandler.java:185)
        at java.lang.Thread.run(Thread.java:750)
"java.util.concurrent.ThreadPoolExecutor$Worker@47bcd7a6[State = -1, empty queue]" daemon prio=5 tid=1065 timed_waiting
java.lang.Thread.State: TIMED_WAITING
        at sun.misc.Unsafe.park(Native Method)
        at java.util.concurrent.locks.LockSupport.parkNanos(LockSupport.java:215)
        at java.util.concurrent.locks.AbstractQueuedSynchronizer$ConditionObject.awaitNanos(AbstractQueuedSynchronizer.java:2078)
        at java.util.concurrent.ScheduledThreadPoolExecutor$DelayedWorkQueue.take(ScheduledThreadPoolExecutor.java:1093)
        at java.util.concurrent.ScheduledThreadPoolExecutor$DelayedWorkQueue.take(ScheduledThreadPoolExecutor.java:809)
        at java.util.concurrent.ThreadPoolExecutor.getTask(ThreadPoolExecutor.java:1074)
        at java.util.concurrent.ThreadPoolExecutor.runWorker(ThreadPoolExecutor.java:1134)
        at java.util.concurrent.ThreadPoolExecutor$Worker.run(ThreadPoolExecutor.java:624)
        at java.lang.Thread.run(Thread.java:750)
"UnderReplicatedQueueThreadThread" daemon prio=5 tid=38 timed_waiting
java.lang.Thread.State: TIMED_WAITING
        at java.lang.Object.wait(Native Method)
        at org.apache.hadoop.hdds.scm.ha.BackgroundSCMService.run(BackgroundSCMService.java:105)
        at org.apache.hadoop.hdds.scm.ha.BackgroundSCMService$$Lambda$668/1691551744.run(Unknown Source)
        at java.lang.Thread.run(Thread.java:750)
"IPC Parameter Sending Thread #1" daemon prio=5 tid=901 timed_waiting
java.lang.Thread.State: TIMED_WAITING
        at sun.misc.Unsafe.park(Native Method)
        at java.util.concurrent.locks.LockSupport.parkNanos(LockSupport.java:215)
        at java.util.concurrent.SynchronousQueue$TransferStack.awaitFulfill(SynchronousQueue.java:460)
        at java.util.concurrent.SynchronousQueue$TransferStack.transfer(SynchronousQueue.java:362)
        at java.util.concurrent.SynchronousQueue.poll(SynchronousQueue.java:941)
        at java.util.concurrent.ThreadPoolExecutor.getTask(ThreadPoolExecutor.java:1073)
        at java.util.concurrent.ThreadPoolExecutor.runWorker(ThreadPoolExecutor.java:1134)
        at java.util.concurrent.ThreadPoolExecutor$Worker.run(ThreadPoolExecutor.java:624)
        at java.lang.Thread.run(Thread.java:750)
"Datanode ReportManager Thread - 4" daemon prio=5 tid=813 in Object.wait()
java.lang.Thread.State: WAITING (on object monitor)
        at sun.misc.Unsafe.park(Native Method)
        at java.util.concurrent.locks.LockSupport.park(LockSupport.java:175)
        at java.util.concurrent.locks.AbstractQueuedSynchronizer$ConditionObject.await(AbstractQueuedSynchronizer.java:2039)
        at java.util.concurrent.ScheduledThreadPoolExecutor$DelayedWorkQueue.take(ScheduledThreadPoolExecutor.java:1088)
        at java.util.concurrent.ScheduledThreadPoolExecutor$DelayedWorkQueue.take(ScheduledThreadPoolExecutor.java:809)
        at java.util.concurrent.ThreadPoolExecutor.getTask(ThreadPoolExecutor.java:1074)
        at java.util.concurrent.ThreadPoolExecutor.runWorker(ThreadPoolExecutor.java:1134)
        at java.util.concurrent.ThreadPoolExecutor$Worker.run(ThreadPoolExecutor.java:624)
        at java.lang.Thread.run(Thread.java:750)
"FullTableCache Cleanup Thread - 0" daemon prio=5 tid=1141 in Object.wait()
java.lang.Thread.State: WAITING (on object monitor)
        at sun.misc.Unsafe.park(Native Method)
        at java.util.concurrent.locks.LockSupport.park(LockSupport.java:175)
        at java.util.concurrent.locks.AbstractQueuedSynchronizer$ConditionObject.await(AbstractQueuedSynchronizer.java:2039)
        at java.util.concurrent.LinkedBlockingQueue.take(LinkedBlockingQueue.java:442)
        at java.util.concurrent.ThreadPoolExecutor.getTask(ThreadPoolExecutor.java:1074)
        at java.util.concurrent.ThreadPoolExecutor.runWorker(ThreadPoolExecutor.java:1134)
        at java.util.concurrent.ThreadPoolExecutor$Worker.run(ThreadPoolExecutor.java:624)
        at java.lang.Thread.run(Thread.java:750)
"EndpointStateMachine task thread for /127.0.0.1:44825 - 0 "  prio=5 tid=939 blocked
java.lang.Thread.State: BLOCKED
        at org.apache.hadoop.ipc.Client$Connection.addCall(Client.java:522)
        at org.apache.hadoop.ipc.Client$Connection.access$3700(Client.java:414)
        at org.apache.hadoop.ipc.Client.getConnection(Client.java:1634)
        at org.apache.hadoop.ipc.Client.call(Client.java:1463)
        at org.apache.hadoop.ipc.Client.call(Client.java:1416)
        at org.apache.hadoop.ipc.ProtobufRpcEngine$Invoker.invoke(ProtobufRpcEngine.java:236)
        at org.apache.hadoop.ipc.ProtobufRpcEngine$Invoker.invoke(ProtobufRpcEngine.java:123)
        at com.sun.proxy.$Proxy51.submitRequest(Unknown Source)
        at org.apache.hadoop.ozone.protocolPB.StorageContainerDatanodeProtocolClientSideTranslatorPB.submitRequest(StorageContainerDatanodeProtocolClientSideTranslatorPB.java:117)
        at org.apache.hadoop.ozone.protocolPB.StorageContainerDatanodeProtocolClientSideTranslatorPB.sendHeartbeat(StorageContainerDatanodeProtocolClientSideTranslatorPB.java:149)
        at org.apache.hadoop.ozone.container.common.states.endpoint.HeartbeatEndpointTask.call(HeartbeatEndpointTask.java:185)
        at org.apache.hadoop.ozone.container.common.states.endpoint.HeartbeatEndpointTask.call(HeartbeatEndpointTask.java:87)
        at java.util.concurrent.FutureTask.run(FutureTask.java:266)
        at java.util.concurrent.ThreadPoolExecutor.runWorker(ThreadPoolExecutor.java:1149)
        at java.util.concurrent.ThreadPoolExecutor$Worker.run(ThreadPoolExecutor.java:624)
        at java.lang.Thread.run(Thread.java:750)
"Datanode ReportManager Thread - 4" daemon prio=5 tid=871 in Object.wait()
java.lang.Thread.State: WAITING (on object monitor)
        at sun.misc.Unsafe.park(Native Method)
        at java.util.concurrent.locks.LockSupport.park(LockSupport.java:175)
        at java.util.concurrent.locks.AbstractQueuedSynchronizer$ConditionObject.await(AbstractQueuedSynchronizer.java:2039)
        at java.util.concurrent.ScheduledThreadPoolExecutor$DelayedWorkQueue.take(ScheduledThreadPoolExecutor.java:1088)
        at java.util.concurrent.ScheduledThreadPoolExecutor$DelayedWorkQueue.take(ScheduledThreadPoolExecutor.java:809)
        at java.util.concurrent.ThreadPoolExecutor.getTask(ThreadPoolExecutor.java:1074)
        at java.util.concurrent.ThreadPoolExecutor.runWorker(ThreadPoolExecutor.java:1134)
        at java.util.concurrent.ThreadPoolExecutor$Worker.run(ThreadPoolExecutor.java:624)
        at java.lang.Thread.run(Thread.java:750)
"Listener at 127.0.0.1/34741" daemon prio=5 tid=12 runnable
java.lang.Thread.State: RUNNABLE
        at java.lang.Thread.dumpThreads(Native Method)
        at java.lang.Thread.getAllStackTraces(Thread.java:1615)
        at org.apache.ozone.test.TimedOutTestsListener.buildThreadDump(TimedOutTestsListener.java:93)
        at org.apache.ozone.test.TimedOutTestsListener.buildThreadDiagnosticString(TimedOutTestsListener.java:79)
        at org.apache.ozone.test.GenericTestUtils.waitFor(GenericTestUtils.java:224)
        at org.apache.hadoop.ozone.parser.TestOzoneHARatisLogParser.testRatisLogParsing(TestOzoneHARatisLogParser.java:129)
        at sun.reflect.NativeMethodAccessorImpl.invoke0(Native Method)
        at sun.reflect.NativeMethodAccessorImpl.invoke(NativeMethodAccessorImpl.java:62)
        at sun.reflect.DelegatingMethodAccessorImpl.invoke(DelegatingMethodAccessorImpl.java:43)
        at java.lang.reflect.Method.invoke(Method.java:498)
        at org.junit.runners.model.FrameworkMethod$1.runReflectiveCall(FrameworkMethod.java:59)
        at org.junit.internal.runners.model.ReflectiveCallable.run(ReflectiveCallable.java:12)
        at org.junit.runners.model.FrameworkMethod.invokeExplosively(FrameworkMethod.java:56)
        at org.junit.internal.runners.statements.InvokeMethod.evaluate(InvokeMethod.java:17)
        at org.junit.internal.runners.statements.RunBefores.evaluate(RunBefores.java:26)
        at org.junit.internal.runners.statements.RunAfters.evaluate(RunAfters.java:27)
        at org.junit.internal.runners.statements.FailOnTimeout$CallableStatement.call(FailOnTimeout.java:288)
        at org.junit.internal.runners.statements.FailOnTimeout$CallableStatement.call(FailOnTimeout.java:282)
        at java.util.concurrent.FutureTask.run(FutureTask.java:266)
        at java.lang.Thread.run(Thread.java:750)
"Datanode ReportManager Thread - 2" daemon prio=5 tid=869 in Object.wait()
java.lang.Thread.State: WAITING (on object monitor)
        at sun.misc.Unsafe.park(Native Method)
        at java.util.concurrent.locks.LockSupport.park(LockSupport.java:175)
        at java.util.concurrent.locks.AbstractQueuedSynchronizer$ConditionObject.await(AbstractQueuedSynchronizer.java:2039)
        at java.util.concurrent.ScheduledThreadPoolExecutor$DelayedWorkQueue.take(ScheduledThreadPoolExecutor.java:1088)
        at java.util.concurrent.ScheduledThreadPoolExecutor$DelayedWorkQueue.take(ScheduledThreadPoolExecutor.java:809)
        at java.util.concurrent.ThreadPoolExecutor.getTask(ThreadPoolExecutor.java:1074)
        at java.util.concurrent.ThreadPoolExecutor.runWorker(ThreadPoolExecutor.java:1134)
        at java.util.concurrent.ThreadPoolExecutor$Worker.run(ThreadPoolExecutor.java:624)
        at java.lang.Thread.run(Thread.java:750)
"UnderReplicatedQueueThreadThread" daemon prio=5 tid=387 timed_waiting
java.lang.Thread.State: TIMED_WAITING
        at java.lang.Object.wait(Native Method)
        at org.apache.hadoop.hdds.scm.ha.BackgroundSCMService.run(BackgroundSCMService.java:105)
        at org.apache.hadoop.hdds.scm.ha.BackgroundSCMService$$Lambda$668/1691551744.run(Unknown Source)
        at java.lang.Thread.run(Thread.java:750)
"OverReplicatedQueueThreadThread" daemon prio=5 tid=388 timed_waiting
java.lang.Thread.State: TIMED_WAITING
        at java.lang.Object.wait(Native Method)
        at org.apache.hadoop.hdds.scm.ha.BackgroundSCMService.run(BackgroundSCMService.java:105)
        at org.apache.hadoop.hdds.scm.ha.BackgroundSCMService$$Lambda$668/1691551744.run(Unknown Source)
        at java.lang.Thread.run(Thread.java:750)
"EndpointStateMachine task thread for /127.0.0.1:38303 - 0 "  prio=5 tid=937 blocked
java.lang.Thread.State: BLOCKED
        at org.apache.hadoop.ipc.Client$Connection.addCall(Client.java:522)
        at org.apache.hadoop.ipc.Client$Connection.access$3700(Client.java:414)
        at org.apache.hadoop.ipc.Client.getConnection(Client.java:1634)
        at org.apache.hadoop.ipc.Client.call(Client.java:1463)
        at org.apache.hadoop.ipc.Client.call(Client.java:1416)
        at org.apache.hadoop.ipc.ProtobufRpcEngine$Invoker.invoke(ProtobufRpcEngine.java:236)
        at org.apache.hadoop.ipc.ProtobufRpcEngine$Invoker.invoke(ProtobufRpcEngine.java:123)
        at com.sun.proxy.$Proxy51.submitRequest(Unknown Source)
        at org.apache.hadoop.ozone.protocolPB.StorageContainerDatanodeProtocolClientSideTranslatorPB.submitRequest(StorageContainerDatanodeProtocolClientSideTranslatorPB.java:117)
        at org.apache.hadoop.ozone.protocolPB.StorageContainerDatanodeProtocolClientSideTranslatorPB.sendHeartbeat(StorageContainerDatanodeProtocolClientSideTranslatorPB.java:149)
        at org.apache.hadoop.ozone.container.common.states.endpoint.HeartbeatEndpointTask.call(HeartbeatEndpointTask.java:185)
        at org.apache.hadoop.ozone.container.common.states.endpoint.HeartbeatEndpointTask.call(HeartbeatEndpointTask.java:87)
        at java.util.concurrent.FutureTask.run(FutureTask.java:266)
        at java.util.concurrent.ThreadPoolExecutor.runWorker(ThreadPoolExecutor.java:1149)
        at java.util.concurrent.ThreadPoolExecutor$Worker.run(ThreadPoolExecutor.java:624)
        at java.lang.Thread.run(Thread.java:750)
"FullTableCache Cleanup Thread - 0" daemon prio=5 tid=1149 in Object.wait()
java.lang.Thread.State: WAITING (on object monitor)
        at sun.misc.Unsafe.park(Native Method)
        at java.util.concurrent.locks.LockSupport.park(LockSupport.java:175)
        at java.util.concurrent.locks.AbstractQueuedSynchronizer$ConditionObject.await(AbstractQueuedSynchronizer.java:2039)
        at java.util.concurrent.LinkedBlockingQueue.take(LinkedBlockingQueue.java:442)
        at java.util.concurrent.ThreadPoolExecutor.getTask(ThreadPoolExecutor.java:1074)
        at java.util.concurrent.ThreadPoolExecutor.runWorker(ThreadPoolExecutor.java:1134)
        at java.util.concurrent.ThreadPoolExecutor$Worker.run(ThreadPoolExecutor.java:624)
        at java.lang.Thread.run(Thread.java:750)
"EndpointStateMachine task thread for /127.0.0.1:44825 - 0 "  prio=5 tid=896 timed_waiting
java.lang.Thread.State: TIMED_WAITING
        at java.lang.Thread.sleep(Native Method)
        at org.apache.hadoop.ipc.Client$Connection.handleConnectionFailure(Client.java:972)
        at org.apache.hadoop.ipc.Client$Connection.setupConnection(Client.java:724)
        at org.apache.hadoop.ipc.Client$Connection.setupIOstreams(Client.java:822)
        at org.apache.hadoop.ipc.Client$Connection.access$3800(Client.java:414)
        at org.apache.hadoop.ipc.Client.getConnection(Client.java:1647)
        at org.apache.hadoop.ipc.Client.call(Client.java:1463)
        at org.apache.hadoop.ipc.Client.call(Client.java:1416)
        at org.apache.hadoop.ipc.ProtobufRpcEngine$Invoker.invoke(ProtobufRpcEngine.java:236)
        at org.apache.hadoop.ipc.ProtobufRpcEngine$Invoker.invoke(ProtobufRpcEngine.java:123)
        at com.sun.proxy.$Proxy51.submitRequest(Unknown Source)
        at org.apache.hadoop.ozone.protocolPB.StorageContainerDatanodeProtocolClientSideTranslatorPB.submitRequest(StorageContainerDatanodeProtocolClientSideTranslatorPB.java:117)
        at org.apache.hadoop.ozone.protocolPB.StorageContainerDatanodeProtocolClientSideTranslatorPB.sendHeartbeat(StorageContainerDatanodeProtocolClientSideTranslatorPB.java:149)
        at org.apache.hadoop.ozone.container.common.states.endpoint.HeartbeatEndpointTask.call(HeartbeatEndpointTask.java:185)
        at org.apache.hadoop.ozone.container.common.states.endpoint.HeartbeatEndpointTask.call(HeartbeatEndpointTask.java:87)
        at java.util.concurrent.FutureTask.run(FutureTask.java:266)
        at java.util.concurrent.ThreadPoolExecutor.runWorker(ThreadPoolExecutor.java:1149)
        at java.util.concurrent.ThreadPoolExecutor$Worker.run(ThreadPoolExecutor.java:624)
        at java.lang.Thread.run(Thread.java:750)
"OverReplicatedQueueThreadThread" daemon prio=5 tid=39 timed_waiting
java.lang.Thread.State: TIMED_WAITING
        at java.lang.Object.wait(Native Method)
        at org.apache.hadoop.hdds.scm.ha.BackgroundSCMService.run(BackgroundSCMService.java:105)
        at org.apache.hadoop.hdds.scm.ha.BackgroundSCMService$$Lambda$668/1691551744.run(Unknown Source)
        at java.lang.Thread.run(Thread.java:750)
"Finalizer" daemon prio=8 tid=3 in Object.wait()
java.lang.Thread.State: WAITING (on object monitor)
        at java.lang.Object.wait(Native Method)
        at java.lang.ref.ReferenceQueue.remove(ReferenceQueue.java:144)
        at java.lang.ref.ReferenceQueue.remove(ReferenceQueue.java:165)
        at java.lang.ref.Finalizer$FinalizerThread.run(Finalizer.java:216)
"FullTableCache Cleanup Thread - 0" daemon prio=5 tid=1147 in Object.wait()
java.lang.Thread.State: WAITING (on object monitor)
        at sun.misc.Unsafe.park(Native Method)
        at java.util.concurrent.locks.LockSupport.park(LockSupport.java:175)
        at java.util.concurrent.locks.AbstractQueuedSynchronizer$ConditionObject.await(AbstractQueuedSynchronizer.java:2039)
        at java.util.concurrent.LinkedBlockingQueue.take(LinkedBlockingQueue.java:442)
        at java.util.concurrent.ThreadPoolExecutor.getTask(ThreadPoolExecutor.java:1074)
        at java.util.concurrent.ThreadPoolExecutor.runWorker(ThreadPoolExecutor.java:1134)
        at java.util.concurrent.ThreadPoolExecutor$Worker.run(ThreadPoolExecutor.java:624)
        at java.lang.Thread.run(Thread.java:750)
"EndpointStateMachine task thread for /127.0.0.1:38303 - 0 "  prio=5 tid=895 timed_waiting
java.lang.Thread.State: TIMED_WAITING
        at java.lang.Thread.sleep(Native Method)
        at org.apache.hadoop.ipc.Client$Connection.handleConnectionFailure(Client.java:972)
        at org.apache.hadoop.ipc.Client$Connection.setupConnection(Client.java:724)
        at org.apache.hadoop.ipc.Client$Connection.setupIOstreams(Client.java:822)
        at org.apache.hadoop.ipc.Client$Connection.access$3800(Client.java:414)
        at org.apache.hadoop.ipc.Client.getConnection(Client.java:1647)
        at org.apache.hadoop.ipc.Client.call(Client.java:1463)
        at org.apache.hadoop.ipc.Client.call(Client.java:1416)
        at org.apache.hadoop.ipc.ProtobufRpcEngine$Invoker.invoke(ProtobufRpcEngine.java:236)
        at org.apache.hadoop.ipc.ProtobufRpcEngine$Invoker.invoke(ProtobufRpcEngine.java:123)
        at com.sun.proxy.$Proxy51.submitRequest(Unknown Source)
        at org.apache.hadoop.ozone.protocolPB.StorageContainerDatanodeProtocolClientSideTranslatorPB.submitRequest(StorageContainerDatanodeProtocolClientSideTranslatorPB.java:117)
        at org.apache.hadoop.ozone.protocolPB.StorageContainerDatanodeProtocolClientSideTranslatorPB.sendHeartbeat(StorageContainerDatanodeProtocolClientSideTranslatorPB.java:149)
        at org.apache.hadoop.ozone.container.common.states.endpoint.HeartbeatEndpointTask.call(HeartbeatEndpointTask.java:185)
        at org.apache.hadoop.ozone.container.common.states.endpoint.HeartbeatEndpointTask.call(HeartbeatEndpointTask.java:87)
        at java.util.concurrent.FutureTask.run(FutureTask.java:266)
        at java.util.concurrent.ThreadPoolExecutor.runWorker(ThreadPoolExecutor.java:1149)
        at java.util.concurrent.ThreadPoolExecutor$Worker.run(ThreadPoolExecutor.java:624)
        at java.lang.Thread.run(Thread.java:750)
"Datanode ReportManager Thread - 1" daemon prio=5 tid=810 in Object.wait()
java.lang.Thread.State: WAITING (on object monitor)
        at sun.misc.Unsafe.park(Native Method)
        at java.util.concurrent.locks.LockSupport.park(LockSupport.java:175)
        at java.util.concurrent.locks.AbstractQueuedSynchronizer$ConditionObject.await(AbstractQueuedSynchronizer.java:2039)
        at java.util.concurrent.ScheduledThreadPoolExecutor$DelayedWorkQueue.take(ScheduledThreadPoolExecutor.java:1088)
        at java.util.concurrent.ScheduledThreadPoolExecutor$DelayedWorkQueue.take(ScheduledThreadPoolExecutor.java:809)
        at java.util.concurrent.ThreadPoolExecutor.getTask(ThreadPoolExecutor.java:1074)
        at java.util.concurrent.ThreadPoolExecutor.runWorker(ThreadPoolExecutor.java:1134)
        at java.util.concurrent.ThreadPoolExecutor$Worker.run(ThreadPoolExecutor.java:624)
        at java.lang.Thread.run(Thread.java:750)
"SSL Certificates Store Monitor" daemon prio=5 tid=665 in Object.wait()
java.lang.Thread.State: WAITING (on object monitor)
        at java.lang.Object.wait(Native Method)
        at java.lang.Object.wait(Object.java:502)
        at java.util.TimerThread.mainLoop(Timer.java:526)
        at java.util.TimerThread.run(Timer.java:505)
"OverReplicatedQueueThreadThread" daemon prio=5 tid=502 timed_waiting
java.lang.Thread.State: TIMED_WAITING
        at java.lang.Object.wait(Native Method)
        at org.apache.hadoop.hdds.scm.ha.BackgroundSCMService.run(BackgroundSCMService.java:105)
        at org.apache.hadoop.hdds.scm.ha.BackgroundSCMService$$Lambda$668/1691551744.run(Unknown Source)
        at java.lang.Thread.run(Thread.java:750)
"Datanode ReportManager Thread - 1" daemon prio=5 tid=868 in Object.wait()
java.lang.Thread.State: WAITING (on object monitor)
        at sun.misc.Unsafe.park(Native Method)
        at java.util.concurrent.locks.LockSupport.park(LockSupport.java:175)
        at java.util.concurrent.locks.AbstractQueuedSynchronizer$ConditionObject.await(AbstractQueuedSynchronizer.java:2039)
        at java.util.concurrent.ScheduledThreadPoolExecutor$DelayedWorkQueue.take(ScheduledThreadPoolExecutor.java:1088)
        at java.util.concurrent.ScheduledThreadPoolExecutor$DelayedWorkQueue.take(ScheduledThreadPoolExecutor.java:809)
        at java.util.concurrent.ThreadPoolExecutor.getTask(ThreadPoolExecutor.java:1074)
        at java.util.concurrent.ThreadPoolExecutor.runWorker(ThreadPoolExecutor.java:1134)
        at java.util.concurrent.ThreadPoolExecutor$Worker.run(ThreadPoolExecutor.java:624)
        at java.lang.Thread.run(Thread.java:750)
"EndpointStateMachine task thread for /127.0.0.1:38303 - 0 "  prio=5 tid=920 blocked
java.lang.Thread.State: BLOCKED
        at org.apache.hadoop.ipc.Client$Connection.addCall(Client.java:522)
        at org.apache.hadoop.ipc.Client$Connection.access$3700(Client.java:414)
        at org.apache.hadoop.ipc.Client.getConnection(Client.java:1634)
        at org.apache.hadoop.ipc.Client.call(Client.java:1463)
        at org.apache.hadoop.ipc.Client.call(Client.java:1416)
        at org.apache.hadoop.ipc.ProtobufRpcEngine$Invoker.invoke(ProtobufRpcEngine.java:236)
        at org.apache.hadoop.ipc.ProtobufRpcEngine$Invoker.invoke(ProtobufRpcEngine.java:123)
        at com.sun.proxy.$Proxy51.submitRequest(Unknown Source)
        at org.apache.hadoop.ozone.protocolPB.StorageContainerDatanodeProtocolClientSideTranslatorPB.submitRequest(StorageContainerDatanodeProtocolClientSideTranslatorPB.java:117)
        at org.apache.hadoop.ozone.protocolPB.StorageContainerDatanodeProtocolClientSideTranslatorPB.sendHeartbeat(StorageContainerDatanodeProtocolClientSideTranslatorPB.java:149)
        at org.apache.hadoop.ozone.container.common.states.endpoint.HeartbeatEndpointTask.call(HeartbeatEndpointTask.java:185)
        at org.apache.hadoop.ozone.container.common.states.endpoint.HeartbeatEndpointTask.call(HeartbeatEndpointTask.java:87)
        at java.util.concurrent.FutureTask.run(FutureTask.java:266)
        at java.util.concurrent.ThreadPoolExecutor.runWorker(ThreadPoolExecutor.java:1149)
        at java.util.concurrent.ThreadPoolExecutor$Worker.run(ThreadPoolExecutor.java:624)
        at java.lang.Thread.run(Thread.java:750)


	at org.apache.ozone.test.GenericTestUtils.waitFor(GenericTestUtils.java:224)
	at org.apache.hadoop.ozone.parser.TestOzoneHARatisLogParser.testRatisLogParsing(TestOzoneHARatisLogParser.java:129)
	at sun.reflect.NativeMethodAccessorImpl.invoke0(Native Method)
	at sun.reflect.NativeMethodAccessorImpl.invoke(NativeMethodAccessorImpl.java:62)
	at sun.reflect.DelegatingMethodAccessorImpl.invoke(DelegatingMethodAccessorImpl.java:43)
	at java.lang.reflect.Method.invoke(Method.java:498)
	at org.junit.runners.model.FrameworkMethod$1.runReflectiveCall(FrameworkMethod.java:59)
	at org.junit.internal.runners.model.ReflectiveCallable.run(ReflectiveCallable.java:12)
	at org.junit.runners.model.FrameworkMethod.invokeExplosively(FrameworkMethod.java:56)
	at org.junit.internal.runners.statements.InvokeMethod.evaluate(InvokeMethod.java:17)
	at org.junit.internal.runners.statements.RunBefores.evaluate(RunBefores.java:26)
	at org.junit.internal.runners.statements.RunAfters.evaluate(RunAfters.java:27)
	at org.junit.internal.runners.statements.FailOnTimeout$CallableStatement.call(FailOnTimeout.java:288)
	at org.junit.internal.runners.statements.FailOnTimeout$CallableStatement.call(FailOnTimeout.java:282)
	at java.util.concurrent.FutureTask.run(FutureTask.java:266)
	at java.lang.Thread.run(Thread.java:750)

[INFO] Running org.apache.hadoop.ozone.TestStorageContainerManager
[INFO] Tests run: 10, Failures: 0, Errors: 0, Skipped: 0, Time elapsed: 391.054 s - in org.apache.hadoop.ozone.TestStorageContainerManager
[INFO] Running org.apache.hadoop.ozone.shell.TestOzoneTenantShell
[INFO] Tests run: 6, Failures: 0, Errors: 0, Skipped: 0, Time elapsed: 18.747 s - in org.apache.hadoop.ozone.shell.TestOzoneTenantShell
[INFO] Running org.apache.hadoop.ozone.shell.TestOzoneDatanodeShell
[INFO] Tests run: 2, Failures: 0, Errors: 0, Skipped: 0, Time elapsed: 0.852 s - in org.apache.hadoop.ozone.shell.TestOzoneDatanodeShell
[INFO] Running org.apache.hadoop.ozone.shell.TestScmAdminHA
[INFO] Tests run: 1, Failures: 0, Errors: 0, Skipped: 0, Time elapsed: 46.017 s - in org.apache.hadoop.ozone.shell.TestScmAdminHA
[INFO] Running org.apache.hadoop.ozone.shell.TestNSSummaryAdmin
[INFO] Tests run: 3, Failures: 0, Errors: 0, Skipped: 0, Time elapsed: 14.728 s - in org.apache.hadoop.ozone.shell.TestNSSummaryAdmin
[INFO] Running org.apache.hadoop.ozone.shell.TestOzoneShellHA
[INFO] Tests run: 13, Failures: 0, Errors: 0, Skipped: 0, Time elapsed: 78.658 s - in org.apache.hadoop.ozone.shell.TestOzoneShellHA
[INFO] Running org.apache.hadoop.ozone.shell.TestOzoneShellHAWithFSO
[INFO] Tests run: 13, Failures: 0, Errors: 0, Skipped: 0, Time elapsed: 84.052 s - in org.apache.hadoop.ozone.shell.TestOzoneShellHAWithFSO
[INFO] Running org.apache.hadoop.ozone.TestContainerBalancerOperations
[WARNING] Tests run: 1, Failures: 0, Errors: 0, Skipped: 1, Time elapsed: 0.024 s - in org.apache.hadoop.ozone.TestContainerBalancerOperations
[INFO] 
[INFO] Results:
[INFO] 
[ERROR] Errors: 
[ERROR]   TestOzoneHARatisLogParser.testRatisLogParsing:129  Timeout Timed out waiting ...
[INFO] 
[ERROR] Tests run: 137, Failures: 0, Errors: 1, Skipped: 2
[INFO] 
[INFO] 
[INFO] ------------------------------------------------------------------------
[INFO] Skipping Apache Ozone Mini Ozone Chaos Tests
[INFO] This project has been banned from the build due to previous failures.
[INFO] ------------------------------------------------------------------------
[INFO] ------------------------------------------------------------------------
[INFO] Reactor Summary for Apache Ozone Integration Tests 1.3.0-SNAPSHOT:
[INFO] 
[INFO] Apache Ozone Integration Tests ..................... FAILURE [59:18 min]
[INFO] Apache Ozone Mini Ozone Chaos Tests ................ SKIPPED
[INFO] ------------------------------------------------------------------------
[INFO] BUILD FAILURE
[INFO] ------------------------------------------------------------------------
[INFO] Total time:  59:19 min
[INFO] Finished at: 2022-07-21T18:36:10Z
[INFO] ------------------------------------------------------------------------
[ERROR] Failed to execute goal org.apache.maven.plugins:maven-surefire-plugin:3.0.0-M5:test (default-test) on project ozone-integration-test: There are test failures.
[ERROR] 
[ERROR] Please refer to /home/runner/work/ozone/ozone/hadoop-ozone/integration-test/target/surefire-reports for the individual test results.
[ERROR] Please refer to dump files (if any exist) [date].dump, [date]-jvmRun[N].dump and [date].dumpstream.
[ERROR] -> [Help 1]
[ERROR] 
[ERROR] To see the full stack trace of the errors, re-run Maven with the -e switch.
[ERROR] Re-run Maven using the -X switch to enable full debug logging.
[ERROR] 
[ERROR] For more information about the errors and possible solutions, please read the following articles:
[ERROR] [Help 1] http://cwiki.apache.org/confluence/display/MAVEN/MojoFailureException
