[INFO] Scanning for projects...
[INFO] ------------------------------------------------------------------------
[INFO] Detecting the operating system and CPU architecture
[INFO] ------------------------------------------------------------------------
[INFO] os.detected.name: linux
[INFO] os.detected.arch: x86_64
[INFO] os.detected.version: 5.4
[INFO] os.detected.version.major: 5
[INFO] os.detected.version.minor: 4
[INFO] os.detected.release: ubuntu
[INFO] os.detected.release.version: 18.04
[INFO] os.detected.release.like.ubuntu: true
[INFO] os.detected.release.like.debian: true
[INFO] os.detected.classifier: linux-x86_64
[INFO] ------------------------------------------------------------------------
[INFO] Reactor Build Order:
[INFO] 
[INFO] Apache Ozone Integration Tests                                     [jar]
[INFO] Apache Ozone Mini Ozone Chaos Tests                                [jar]
[INFO] 
[INFO] --------------< org.apache.ozone:ozone-integration-test >---------------
[INFO] Building Apache Ozone Integration Tests 1.2.0-SNAPSHOT             [1/2]
[INFO] --------------------------------[ jar ]---------------------------------
[INFO] 
[INFO] --- maven-antrun-plugin:1.3:run (create-testdirs) @ ozone-integration-test ---
[INFO] Executing tasks
[INFO] Executed tasks
[INFO] 
[INFO] --- jacoco-maven-plugin:0.8.5:prepare-agent (default-prepare-agent) @ ozone-integration-test ---
[INFO] argLine set to -javaagent:/home/runner/.m2/repository/org/jacoco/org.jacoco.agent/0.8.5/org.jacoco.agent-0.8.5-runtime.jar=destfile=/home/runner/work/ozone/ozone/hadoop-ozone/integration-test/target/jacoco.exec,includes=org.apache.hadoop.hdds.*:org.apache.hadoop.ozone.*:org.apache.hadoop.fs.ozone.*
[INFO] 
[INFO] --- maven-remote-resources-plugin:1.5:process (default) @ ozone-integration-test ---
[INFO] 
[INFO] --- maven-resources-plugin:3.1.0:resources (default-resources) @ ozone-integration-test ---
[INFO] Using 'UTF-8' encoding to copy filtered resources.
[INFO] skip non existing resourceDirectory /home/runner/work/ozone/ozone/hadoop-ozone/integration-test/src/main/resources
[INFO] Copying 2 resources
[INFO] 
[INFO] --- maven-compiler-plugin:3.1:compile (default-compile) @ ozone-integration-test ---
[INFO] No sources to compile
[INFO] 
[INFO] --- maven-resources-plugin:3.1.0:testResources (default-testResources) @ ozone-integration-test ---
[INFO] Using 'UTF-8' encoding to copy filtered resources.
[INFO] Copying 21 resources
[INFO] Copying 2 resources
[INFO] 
[INFO] --- maven-compiler-plugin:3.1:testCompile (default-testCompile) @ ozone-integration-test ---
[INFO] Compiling 11 source files to /home/runner/work/ozone/ozone/hadoop-ozone/integration-test/target/test-classes
[INFO] 
[INFO] --- maven-surefire-plugin:3.0.0-M1:test (default-test) @ ozone-integration-test ---
[INFO] 
[INFO] -------------------------------------------------------
[INFO]  T E S T S
[INFO] -------------------------------------------------------
[INFO] Running org.apache.hadoop.ozone.TestContainerOperations
[INFO] Tests run: 2, Failures: 0, Errors: 0, Skipped: 0, Time elapsed: 47.099 s - in org.apache.hadoop.ozone.TestContainerOperations
[INFO] Running org.apache.hadoop.ozone.container.server.TestSecureContainerServer
[INFO] Tests run: 2, Failures: 0, Errors: 0, Skipped: 0, Time elapsed: 26.799 s - in org.apache.hadoop.ozone.container.server.TestSecureContainerServer
[INFO] Running org.apache.hadoop.ozone.container.server.TestContainerServer
[WARNING] Tests run: 1, Failures: 0, Errors: 0, Skipped: 1, Time elapsed: 0.002 s - in org.apache.hadoop.ozone.container.server.TestContainerServer
[INFO] Running org.apache.hadoop.ozone.container.common.transport.server.ratis.TestCSMMetrics
[INFO] Tests run: 1, Failures: 0, Errors: 0, Skipped: 0, Time elapsed: 14.574 s - in org.apache.hadoop.ozone.container.common.transport.server.ratis.TestCSMMetrics
[INFO] Running org.apache.hadoop.ozone.container.common.statemachine.commandhandler.TestBlockDeletion
[INFO] Tests run: 3, Failures: 0, Errors: 0, Skipped: 0, Time elapsed: 202.49 s - in org.apache.hadoop.ozone.container.common.statemachine.commandhandler.TestBlockDeletion
[INFO] Running org.apache.hadoop.ozone.container.common.statemachine.commandhandler.TestDeleteContainerHandler
[INFO] Tests run: 2, Failures: 0, Errors: 0, Skipped: 0, Time elapsed: 33.876 s - in org.apache.hadoop.ozone.container.common.statemachine.commandhandler.TestDeleteContainerHandler
[INFO] Running org.apache.hadoop.ozone.container.common.statemachine.commandhandler.TestCloseContainerHandler
[INFO] Tests run: 1, Failures: 0, Errors: 0, Skipped: 0, Time elapsed: 25.655 s - in org.apache.hadoop.ozone.container.common.statemachine.commandhandler.TestCloseContainerHandler
[INFO] Running org.apache.hadoop.ozone.container.common.statemachine.commandhandler.TestCloseContainerByPipeline
[WARNING] Tests run: 1, Failures: 0, Errors: 0, Skipped: 1, Time elapsed: 0.002 s - in org.apache.hadoop.ozone.container.common.statemachine.commandhandler.TestCloseContainerByPipeline
[INFO] Running org.apache.hadoop.ozone.container.TestContainerReplication
[INFO] Tests run: 3, Failures: 0, Errors: 0, Skipped: 0, Time elapsed: 155.526 s - in org.apache.hadoop.ozone.container.TestContainerReplication
[INFO] Running org.apache.hadoop.ozone.container.metrics.TestContainerMetrics
[INFO] Tests run: 1, Failures: 0, Errors: 0, Skipped: 0, Time elapsed: 7.403 s - in org.apache.hadoop.ozone.container.metrics.TestContainerMetrics
[INFO] Running org.apache.hadoop.ozone.container.ozoneimpl.TestOzoneContainer
[WARNING] Tests run: 1, Failures: 0, Errors: 0, Skipped: 1, Time elapsed: 0.002 s - in org.apache.hadoop.ozone.container.ozoneimpl.TestOzoneContainer
[INFO] Running org.apache.hadoop.ozone.container.ozoneimpl.TestSecureOzoneContainer
[INFO] Tests run: 5, Failures: 0, Errors: 0, Skipped: 0, Time elapsed: 8.297 s - in org.apache.hadoop.ozone.container.ozoneimpl.TestSecureOzoneContainer
[INFO] Running org.apache.hadoop.ozone.container.ozoneimpl.TestOzoneContainerWithTLS
[WARNING] Tests run: 1, Failures: 0, Errors: 0, Skipped: 1, Time elapsed: 0.004 s - in org.apache.hadoop.ozone.container.ozoneimpl.TestOzoneContainerWithTLS
[INFO] Running org.apache.hadoop.ozone.TestContainerBalancerOperations
[WARNING] Tests run: 1, Failures: 0, Errors: 0, Skipped: 1, Time elapsed: 0.008 s - in org.apache.hadoop.ozone.TestContainerBalancerOperations
[INFO] Running org.apache.hadoop.ozone.shell.TestScmAdminHA
[INFO] Tests run: 1, Failures: 0, Errors: 0, Skipped: 0, Time elapsed: 42.975 s - in org.apache.hadoop.ozone.shell.TestScmAdminHA
[INFO] Running org.apache.hadoop.ozone.shell.TestOzoneDatanodeShell
[INFO] Tests run: 2, Failures: 0, Errors: 0, Skipped: 0, Time elapsed: 0.742 s - in org.apache.hadoop.ozone.shell.TestOzoneDatanodeShell
[INFO] Running org.apache.hadoop.ozone.shell.TestOzoneShellHA
[INFO] Tests run: 6, Failures: 0, Errors: 0, Skipped: 0, Time elapsed: 56.476 s - in org.apache.hadoop.ozone.shell.TestOzoneShellHA
[INFO] Running org.apache.hadoop.ozone.shell.TestNSSummaryAdmin
[INFO] Tests run: 1, Failures: 0, Errors: 0, Skipped: 0, Time elapsed: 11.95 s - in org.apache.hadoop.ozone.shell.TestNSSummaryAdmin
[INFO] Running org.apache.hadoop.ozone.TestSecureOzoneCluster
[INFO] Tests run: 11, Failures: 0, Errors: 0, Skipped: 0, Time elapsed: 68.311 s - in org.apache.hadoop.ozone.TestSecureOzoneCluster
[INFO] Running org.apache.hadoop.ozone.TestMiniOzoneCluster
[INFO] Tests run: 5, Failures: 0, Errors: 0, Skipped: 0, Time elapsed: 142.016 s - in org.apache.hadoop.ozone.TestMiniOzoneCluster
[INFO] Running org.apache.hadoop.ozone.om.TestOmLDBCli
[INFO] Tests run: 1, Failures: 0, Errors: 0, Skipped: 0, Time elapsed: 0.963 s - in org.apache.hadoop.ozone.om.TestOmLDBCli
[INFO] Running org.apache.hadoop.ozone.om.TestOMEpochForNonRatis
[INFO] Tests run: 2, Failures: 0, Errors: 0, Skipped: 0, Time elapsed: 51.698 s - in org.apache.hadoop.ozone.om.TestOMEpochForNonRatis
[INFO] Running org.apache.hadoop.ozone.om.TestOzoneManagerHAMetadataOnly
[WARNING] Tests run: 10, Failures: 0, Errors: 0, Skipped: 2, Time elapsed: 104.11 s - in org.apache.hadoop.ozone.om.TestOzoneManagerHAMetadataOnly
[INFO] Running org.apache.hadoop.ozone.om.TestOmInit
[INFO] Tests run: 1, Failures: 0, Errors: 0, Skipped: 0, Time elapsed: 45.624 s - in org.apache.hadoop.ozone.om.TestOmInit
[INFO] Running org.apache.hadoop.ozone.om.TestOzoneManagerRestart
[INFO] Tests run: 3, Failures: 0, Errors: 0, Skipped: 0, Time elapsed: 52.819 s - in org.apache.hadoop.ozone.om.TestOzoneManagerRestart
[INFO] Running org.apache.hadoop.ozone.om.TestOMUpgradeFinalization
[WARNING] Tests run: 2, Failures: 0, Errors: 0, Skipped: 2, Time elapsed: 0.096 s - in org.apache.hadoop.ozone.om.TestOMUpgradeFinalization
[INFO] Running org.apache.hadoop.ozone.om.TestOzoneManagerPrepare
[WARNING] Tests run: 6, Failures: 0, Errors: 0, Skipped: 1, Time elapsed: 139.872 s - in org.apache.hadoop.ozone.om.TestOzoneManagerPrepare
[INFO] Running org.apache.hadoop.ozone.om.TestKeyManagerImpl
[INFO] Tests run: 20, Failures: 0, Errors: 0, Skipped: 0, Time elapsed: 72.479 s - in org.apache.hadoop.ozone.om.TestKeyManagerImpl
[INFO] Running org.apache.hadoop.ozone.om.ratis.TestOzoneManagerRatisRequest
[INFO] Tests run: 1, Failures: 0, Errors: 0, Skipped: 0, Time elapsed: 3.822 s - in org.apache.hadoop.ozone.om.ratis.TestOzoneManagerRatisRequest
[INFO] Running org.apache.hadoop.ozone.om.TestOzoneManagerHAWithFailover
[INFO] Tests run: 1, Failures: 0, Errors: 0, Skipped: 0, Time elapsed: 47.374 s - in org.apache.hadoop.ozone.om.TestOzoneManagerHAWithFailover
[INFO] Running org.apache.hadoop.ozone.om.snapshot.TestOzoneManagerSnapshotProvider
[INFO] Tests run: 1, Failures: 0, Errors: 0, Skipped: 0, Time elapsed: 38.216 s - in org.apache.hadoop.ozone.om.snapshot.TestOzoneManagerSnapshotProvider
[INFO] Running org.apache.hadoop.ozone.om.TestOmBlockVersioning
[INFO] Tests run: 2, Failures: 0, Errors: 0, Skipped: 0, Time elapsed: 37.034 s - in org.apache.hadoop.ozone.om.TestOmBlockVersioning
[INFO] Running org.apache.hadoop.ozone.om.TestOmAcls
[INFO] Tests run: 2, Failures: 0, Errors: 0, Skipped: 0, Time elapsed: 37.584 s - in org.apache.hadoop.ozone.om.TestOmAcls
[INFO] Running org.apache.hadoop.ozone.om.TestRecursiveAclWithFSO
[INFO] Tests run: 1, Failures: 0, Errors: 0, Skipped: 0, Time elapsed: 43.212 s - in org.apache.hadoop.ozone.om.TestRecursiveAclWithFSO
[INFO] Running org.apache.hadoop.ozone.om.TestOzoneManagerRocksDBLogging
[INFO] Tests run: 1, Failures: 0, Errors: 0, Skipped: 0, Time elapsed: 42.259 s - in org.apache.hadoop.ozone.om.TestOzoneManagerRocksDBLogging
[INFO] Running org.apache.hadoop.ozone.om.TestOmStartupSlvLessThanMlv
[INFO] Tests run: 1, Failures: 0, Errors: 0, Skipped: 0, Time elapsed: 3.896 s - in org.apache.hadoop.ozone.om.TestOmStartupSlvLessThanMlv
[INFO] Running org.apache.hadoop.ozone.om.TestOzoneManagerHAKeyDeletion
[INFO] Tests run: 1, Failures: 0, Errors: 0, Skipped: 0, Time elapsed: 59.778 s - in org.apache.hadoop.ozone.om.TestOzoneManagerHAKeyDeletion
[INFO] Running org.apache.hadoop.ozone.om.parser.TestOMRatisLogParser
[INFO] Tests run: 1, Failures: 0, Errors: 0, Skipped: 0, Time elapsed: 38.262 s - in org.apache.hadoop.ozone.om.parser.TestOMRatisLogParser
[INFO] Running org.apache.hadoop.ozone.om.TestObjectStoreWithFSO
[INFO] Tests run: 8, Failures: 0, Errors: 0, Skipped: 0, Time elapsed: 42.979 s - in org.apache.hadoop.ozone.om.TestObjectStoreWithFSO
[INFO] Running org.apache.hadoop.ozone.om.TestOzoneManagerConfiguration
[INFO] Tests run: 9, Failures: 0, Errors: 0, Skipped: 0, Time elapsed: 49.767 s - in org.apache.hadoop.ozone.om.TestOzoneManagerConfiguration
[INFO] Running org.apache.hadoop.ozone.om.TestOMRatisSnapshots
[INFO] Tests run: 3, Failures: 0, Errors: 0, Skipped: 0, Time elapsed: 133.996 s - in org.apache.hadoop.ozone.om.TestOMRatisSnapshots
[INFO] Running org.apache.hadoop.ozone.om.TestScmSafeMode
[WARNING] Tests run: 1, Failures: 0, Errors: 0, Skipped: 1, Time elapsed: 0.001 s - in org.apache.hadoop.ozone.om.TestScmSafeMode
[INFO] Running org.apache.hadoop.ozone.om.TestOzoneManagerHAWithData
[WARNING] Tests run: 7, Failures: 0, Errors: 0, Skipped: 1, Time elapsed: 129.639 s - in org.apache.hadoop.ozone.om.TestOzoneManagerHAWithData
[INFO] Running org.apache.hadoop.ozone.om.TestOMDbCheckpointServlet
[INFO] Tests run: 3, Failures: 0, Errors: 0, Skipped: 0, Time elapsed: 42.744 s - in org.apache.hadoop.ozone.om.TestOMDbCheckpointServlet
[INFO] Running org.apache.hadoop.ozone.om.TestOzoneManagerRestInterface
[INFO] Tests run: 1, Failures: 0, Errors: 0, Skipped: 0, Time elapsed: 42.221 s - in org.apache.hadoop.ozone.om.TestOzoneManagerRestInterface
[INFO] Running org.apache.hadoop.ozone.om.TestSecureOzoneManager
[INFO] Tests run: 2, Failures: 0, Errors: 0, Skipped: 0, Time elapsed: 2.652 s - in org.apache.hadoop.ozone.om.TestSecureOzoneManager
[INFO] Running org.apache.hadoop.ozone.om.TestOzoneManagerHAWithACL
[INFO] Tests run: 1, Failures: 0, Errors: 0, Skipped: 0, Time elapsed: 40.039 s - in org.apache.hadoop.ozone.om.TestOzoneManagerHAWithACL
[INFO] Running org.apache.hadoop.ozone.om.TestOmMetrics
[INFO] Tests run: 5, Failures: 0, Errors: 0, Skipped: 0, Time elapsed: 47.196 s - in org.apache.hadoop.ozone.om.TestOmMetrics
[INFO] Running org.apache.hadoop.ozone.om.TestKeyPurging
[INFO] Tests run: 1, Failures: 0, Errors: 0, Skipped: 0, Time elapsed: 43.263 s - in org.apache.hadoop.ozone.om.TestKeyPurging
[INFO] Running org.apache.hadoop.ozone.om.TestOzoneManagerBootstrap
[INFO] Tests run: 3, Failures: 0, Errors: 0, Skipped: 0, Time elapsed: 172.896 s - in org.apache.hadoop.ozone.om.TestOzoneManagerBootstrap
[INFO] Running org.apache.hadoop.ozone.om.TestContainerReportWithKeys
[INFO] Tests run: 1, Failures: 0, Errors: 0, Skipped: 0, Time elapsed: 38.081 s - in org.apache.hadoop.ozone.om.TestContainerReportWithKeys
[INFO] Running org.apache.hadoop.ozone.om.TestOzoneManagerListVolumes
[INFO] Tests run: 6, Failures: 0, Errors: 0, Skipped: 0, Time elapsed: 22.14 s - in org.apache.hadoop.ozone.om.TestOzoneManagerListVolumes
[INFO] Running org.apache.hadoop.ozone.TestOzoneConfigurationFields
[INFO] Tests run: 4, Failures: 0, Errors: 0, Skipped: 0, Time elapsed: 0.437 s - in org.apache.hadoop.ozone.TestOzoneConfigurationFields
[INFO] Running org.apache.hadoop.ozone.TestMiniOzoneOMHACluster
[INFO] Tests run: 1, Failures: 0, Errors: 0, Skipped: 0, Time elapsed: 37.31 s - in org.apache.hadoop.ozone.TestMiniOzoneOMHACluster
[INFO] Running org.apache.hadoop.ozone.TestContainerStateMachineIdempotency
[INFO] Tests run: 1, Failures: 0, Errors: 0, Skipped: 0, Time elapsed: 36.305 s - in org.apache.hadoop.ozone.TestContainerStateMachineIdempotency
[INFO] Running org.apache.hadoop.ozone.dn.ratis.TestDnRatisLogParser
[INFO] Tests run: 1, Failures: 0, Errors: 0, Skipped: 0, Time elapsed: 22.43 s - in org.apache.hadoop.ozone.dn.ratis.TestDnRatisLogParser
[INFO] Running org.apache.hadoop.ozone.dn.scrubber.TestDataScrubber
[INFO] Tests run: 1, Failures: 0, Errors: 0, Skipped: 0, Time elapsed: 35.118 s - in org.apache.hadoop.ozone.dn.scrubber.TestDataScrubber
[INFO] Running org.apache.hadoop.ozone.dn.volume.TestDatanodeHddsVolumeFailureDetection
[INFO] Tests run: 3, Failures: 0, Errors: 0, Skipped: 0, Time elapsed: 60.189 s - in org.apache.hadoop.ozone.dn.volume.TestDatanodeHddsVolumeFailureDetection
[INFO] Running org.apache.hadoop.ozone.dn.volume.TestDatanodeHddsVolumeFailureToleration
[INFO] Tests run: 1, Failures: 0, Errors: 0, Skipped: 0, Time elapsed: 38.992 s - in org.apache.hadoop.ozone.dn.volume.TestDatanodeHddsVolumeFailureToleration
[INFO] Running org.apache.hadoop.ozone.recon.TestReconTasks
[INFO] Tests run: 1, Failures: 0, Errors: 0, Skipped: 0, Time elapsed: 73.879 s - in org.apache.hadoop.ozone.recon.TestReconTasks
[INFO] Running org.apache.hadoop.ozone.recon.TestReconWithOzoneManager
[INFO] Tests run: 1, Failures: 0, Errors: 0, Skipped: 0, Time elapsed: 29.928 s - in org.apache.hadoop.ozone.recon.TestReconWithOzoneManager
[INFO] Running org.apache.hadoop.ozone.recon.TestReconAsPassiveScm
[INFO] Tests run: 2, Failures: 0, Errors: 0, Skipped: 0, Time elapsed: 77.593 s - in org.apache.hadoop.ozone.recon.TestReconAsPassiveScm
[INFO] Running org.apache.hadoop.ozone.recon.TestReconWithOzoneManagerFSO
[INFO] Tests run: 1, Failures: 0, Errors: 0, Skipped: 0, Time elapsed: 30.265 s - in org.apache.hadoop.ozone.recon.TestReconWithOzoneManagerFSO
[INFO] Running org.apache.hadoop.ozone.recon.TestReconWithOzoneManagerHA
[INFO] Tests run: 1, Failures: 0, Errors: 0, Skipped: 0, Time elapsed: 42.202 s - in org.apache.hadoop.ozone.recon.TestReconWithOzoneManagerHA
[INFO] Running org.apache.hadoop.ozone.fsck.TestContainerMapper
[INFO] Tests run: 1, Failures: 0, Errors: 0, Skipped: 0, Time elapsed: 40.006 s - in org.apache.hadoop.ozone.fsck.TestContainerMapper
[INFO] Running org.apache.hadoop.ozone.TestDelegationToken
[INFO] Tests run: 1, Failures: 0, Errors: 0, Skipped: 0, Time elapsed: 15.886 s - in org.apache.hadoop.ozone.TestDelegationToken
[INFO] Running org.apache.hadoop.ozone.freon.TestDataValidateWithSafeByteOperations
[INFO] Tests run: 2, Failures: 0, Errors: 0, Skipped: 0, Time elapsed: 61.212 s - in org.apache.hadoop.ozone.freon.TestDataValidateWithSafeByteOperations
[INFO] Running org.apache.hadoop.ozone.freon.TestHadoopDirTreeGeneratorWithFSO
[INFO] Tests run: 1, Failures: 0, Errors: 0, Skipped: 0, Time elapsed: 76.948 s - in org.apache.hadoop.ozone.freon.TestHadoopDirTreeGeneratorWithFSO
[INFO] Running org.apache.hadoop.ozone.freon.TestHadoopDirTreeGenerator
[INFO] Tests run: 1, Failures: 0, Errors: 0, Skipped: 0, Time elapsed: 77.754 s - in org.apache.hadoop.ozone.freon.TestHadoopDirTreeGenerator
[INFO] Running org.apache.hadoop.ozone.freon.TestDataValidateWithDummyContainers
[INFO] Tests run: 2, Failures: 0, Errors: 0, Skipped: 0, Time elapsed: 49.814 s - in org.apache.hadoop.ozone.freon.TestDataValidateWithDummyContainers
[INFO] Running org.apache.hadoop.ozone.freon.TestDataValidateWithUnsafeByteOperations
[INFO] Tests run: 2, Failures: 0, Errors: 0, Skipped: 0, Time elapsed: 63.719 s - in org.apache.hadoop.ozone.freon.TestDataValidateWithUnsafeByteOperations
[INFO] Running org.apache.hadoop.ozone.freon.TestRandomKeyGenerator
[INFO] Tests run: 7, Failures: 0, Errors: 0, Skipped: 0, Time elapsed: 216.428 s - in org.apache.hadoop.ozone.freon.TestRandomKeyGenerator
[INFO] Running org.apache.hadoop.ozone.freon.TestFreonWithPipelineDestroy
[INFO] Tests run: 1, Failures: 0, Errors: 0, Skipped: 0, Time elapsed: 50.177 s - in org.apache.hadoop.ozone.freon.TestFreonWithPipelineDestroy
[INFO] Running org.apache.hadoop.ozone.freon.TestHadoopNestedDirGenerator
[INFO] Tests run: 1, Failures: 0, Errors: 0, Skipped: 0, Time elapsed: 61.22 s - in org.apache.hadoop.ozone.freon.TestHadoopNestedDirGenerator
[INFO] Running org.apache.hadoop.ozone.freon.TestFreonWithDatanodeFastRestart
[WARNING] Tests run: 1, Failures: 0, Errors: 0, Skipped: 1, Time elapsed: 0.009 s - in org.apache.hadoop.ozone.freon.TestFreonWithDatanodeFastRestart
[INFO] Running org.apache.hadoop.ozone.scm.TestSCMMXBean
[INFO] Tests run: 2, Failures: 0, Errors: 0, Skipped: 0, Time elapsed: 36.74 s - in org.apache.hadoop.ozone.scm.TestSCMMXBean
[INFO] Running org.apache.hadoop.ozone.scm.pipeline.TestSCMPipelineBytesWrittenMetrics
[INFO] Tests run: 1, Failures: 0, Errors: 0, Skipped: 0, Time elapsed: 40.114 s - in org.apache.hadoop.ozone.scm.pipeline.TestSCMPipelineBytesWrittenMetrics
[INFO] Running org.apache.hadoop.ozone.scm.pipeline.TestSCMPipelineMetrics
[INFO] Tests run: 3, Failures: 0, Errors: 0, Skipped: 0, Time elapsed: 116.592 s - in org.apache.hadoop.ozone.scm.pipeline.TestSCMPipelineMetrics
[INFO] Running org.apache.hadoop.ozone.scm.pipeline.TestPipelineManagerMXBean
[INFO] Tests run: 1, Failures: 0, Errors: 0, Skipped: 0, Time elapsed: 36.754 s - in org.apache.hadoop.ozone.scm.pipeline.TestPipelineManagerMXBean
[INFO] Running org.apache.hadoop.ozone.scm.TestXceiverClientGrpc
[INFO] Tests run: 4, Failures: 0, Errors: 0, Skipped: 0, Time elapsed: 1.889 s - in org.apache.hadoop.ozone.scm.TestXceiverClientGrpc
[INFO] Running org.apache.hadoop.ozone.scm.TestXceiverClientManager
[INFO] Tests run: 4, Failures: 0, Errors: 0, Skipped: 0, Time elapsed: 36.472 s - in org.apache.hadoop.ozone.scm.TestXceiverClientManager
[INFO] Running org.apache.hadoop.ozone.scm.TestAllocateContainer
[INFO] Tests run: 2, Failures: 0, Errors: 0, Skipped: 0, Time elapsed: 41.081 s - in org.apache.hadoop.ozone.scm.TestAllocateContainer
[INFO] Running org.apache.hadoop.ozone.scm.TestXceiverClientMetrics
[INFO] Tests run: 1, Failures: 0, Errors: 0, Skipped: 0, Time elapsed: 39.296 s - in org.apache.hadoop.ozone.scm.TestXceiverClientMetrics
[INFO] Running org.apache.hadoop.ozone.scm.TestSCMInstallSnapshotWithHA
[INFO] Tests run: 3, Failures: 0, Errors: 0, Skipped: 0, Time elapsed: 182.227 s - in org.apache.hadoop.ozone.scm.TestSCMInstallSnapshotWithHA
[INFO] Running org.apache.hadoop.ozone.scm.node.TestDecommissionAndMaintenance
[INFO] Tests run: 8, Failures: 0, Errors: 0, Skipped: 0, Time elapsed: 386.079 s - in org.apache.hadoop.ozone.scm.node.TestDecommissionAndMaintenance
[INFO] Running org.apache.hadoop.ozone.scm.node.TestQueryNode
[WARNING] Tests run: 1, Failures: 0, Errors: 0, Skipped: 1, Time elapsed: 0.002 s - in org.apache.hadoop.ozone.scm.node.TestQueryNode
[INFO] Running org.apache.hadoop.ozone.scm.TestCloseContainer
[INFO] Tests run: 1, Failures: 0, Errors: 0, Skipped: 0, Time elapsed: 48.319 s - in org.apache.hadoop.ozone.scm.TestCloseContainer
[INFO] Running org.apache.hadoop.ozone.scm.TestFailoverWithSCMHA
[INFO] Tests run: 2, Failures: 0, Errors: 0, Skipped: 0, Time elapsed: 99.441 s - in org.apache.hadoop.ozone.scm.TestFailoverWithSCMHA
[INFO] Running org.apache.hadoop.ozone.scm.TestGetCommittedBlockLengthAndPutKey
[INFO] Tests run: 3, Failures: 0, Errors: 0, Skipped: 0, Time elapsed: 37.524 s - in org.apache.hadoop.ozone.scm.TestGetCommittedBlockLengthAndPutKey
[INFO] Running org.apache.hadoop.ozone.scm.TestStorageContainerManagerHA
[ERROR] Tests run: 3, Failures: 0, Errors: 1, Skipped: 0, Time elapsed: 135.999 s <<< FAILURE! - in org.apache.hadoop.ozone.scm.TestStorageContainerManagerHA
[ERROR] testAllSCMAreRunning  Time elapsed: 15.913 s  <<< ERROR!
java.io.IOException: Failed init RocksDB, db path : /home/runner/work/ozone/ozone/hadoop-ozone/integration-test/target/test-dir/MiniOzoneClusterImpl-567ee595-0d17-479d-b372-76012e76e7dd/omNode-1/om.db, exception :org.rocksdb.RocksDBException lock hold by current process, acquire time 1633364237 acquiring thread 140663645288192: /home/runner/work/ozone/ozone/hadoop-ozone/integration-test/target/test-dir/MiniOzoneClusterImpl-567ee595-0d17-479d-b372-76012e76e7dd/omNode-1/om.db/LOCK: No locks available; status : IOError; message : lock hold by current process, acquire time 1633364237 acquiring thread 140663645288192: /home/runner/work/ozone/ozone/hadoop-ozone/integration-test/target/test-dir/MiniOzoneClusterImpl-567ee595-0d17-479d-b372-76012e76e7dd/omNode-1/om.db/LOCK: No locks available
	at org.apache.hadoop.hdds.utils.HddsServerUtil.toIOException(HddsServerUtil.java:564)
	at org.apache.hadoop.hdds.utils.db.RDBStore.<init>(RDBStore.java:164)
	at org.apache.hadoop.hdds.utils.db.DBStoreBuilder.build(DBStoreBuilder.java:191)
	at org.apache.hadoop.ozone.om.OmMetadataManagerImpl.loadDB(OmMetadataManagerImpl.java:400)
	at org.apache.hadoop.ozone.om.OmMetadataManagerImpl.loadDB(OmMetadataManagerImpl.java:390)
	at org.apache.hadoop.ozone.om.OmMetadataManagerImpl.start(OmMetadataManagerImpl.java:382)
	at org.apache.hadoop.ozone.om.OmMetadataManagerImpl.<init>(OmMetadataManagerImpl.java:247)
	at org.apache.hadoop.ozone.om.OzoneManager.instantiateServices(OzoneManager.java:592)
	at org.apache.hadoop.ozone.om.OzoneManager.<init>(OzoneManager.java:501)
	at org.apache.hadoop.ozone.om.OzoneManager.createOm(OzoneManager.java:558)
	at org.apache.hadoop.ozone.MiniOzoneHAClusterImpl$Builder.createOMService(MiniOzoneHAClusterImpl.java:476)
	at org.apache.hadoop.ozone.MiniOzoneHAClusterImpl$Builder.build(MiniOzoneHAClusterImpl.java:387)
	at org.apache.hadoop.ozone.scm.TestStorageContainerManagerHA.init(TestStorageContainerManagerHA.java:103)
	at sun.reflect.NativeMethodAccessorImpl.invoke0(Native Method)
	at sun.reflect.NativeMethodAccessorImpl.invoke(NativeMethodAccessorImpl.java:62)
	at sun.reflect.DelegatingMethodAccessorImpl.invoke(DelegatingMethodAccessorImpl.java:43)
	at java.lang.reflect.Method.invoke(Method.java:498)
	at org.junit.runners.model.FrameworkMethod$1.runReflectiveCall(FrameworkMethod.java:59)
	at org.junit.internal.runners.model.ReflectiveCallable.run(ReflectiveCallable.java:12)
	at org.junit.runners.model.FrameworkMethod.invokeExplosively(FrameworkMethod.java:56)
	at org.junit.internal.runners.statements.RunBefores.invokeMethod(RunBefores.java:33)
	at org.junit.internal.runners.statements.RunBefores.evaluate(RunBefores.java:24)
	at org.junit.internal.runners.statements.RunAfters.evaluate(RunAfters.java:27)
	at org.junit.internal.runners.statements.FailOnTimeout$CallableStatement.call(FailOnTimeout.java:288)
	at org.junit.internal.runners.statements.FailOnTimeout$CallableStatement.call(FailOnTimeout.java:282)
	at java.util.concurrent.FutureTask.run(FutureTask.java:266)
	at java.lang.Thread.run(Thread.java:748)
Caused by: org.rocksdb.RocksDBException: lock hold by current process, acquire time 1633364237 acquiring thread 140663645288192: /home/runner/work/ozone/ozone/hadoop-ozone/integration-test/target/test-dir/MiniOzoneClusterImpl-567ee595-0d17-479d-b372-76012e76e7dd/omNode-1/om.db/LOCK: No locks available
	at org.rocksdb.RocksDB.open(Native Method)
	at org.rocksdb.RocksDB.open(RocksDB.java:306)
	at org.apache.hadoop.hdds.utils.db.RDBStore.<init>(RDBStore.java:119)
	... 25 more

[INFO] Running org.apache.hadoop.ozone.scm.TestSCMContainerPlacementPolicyMetrics
[WARNING] Tests run: 1, Failures: 0, Errors: 0, Skipped: 1, Time elapsed: 0.001 s - in org.apache.hadoop.ozone.scm.TestSCMContainerPlacementPolicyMetrics
[INFO] Running org.apache.hadoop.ozone.scm.TestSCMNodeManagerMXBean
[INFO] Tests run: 2, Failures: 0, Errors: 0, Skipped: 0, Time elapsed: 41.857 s - in org.apache.hadoop.ozone.scm.TestSCMNodeManagerMXBean
[INFO] Running org.apache.hadoop.ozone.scm.TestContainerSmallFile
[INFO] Tests run: 4, Failures: 0, Errors: 0, Skipped: 0, Time elapsed: 41.729 s - in org.apache.hadoop.ozone.scm.TestContainerSmallFile
[INFO] Running org.apache.hadoop.ozone.TestStorageContainerManager
[INFO] Tests run: 12, Failures: 0, Errors: 0, Skipped: 0, Time elapsed: 376.845 s - in org.apache.hadoop.ozone.TestStorageContainerManager
[INFO] 
[INFO] Results:
[INFO] 
[ERROR] Errors: 
[ERROR]   TestStorageContainerManagerHA.init:103 » IO Failed init RocksDB, db path : /ho...
[INFO] 
[ERROR] Tests run: 255, Failures: 0, Errors: 1, Skipped: 15
[INFO] 
[INFO] 
[INFO] ------------------------------------------------------------------------
[INFO] Skipping Apache Ozone Mini Ozone Chaos Tests
[INFO] This project has been banned from the build due to previous failures.
[INFO] ------------------------------------------------------------------------
[INFO] ------------------------------------------------------------------------
[INFO] Reactor Summary for Apache Ozone Integration Tests 1.2.0-SNAPSHOT:
[INFO] 
[INFO] Apache Ozone Integration Tests ..................... FAILURE [  01:32 h]
[INFO] Apache Ozone Mini Ozone Chaos Tests ................ SKIPPED
[INFO] ------------------------------------------------------------------------
[INFO] BUILD FAILURE
[INFO] ------------------------------------------------------------------------
[INFO] Total time:  01:32 h
[INFO] Finished at: 2021-10-04T16:25:05Z
[INFO] ------------------------------------------------------------------------
[ERROR] Failed to execute goal org.apache.maven.plugins:maven-surefire-plugin:3.0.0-M1:test (default-test) on project ozone-integration-test: There are test failures.
[ERROR] 
[ERROR] Please refer to /home/runner/work/ozone/ozone/hadoop-ozone/integration-test/target/surefire-reports for the individual test results.
[ERROR] Please refer to dump files (if any exist) [date].dump, [date]-jvmRun[N].dump and [date].dumpstream.
[ERROR] -> [Help 1]
[ERROR] 
[ERROR] To see the full stack trace of the errors, re-run Maven with the -e switch.
[ERROR] Re-run Maven using the -X switch to enable full debug logging.
[ERROR] 
[ERROR] For more information about the errors and possible solutions, please read the following articles:
[ERROR] [Help 1] http://cwiki.apache.org/confluence/display/MAVEN/MojoFailureException
