[INFO] Scanning for projects...
[INFO] ------------------------------------------------------------------------
[INFO] Detecting the operating system and CPU architecture
[INFO] ------------------------------------------------------------------------
[INFO] os.detected.name: linux
[INFO] os.detected.arch: x86_64
[INFO] os.detected.version: 5.4
[INFO] os.detected.version.major: 5
[INFO] os.detected.version.minor: 4
[INFO] os.detected.release: ubuntu
[INFO] os.detected.release.version: 18.04
[INFO] os.detected.release.like.ubuntu: true
[INFO] os.detected.release.like.debian: true
[INFO] os.detected.classifier: linux-x86_64
[INFO] ------------------------------------------------------------------------
[INFO] Reactor Build Order:
[INFO] 
[INFO] Apache Ozone Integration Tests                                     [jar]
[INFO] Apache Ozone Mini Ozone Chaos Tests                                [jar]
[INFO] 
[INFO] --------------< org.apache.ozone:ozone-integration-test >---------------
[INFO] Building Apache Ozone Integration Tests 1.3.0-SNAPSHOT             [1/2]
[INFO] --------------------------------[ jar ]---------------------------------
[INFO] 
[INFO] --- maven-antrun-plugin:1.3:run (create-testdirs) @ ozone-integration-test ---
[INFO] Executing tasks
[INFO] Executed tasks
[INFO] 
[INFO] --- jacoco-maven-plugin:0.8.5:prepare-agent (default-prepare-agent) @ ozone-integration-test ---
[WARNING] The artifact xml-apis:xml-apis:jar:2.0.2 has been relocated to xml-apis:xml-apis:jar:1.0.b2
[INFO] argLine set to -javaagent:/home/runner/.m2/repository/org/jacoco/org.jacoco.agent/0.8.5/org.jacoco.agent-0.8.5-runtime.jar=destfile=/home/runner/work/ozone/ozone/hadoop-ozone/integration-test/target/jacoco.exec,includes=org.apache.hadoop.hdds.*:org.apache.hadoop.ozone.*:org.apache.hadoop.fs.ozone.*
[INFO] 
[INFO] --- maven-remote-resources-plugin:1.5:process (default) @ ozone-integration-test ---
[INFO] 
[INFO] --- maven-resources-plugin:3.1.0:resources (default-resources) @ ozone-integration-test ---
[INFO] Using 'UTF-8' encoding to copy filtered resources.
[INFO] skip non existing resourceDirectory /home/runner/work/ozone/ozone/hadoop-ozone/integration-test/src/main/resources
[INFO] Copying 2 resources
[INFO] 
[INFO] --- maven-compiler-plugin:3.1:compile (default-compile) @ ozone-integration-test ---
[INFO] No sources to compile
[INFO] 
[INFO] --- maven-resources-plugin:3.1.0:testResources (default-testResources) @ ozone-integration-test ---
[INFO] Using 'UTF-8' encoding to copy filtered resources.
[INFO] Copying 21 resources
[INFO] Copying 2 resources
[INFO] 
[INFO] --- maven-compiler-plugin:3.1:testCompile (default-testCompile) @ ozone-integration-test ---
[INFO] Compiling 11 source files to /home/runner/work/ozone/ozone/hadoop-ozone/integration-test/target/test-classes
[INFO] 
[INFO] --- maven-surefire-plugin:3.0.0-M1:test (default-test) @ ozone-integration-test ---
[INFO] 
[INFO] -------------------------------------------------------
[INFO]  T E S T S
[INFO] -------------------------------------------------------
[INFO] Running org.apache.hadoop.hdds.scm.TestSCMSnapshot
[INFO] Tests run: 1, Failures: 0, Errors: 0, Skipped: 0, Time elapsed: 54.605 s - in org.apache.hadoop.hdds.scm.TestSCMSnapshot
[INFO] Running org.apache.hadoop.hdds.scm.pipeline.TestPipelineClose
[WARNING] Tests run: 4, Failures: 0, Errors: 0, Skipped: 1, Time elapsed: 156.121 s - in org.apache.hadoop.hdds.scm.pipeline.TestPipelineClose
[INFO] Running org.apache.hadoop.hdds.scm.pipeline.TestNode2PipelineMap
[INFO] Tests run: 1, Failures: 0, Errors: 0, Skipped: 0, Time elapsed: 61.663 s - in org.apache.hadoop.hdds.scm.pipeline.TestNode2PipelineMap
[INFO] Running org.apache.hadoop.hdds.scm.pipeline.TestSCMRestart
[INFO] Tests run: 1, Failures: 0, Errors: 0, Skipped: 0, Time elapsed: 60.696 s - in org.apache.hadoop.hdds.scm.pipeline.TestSCMRestart
[INFO] Running org.apache.hadoop.hdds.scm.pipeline.TestNodeFailure
[INFO] Tests run: 1, Failures: 0, Errors: 0, Skipped: 0, Time elapsed: 112.538 s - in org.apache.hadoop.hdds.scm.pipeline.TestNodeFailure
[INFO] Running org.apache.hadoop.hdds.scm.pipeline.TestRatisPipelineCreateAndDestroy
[WARNING] Tests run: 1, Failures: 0, Errors: 0, Skipped: 1, Time elapsed: 0.006 s - in org.apache.hadoop.hdds.scm.pipeline.TestRatisPipelineCreateAndDestroy
[INFO] Running org.apache.hadoop.hdds.scm.pipeline.TestMultiRaftSetup
[INFO] Tests run: 3, Failures: 0, Errors: 0, Skipped: 0, Time elapsed: 184.448 s - in org.apache.hadoop.hdds.scm.pipeline.TestMultiRaftSetup
[INFO] Running org.apache.hadoop.hdds.scm.pipeline.TestLeaderChoosePolicy
[WARNING] Tests run: 1, Failures: 0, Errors: 0, Skipped: 1, Time elapsed: 0.001 s - in org.apache.hadoop.hdds.scm.pipeline.TestLeaderChoosePolicy
[INFO] Running org.apache.hadoop.hdds.scm.TestSCMDbCheckpointServlet
[INFO] Tests run: 1, Failures: 0, Errors: 0, Skipped: 0, Time elapsed: 64.907 s - in org.apache.hadoop.hdds.scm.TestSCMDbCheckpointServlet
[INFO] Running org.apache.hadoop.hdds.scm.container.TestContainerStateManagerIntegration
[WARNING] Tests run: 1, Failures: 0, Errors: 0, Skipped: 1, Time elapsed: 0.001 s - in org.apache.hadoop.hdds.scm.container.TestContainerStateManagerIntegration
[INFO] Running org.apache.hadoop.hdds.scm.container.metrics.TestSCMContainerManagerMetrics
[INFO] Tests run: 2, Failures: 0, Errors: 0, Skipped: 0, Time elapsed: 54.066 s - in org.apache.hadoop.hdds.scm.container.metrics.TestSCMContainerManagerMetrics
[INFO] Running org.apache.hadoop.hdds.scm.TestRatisPipelineLeader
[WARNING] Tests run: 1, Failures: 0, Errors: 0, Skipped: 1, Time elapsed: 0.002 s - in org.apache.hadoop.hdds.scm.TestRatisPipelineLeader
[INFO] Running org.apache.hadoop.hdds.scm.TestSCMInstallSnapshot
[INFO] Tests run: 2, Failures: 0, Errors: 0, Skipped: 0, Time elapsed: 49.624 s - in org.apache.hadoop.hdds.scm.TestSCMInstallSnapshot
[INFO] Running org.apache.hadoop.hdds.scm.safemode.TestSCMSafeModeWithPipelineRules
[WARNING] Tests run: 1, Failures: 0, Errors: 0, Skipped: 1, Time elapsed: 0.002 s - in org.apache.hadoop.hdds.scm.safemode.TestSCMSafeModeWithPipelineRules
[INFO] Running org.apache.hadoop.hdds.upgrade.TestHDDSUpgrade
[ERROR] Tests run: 13, Failures: 0, Errors: 1, Skipped: 4, Time elapsed: 507.45 s <<< FAILURE! - in org.apache.hadoop.hdds.upgrade.TestHDDSUpgrade
[ERROR] testFinalizationFromInitialVersionToLatestVersion  Time elapsed: 100.19 s  <<< ERROR!
java.io.IOException: Failed to obtain available cluster in time
	at org.apache.hadoop.ozone.MiniOzoneClusterProvider.provide(MiniOzoneClusterProvider.java:162)
	at org.apache.hadoop.hdds.upgrade.TestHDDSUpgrade.init(TestHDDSUpgrade.java:174)
	at org.apache.hadoop.hdds.upgrade.TestHDDSUpgrade.setUp(TestHDDSUpgrade.java:136)
	at sun.reflect.NativeMethodAccessorImpl.invoke0(Native Method)
	at sun.reflect.NativeMethodAccessorImpl.invoke(NativeMethodAccessorImpl.java:62)
	at sun.reflect.DelegatingMethodAccessorImpl.invoke(DelegatingMethodAccessorImpl.java:43)
	at java.lang.reflect.Method.invoke(Method.java:498)
	at org.junit.runners.model.FrameworkMethod$1.runReflectiveCall(FrameworkMethod.java:59)
	at org.junit.internal.runners.model.ReflectiveCallable.run(ReflectiveCallable.java:12)
	at org.junit.runners.model.FrameworkMethod.invokeExplosively(FrameworkMethod.java:56)
	at org.junit.internal.runners.statements.RunBefores.invokeMethod(RunBefores.java:33)
	at org.junit.internal.runners.statements.RunBefores.evaluate(RunBefores.java:24)
	at org.junit.internal.runners.statements.RunAfters.evaluate(RunAfters.java:27)
	at org.junit.internal.runners.statements.FailOnTimeout$CallableStatement.call(FailOnTimeout.java:288)
	at org.junit.internal.runners.statements.FailOnTimeout$CallableStatement.call(FailOnTimeout.java:282)
	at java.util.concurrent.FutureTask.run(FutureTask.java:266)
	at java.lang.Thread.run(Thread.java:748)

[INFO] Running org.apache.hadoop.fs.ozone.TestOzoneFileSystemWithLinks
[INFO] Tests run: 1, Failures: 0, Errors: 0, Skipped: 0, Time elapsed: 50.67 s - in org.apache.hadoop.fs.ozone.TestOzoneFileSystemWithLinks
[INFO] Running org.apache.hadoop.fs.ozone.TestOzoneFileSystemPrefixParser
[INFO] Tests run: 1, Failures: 0, Errors: 0, Skipped: 0, Time elapsed: 50.064 s - in org.apache.hadoop.fs.ozone.TestOzoneFileSystemPrefixParser
[INFO] Running org.apache.hadoop.fs.ozone.TestOzoneFSWithObjectStoreCreate
[INFO] Tests run: 6, Failures: 0, Errors: 0, Skipped: 0, Time elapsed: 53.466 s - in org.apache.hadoop.fs.ozone.TestOzoneFSWithObjectStoreCreate
[INFO] Running org.apache.hadoop.fs.ozone.TestOzoneFSInputStream
[INFO] Tests run: 3, Failures: 0, Errors: 0, Skipped: 0, Time elapsed: 69.952 s - in org.apache.hadoop.fs.ozone.TestOzoneFSInputStream
[INFO] Running org.apache.hadoop.fs.ozone.TestOzoneFileInterfaces
[WARNING] Tests run: 20, Failures: 0, Errors: 0, Skipped: 2, Time elapsed: 103.575 s - in org.apache.hadoop.fs.ozone.TestOzoneFileInterfaces
[INFO] Running org.apache.hadoop.fs.ozone.TestDirectoryDeletingServiceWithFSO
[INFO] Tests run: 4, Failures: 0, Errors: 0, Skipped: 0, Time elapsed: 94.536 s - in org.apache.hadoop.fs.ozone.TestDirectoryDeletingServiceWithFSO
[INFO] Running org.apache.hadoop.fs.ozone.TestOzoneFileSystemWithFSO
[WARNING] Tests run: 74, Failures: 0, Errors: 0, Skipped: 10, Time elapsed: 92.95 s - in org.apache.hadoop.fs.ozone.TestOzoneFileSystemWithFSO
[INFO] Running org.apache.hadoop.fs.ozone.contract.rooted.ITestRootedOzoneContractMkdir
[INFO] Tests run: 8, Failures: 0, Errors: 0, Skipped: 0, Time elapsed: 61.065 s - in org.apache.hadoop.fs.ozone.contract.rooted.ITestRootedOzoneContractMkdir
[INFO] Running org.apache.hadoop.fs.ozone.contract.rooted.ITestRootedOzoneContractUnbuffer
[INFO] Tests run: 6, Failures: 0, Errors: 0, Skipped: 0, Time elapsed: 61.444 s - in org.apache.hadoop.fs.ozone.contract.rooted.ITestRootedOzoneContractUnbuffer
[INFO] Running org.apache.hadoop.fs.ozone.contract.rooted.ITestRootedOzoneContractDelete
[INFO] Tests run: 8, Failures: 0, Errors: 0, Skipped: 0, Time elapsed: 67.127 s - in org.apache.hadoop.fs.ozone.contract.rooted.ITestRootedOzoneContractDelete
[INFO] Running org.apache.hadoop.fs.ozone.contract.rooted.ITestRootedOzoneContractOpen
[INFO] Tests run: 17, Failures: 0, Errors: 0, Skipped: 0, Time elapsed: 63.206 s - in org.apache.hadoop.fs.ozone.contract.rooted.ITestRootedOzoneContractOpen
[INFO] Running org.apache.hadoop.fs.ozone.contract.rooted.ITestRootedOzoneContractCreate
[WARNING] Tests run: 16, Failures: 0, Errors: 0, Skipped: 2, Time elapsed: 65.028 s - in org.apache.hadoop.fs.ozone.contract.rooted.ITestRootedOzoneContractCreate
[INFO] Running org.apache.hadoop.fs.ozone.contract.rooted.ITestRootedOzoneContractSeek
[INFO] Tests run: 18, Failures: 0, Errors: 0, Skipped: 0, Time elapsed: 77.693 s - in org.apache.hadoop.fs.ozone.contract.rooted.ITestRootedOzoneContractSeek
[INFO] Running org.apache.hadoop.fs.ozone.contract.rooted.ITestRootedOzoneContractRename
[INFO] Tests run: 10, Failures: 0, Errors: 0, Skipped: 0, Time elapsed: 62.001 s - in org.apache.hadoop.fs.ozone.contract.rooted.ITestRootedOzoneContractRename
[INFO] Running org.apache.hadoop.fs.ozone.contract.rooted.ITestRootedOzoneContractDistCp
[INFO] Tests run: 10, Failures: 0, Errors: 0, Skipped: 0, Time elapsed: 142.216 s - in org.apache.hadoop.fs.ozone.contract.rooted.ITestRootedOzoneContractDistCp
[INFO] Running org.apache.hadoop.fs.ozone.contract.rooted.ITestRootedOzoneContractGetFileStatus
[INFO] Tests run: 20, Failures: 0, Errors: 0, Skipped: 0, Time elapsed: 68.136 s - in org.apache.hadoop.fs.ozone.contract.rooted.ITestRootedOzoneContractGetFileStatus
[INFO] Running org.apache.hadoop.fs.ozone.contract.rooted.ITestRootedOzoneContractRootDir
[INFO] Tests run: 9, Failures: 0, Errors: 0, Skipped: 0, Time elapsed: 64.962 s - in org.apache.hadoop.fs.ozone.contract.rooted.ITestRootedOzoneContractRootDir
[INFO] Running org.apache.hadoop.fs.ozone.contract.ITestOzoneContractOpen
[INFO] Tests run: 34, Failures: 0, Errors: 0, Skipped: 0, Time elapsed: 126.7 s - in org.apache.hadoop.fs.ozone.contract.ITestOzoneContractOpen
[INFO] Running org.apache.hadoop.fs.ozone.contract.ITestOzoneContractGetFileStatus
[INFO] Tests run: 40, Failures: 0, Errors: 0, Skipped: 0, Time elapsed: 139.012 s - in org.apache.hadoop.fs.ozone.contract.ITestOzoneContractGetFileStatus
[INFO] Running org.apache.hadoop.fs.ozone.contract.ITestOzoneContractRootDir
[INFO] Tests run: 18, Failures: 0, Errors: 0, Skipped: 0, Time elapsed: 127.659 s - in org.apache.hadoop.fs.ozone.contract.ITestOzoneContractRootDir
[INFO] Running org.apache.hadoop.fs.ozone.contract.ITestOzoneContractSeek
[INFO] Tests run: 18, Failures: 0, Errors: 0, Skipped: 0, Time elapsed: 63.525 s - in org.apache.hadoop.fs.ozone.contract.ITestOzoneContractSeek
[INFO] Running org.apache.hadoop.fs.ozone.contract.ITestOzoneContractRename
[INFO] Tests run: 20, Failures: 0, Errors: 0, Skipped: 0, Time elapsed: 148.666 s - in org.apache.hadoop.fs.ozone.contract.ITestOzoneContractRename
[INFO] Running org.apache.hadoop.fs.ozone.contract.ITestOzoneContractDistCpWithFSO
[INFO] Tests run: 10, Failures: 0, Errors: 0, Skipped: 0, Time elapsed: 141.046 s - in org.apache.hadoop.fs.ozone.contract.ITestOzoneContractDistCpWithFSO
[INFO] Running org.apache.hadoop.fs.ozone.contract.ITestOzoneContractDelete
[INFO] Tests run: 16, Failures: 0, Errors: 0, Skipped: 0, Time elapsed: 126.941 s - in org.apache.hadoop.fs.ozone.contract.ITestOzoneContractDelete
[INFO] Running org.apache.hadoop.fs.ozone.contract.ITestOzoneContractMkdir
[INFO] Tests run: 16, Failures: 0, Errors: 0, Skipped: 0, Time elapsed: 130.651 s - in org.apache.hadoop.fs.ozone.contract.ITestOzoneContractMkdir
[INFO] Running org.apache.hadoop.fs.ozone.contract.ITestOzoneContractDistCp
[INFO] Tests run: 10, Failures: 0, Errors: 0, Skipped: 0, Time elapsed: 142.678 s - in org.apache.hadoop.fs.ozone.contract.ITestOzoneContractDistCp
[INFO] Running org.apache.hadoop.fs.ozone.contract.ITestOzoneContractUnbuffer
[INFO] Tests run: 6, Failures: 0, Errors: 0, Skipped: 0, Time elapsed: 62.289 s - in org.apache.hadoop.fs.ozone.contract.ITestOzoneContractUnbuffer
[INFO] Running org.apache.hadoop.fs.ozone.contract.ITestOzoneContractCreate
[WARNING] Tests run: 32, Failures: 0, Errors: 0, Skipped: 4, Time elapsed: 129.2 s - in org.apache.hadoop.fs.ozone.contract.ITestOzoneContractCreate
[INFO] Running org.apache.hadoop.fs.ozone.TestOzoneFileInterfacesWithFSO
[WARNING] Tests run: 20, Failures: 0, Errors: 0, Skipped: 12, Time elapsed: 118.542 s - in org.apache.hadoop.fs.ozone.TestOzoneFileInterfacesWithFSO
[INFO] Running org.apache.hadoop.fs.ozone.TestRootedOzoneFileSystemWithFSO
[WARNING] Tests run: 66, Failures: 0, Errors: 0, Skipped: 20, Time elapsed: 119.195 s - in org.apache.hadoop.fs.ozone.TestRootedOzoneFileSystemWithFSO
[INFO] Running org.apache.hadoop.fs.ozone.TestRootedOzoneFileSystem
[WARNING] Tests run: 160, Failures: 0, Errors: 0, Skipped: 18, Time elapsed: 325.829 s - in org.apache.hadoop.fs.ozone.TestRootedOzoneFileSystem
[INFO] Running org.apache.hadoop.fs.ozone.TestOzoneFsHAURLs
[INFO] Tests run: 2, Failures: 0, Errors: 0, Skipped: 0, Time elapsed: 73.951 s - in org.apache.hadoop.fs.ozone.TestOzoneFsHAURLs
[INFO] Running org.apache.hadoop.fs.ozone.TestOzoneFileSystemMissingParent
[INFO] Tests run: 2, Failures: 0, Errors: 0, Skipped: 0, Time elapsed: 56.354 s - in org.apache.hadoop.fs.ozone.TestOzoneFileSystemMissingParent
[INFO] Running org.apache.hadoop.fs.ozone.TestOzoneFileSystemMetrics
[INFO] Tests run: 3, Failures: 0, Errors: 0, Skipped: 0, Time elapsed: 61.51 s - in org.apache.hadoop.fs.ozone.TestOzoneFileSystemMetrics
[INFO] Running org.apache.hadoop.fs.ozone.TestOzoneFileSystem
[INFO] Tests run: 132, Failures: 0, Errors: 0, Skipped: 0, Time elapsed: 226.891 s - in org.apache.hadoop.fs.ozone.TestOzoneFileSystem
[INFO] 
[INFO] Results:
[INFO] 
[ERROR] Errors: 
[ERROR]   TestHDDSUpgrade.setUp:136->init:174 » IO Failed to obtain available cluster in...
[INFO] 
[ERROR] Tests run: 870, Failures: 0, Errors: 1, Skipped: 78
[INFO] 
[INFO] 
[INFO] ------------------------------------------------------------------------
[INFO] Skipping Apache Ozone Mini Ozone Chaos Tests
[INFO] This project has been banned from the build due to previous failures.
[INFO] ------------------------------------------------------------------------
[INFO] ------------------------------------------------------------------------
[INFO] Reactor Summary for Apache Ozone Integration Tests 1.3.0-SNAPSHOT:
[INFO] 
[INFO] Apache Ozone Integration Tests ..................... FAILURE [  01:22 h]
[INFO] Apache Ozone Mini Ozone Chaos Tests ................ SKIPPED
[INFO] ------------------------------------------------------------------------
[INFO] BUILD FAILURE
[INFO] ------------------------------------------------------------------------
[INFO] Total time:  01:22 h
[INFO] Finished at: 2022-02-12T06:43:47Z
[INFO] ------------------------------------------------------------------------
[ERROR] Failed to execute goal org.apache.maven.plugins:maven-surefire-plugin:3.0.0-M1:test (default-test) on project ozone-integration-test: There are test failures.
[ERROR] 
[ERROR] Please refer to /home/runner/work/ozone/ozone/hadoop-ozone/integration-test/target/surefire-reports for the individual test results.
[ERROR] Please refer to dump files (if any exist) [date].dump, [date]-jvmRun[N].dump and [date].dumpstream.
[ERROR] -> [Help 1]
[ERROR] 
[ERROR] To see the full stack trace of the errors, re-run Maven with the -e switch.
[ERROR] Re-run Maven using the -X switch to enable full debug logging.
[ERROR] 
[ERROR] For more information about the errors and possible solutions, please read the following articles:
[ERROR] [Help 1] http://cwiki.apache.org/confluence/display/MAVEN/MojoFailureException
