[INFO] Scanning for projects...
[WARNING] 
[WARNING] Some problems were encountered while building the effective model for org.apache.ozone:ozone-common:jar:1.3.0-SNAPSHOT
[WARNING] 'dependencies.dependency.(groupId:artifactId:type:classifier)' must be unique: org.mockito:mockito-core:jar -> duplicate declaration of version (?) @ line 68, column 17
[WARNING] 
[WARNING] It is highly recommended to fix these problems because they threaten the stability of your build.
[WARNING] 
[WARNING] For this reason, future Maven versions might no longer support building such malformed projects.
[WARNING] 
[INFO] ------------------------------------------------------------------------
[INFO] Detecting the operating system and CPU architecture
[INFO] ------------------------------------------------------------------------
[INFO] os.detected.name: linux
[INFO] os.detected.arch: x86_64
[INFO] os.detected.version: 5.4
[INFO] os.detected.version.major: 5
[INFO] os.detected.version.minor: 4
[INFO] os.detected.release: ubuntu
[INFO] os.detected.release.version: 18.04
[INFO] os.detected.release.like.ubuntu: true
[INFO] os.detected.release.like.debian: true
[INFO] os.detected.classifier: linux-x86_64
[INFO] ------------------------------------------------------------------------
[INFO] Reactor Build Order:
[INFO] 
[INFO] Apache Ozone Integration Tests                                     [jar]
[INFO] Apache Ozone Mini Ozone Chaos Tests                                [jar]
[INFO] 
[INFO] --------------< org.apache.ozone:ozone-integration-test >---------------
[INFO] Building Apache Ozone Integration Tests 1.3.0-SNAPSHOT             [1/2]
[INFO] --------------------------------[ jar ]---------------------------------
[INFO] 
[INFO] --- maven-antrun-plugin:1.3:run (create-testdirs) @ ozone-integration-test ---
[INFO] Executing tasks
[INFO] Executed tasks
[INFO] 
[INFO] --- jacoco-maven-plugin:0.8.5:prepare-agent (default-prepare-agent) @ ozone-integration-test ---
[INFO] argLine set to -javaagent:/home/runner/.m2/repository/org/jacoco/org.jacoco.agent/0.8.5/org.jacoco.agent-0.8.5-runtime.jar=destfile=/home/runner/work/ozone/ozone/hadoop-ozone/integration-test/target/jacoco.exec,includes=org.apache.hadoop.hdds.*:org.apache.hadoop.ozone.*:org.apache.hadoop.fs.ozone.*
[INFO] 
[INFO] --- maven-remote-resources-plugin:1.5:process (default) @ ozone-integration-test ---
[INFO] 
[INFO] --- maven-resources-plugin:3.1.0:resources (default-resources) @ ozone-integration-test ---
[INFO] Using 'UTF-8' encoding to copy filtered resources.
[INFO] skip non existing resourceDirectory /home/runner/work/ozone/ozone/hadoop-ozone/integration-test/src/main/resources
[INFO] Copying 2 resources
[INFO] 
[INFO] --- maven-compiler-plugin:3.1:compile (default-compile) @ ozone-integration-test ---
[INFO] No sources to compile
[INFO] 
[INFO] --- maven-resources-plugin:3.1.0:testResources (default-testResources) @ ozone-integration-test ---
[INFO] Using 'UTF-8' encoding to copy filtered resources.
[INFO] Copying 21 resources
[INFO] Copying 2 resources
[INFO] 
[INFO] --- maven-compiler-plugin:3.1:testCompile (default-testCompile) @ ozone-integration-test ---
[INFO] Compiling 12 source files to /home/runner/work/ozone/ozone/hadoop-ozone/integration-test/target/test-classes
[INFO] 
[INFO] --- maven-surefire-plugin:3.0.0-M5:test (default-test) @ ozone-integration-test ---
[INFO] 
[INFO] -------------------------------------------------------
[INFO]  T E S T S
[INFO] -------------------------------------------------------
[INFO] Running org.apache.hadoop.ozone.TestSecureOzoneCluster
[INFO] Tests run: 11, Failures: 0, Errors: 0, Skipped: 0, Time elapsed: 68.526 s - in org.apache.hadoop.ozone.TestSecureOzoneCluster
[INFO] Running org.apache.hadoop.ozone.TestStorageContainerManager
[INFO] Tests run: 12, Failures: 0, Errors: 0, Skipped: 0, Time elapsed: 422.159 s - in org.apache.hadoop.ozone.TestStorageContainerManager
[INFO] Running org.apache.hadoop.ozone.TestMiniOzoneOMHACluster
[INFO] Tests run: 1, Failures: 0, Errors: 0, Skipped: 0, Time elapsed: 52.921 s - in org.apache.hadoop.ozone.TestMiniOzoneOMHACluster
[INFO] Running org.apache.hadoop.ozone.freon.TestDataValidateWithUnsafeByteOperations
[INFO] Tests run: 2, Failures: 0, Errors: 0, Skipped: 0, Time elapsed: 72.136 s - in org.apache.hadoop.ozone.freon.TestDataValidateWithUnsafeByteOperations
[INFO] Running org.apache.hadoop.ozone.freon.TestHadoopDirTreeGeneratorWithFSO
[INFO] Tests run: 1, Failures: 0, Errors: 0, Skipped: 0, Time elapsed: 76.259 s - in org.apache.hadoop.ozone.freon.TestHadoopDirTreeGeneratorWithFSO
[INFO] Running org.apache.hadoop.ozone.freon.TestDataValidateWithSafeByteOperations
[INFO] Tests run: 2, Failures: 0, Errors: 0, Skipped: 0, Time elapsed: 66.708 s - in org.apache.hadoop.ozone.freon.TestDataValidateWithSafeByteOperations
[INFO] Running org.apache.hadoop.ozone.freon.TestDataValidateWithDummyContainers
[INFO] Tests run: 2, Failures: 0, Errors: 0, Skipped: 0, Time elapsed: 55.652 s - in org.apache.hadoop.ozone.freon.TestDataValidateWithDummyContainers
[INFO] Running org.apache.hadoop.ozone.freon.TestFreonWithPipelineDestroy
[INFO] Tests run: 1, Failures: 0, Errors: 0, Skipped: 0, Time elapsed: 61.005 s - in org.apache.hadoop.ozone.freon.TestFreonWithPipelineDestroy
[INFO] Running org.apache.hadoop.ozone.freon.TestOmBucketReadWriteFileOps
[INFO] Tests run: 1, Failures: 0, Errors: 0, Skipped: 0, Time elapsed: 69.361 s - in org.apache.hadoop.ozone.freon.TestOmBucketReadWriteFileOps
[INFO] Running org.apache.hadoop.ozone.freon.TestOmBucketReadWriteKeyOps
[INFO] Tests run: 1, Failures: 0, Errors: 0, Skipped: 0, Time elapsed: 68.834 s - in org.apache.hadoop.ozone.freon.TestOmBucketReadWriteKeyOps
[INFO] Running org.apache.hadoop.ozone.freon.TestHadoopDirTreeGenerator
[INFO] Tests run: 1, Failures: 0, Errors: 0, Skipped: 0, Time elapsed: 79.357 s - in org.apache.hadoop.ozone.freon.TestHadoopDirTreeGenerator
[INFO] Running org.apache.hadoop.ozone.freon.TestFreonWithDatanodeFastRestart
[WARNING] Tests run: 1, Failures: 0, Errors: 0, Skipped: 1, Time elapsed: 0.014 s - in org.apache.hadoop.ozone.freon.TestFreonWithDatanodeFastRestart
[INFO] Running org.apache.hadoop.ozone.freon.TestHadoopNestedDirGenerator
[INFO] Tests run: 1, Failures: 0, Errors: 0, Skipped: 0, Time elapsed: 67.059 s - in org.apache.hadoop.ozone.freon.TestHadoopNestedDirGenerator
[INFO] Running org.apache.hadoop.ozone.freon.TestRandomKeyGenerator
[INFO] Tests run: 7, Failures: 0, Errors: 0, Skipped: 0, Time elapsed: 168.434 s - in org.apache.hadoop.ozone.freon.TestRandomKeyGenerator
[INFO] Running org.apache.hadoop.ozone.parser.TestOzoneHARatisLogParser
[ERROR] Tests run: 1, Failures: 0, Errors: 1, Skipped: 0, Time elapsed: 80.475 s <<< FAILURE! - in org.apache.hadoop.ozone.parser.TestOzoneHARatisLogParser
[ERROR] org.apache.hadoop.ozone.parser.TestOzoneHARatisLogParser.testRatisLogParsing  Time elapsed: 80.436 s  <<< ERROR!
java.util.concurrent.TimeoutException: 
Timed out waiting for condition. Thread diagnostics:
Timestamp: 2022-06-08 07:34:47,142

"main"  prio=5 tid=1 timed_waiting
java.lang.Thread.State: TIMED_WAITING
        at sun.misc.Unsafe.park(Native Method)
        at java.util.concurrent.locks.LockSupport.parkNanos(LockSupport.java:215)
        at java.util.concurrent.FutureTask.awaitDone(FutureTask.java:426)
        at java.util.concurrent.FutureTask.get(FutureTask.java:204)
        at org.junit.internal.runners.statements.FailOnTimeout.getResult(FailOnTimeout.java:156)
        at org.junit.internal.runners.statements.FailOnTimeout.evaluate(FailOnTimeout.java:129)
        at org.junit.runners.ParentRunner$3.evaluate(ParentRunner.java:306)
        at org.junit.runners.BlockJUnit4ClassRunner$1.evaluate(BlockJUnit4ClassRunner.java:100)
        at org.junit.runners.ParentRunner.runLeaf(ParentRunner.java:366)
        at org.junit.runners.BlockJUnit4ClassRunner.runChild(BlockJUnit4ClassRunner.java:103)
        at org.junit.runners.BlockJUnit4ClassRunner.runChild(BlockJUnit4ClassRunner.java:63)
        at org.junit.runners.ParentRunner$4.run(ParentRunner.java:331)
        at org.junit.runners.ParentRunner$1.schedule(ParentRunner.java:79)
        at org.junit.runners.ParentRunner.runChildren(ParentRunner.java:329)
        at org.junit.runners.ParentRunner.access$100(ParentRunner.java:66)
        at org.junit.runners.ParentRunner$2.evaluate(ParentRunner.java:293)
        at org.junit.runners.ParentRunner$3.evaluate(ParentRunner.java:306)
        at org.junit.runners.ParentRunner.run(ParentRunner.java:413)
        at org.junit.runner.JUnitCore.run(JUnitCore.java:137)
        at org.junit.runner.JUnitCore.run(JUnitCore.java:115)
        at org.junit.vintage.engine.execution.RunnerExecutor.execute(RunnerExecutor.java:42)
        at org.junit.vintage.engine.VintageTestEngine.executeAllChildren(VintageTestEngine.java:80)
        at org.junit.vintage.engine.VintageTestEngine.execute(VintageTestEngine.java:72)
        at org.junit.platform.launcher.core.EngineExecutionOrchestrator.execute(EngineExecutionOrchestrator.java:107)
        at org.junit.platform.launcher.core.EngineExecutionOrchestrator.execute(EngineExecutionOrchestrator.java:88)
        at org.junit.platform.launcher.core.EngineExecutionOrchestrator.lambda$execute$0(EngineExecutionOrchestrator.java:54)
        at org.junit.platform.launcher.core.EngineExecutionOrchestrator$$Lambda$188/262366552.accept(Unknown Source)
        at org.junit.platform.launcher.core.EngineExecutionOrchestrator.withInterceptedStreams(EngineExecutionOrchestrator.java:67)
        at org.junit.platform.launcher.core.EngineExecutionOrchestrator.execute(EngineExecutionOrchestrator.java:52)
        at org.junit.platform.launcher.core.DefaultLauncher.execute(DefaultLauncher.java:114)
        at org.junit.platform.launcher.core.DefaultLauncher.execute(DefaultLauncher.java:86)
        at org.junit.platform.launcher.core.DefaultLauncherSession$DelegatingLauncher.execute(DefaultLauncherSession.java:86)
        at org.junit.platform.launcher.core.SessionPerRequestLauncher.execute(SessionPerRequestLauncher.java:53)
        at org.apache.maven.surefire.junitplatform.JUnitPlatformProvider.execute(JUnitPlatformProvider.java:188)
        at org.apache.maven.surefire.junitplatform.JUnitPlatformProvider.invokeAllTests(JUnitPlatformProvider.java:154)
        at org.apache.maven.surefire.junitplatform.JUnitPlatformProvider.invoke(JUnitPlatformProvider.java:124)
        at org.apache.maven.surefire.booter.ForkedBooter.runSuitesInProcess(ForkedBooter.java:428)
        at org.apache.maven.surefire.booter.ForkedBooter.execute(ForkedBooter.java:162)
        at org.apache.maven.surefire.booter.ForkedBooter.run(ForkedBooter.java:562)
        at org.apache.maven.surefire.booter.ForkedBooter.main(ForkedBooter.java:548)
"org.apache.hadoop.ozone.container.common.statemachine.commandhandler.DeleteBlocksCommandHandler$DeleteCmdWorker@6ee6e2c4" daemon prio=5 tid=781 runnable
java.lang.Thread.State: RUNNABLE
        at java.lang.Thread.sleep(Native Method)
        at org.apache.hadoop.ozone.container.common.statemachine.commandhandler.DeleteBlocksCommandHandler$DeleteCmdWorker.run(DeleteBlocksCommandHandler.java:185)
        at java.lang.Thread.run(Thread.java:750)
"EndpointStateMachine task thread for /127.0.0.1:40207 - 0 "  prio=5 tid=877 in Object.wait()
java.lang.Thread.State: WAITING (on object monitor)
        at sun.misc.Unsafe.park(Native Method)
        at java.util.concurrent.locks.LockSupport.park(LockSupport.java:175)
        at java.util.concurrent.locks.AbstractQueuedSynchronizer$ConditionObject.await(AbstractQueuedSynchronizer.java:2039)
        at java.util.concurrent.LinkedBlockingQueue.take(LinkedBlockingQueue.java:442)
        at java.util.concurrent.ThreadPoolExecutor.getTask(ThreadPoolExecutor.java:1074)
        at java.util.concurrent.ThreadPoolExecutor.runWorker(ThreadPoolExecutor.java:1134)
        at java.util.concurrent.ThreadPoolExecutor$Worker.run(ThreadPoolExecutor.java:624)
        at java.lang.Thread.run(Thread.java:750)
"Reference Handler" daemon prio=10 tid=2 in Object.wait()
java.lang.Thread.State: WAITING (on object monitor)
        at java.lang.Object.wait(Native Method)
        at java.lang.Object.wait(Object.java:502)
        at java.lang.ref.Reference.tryHandlePending(Reference.java:191)
        at java.lang.ref.Reference$ReferenceHandler.run(Reference.java:153)
"Datanode ReportManager Thread - 2" daemon prio=5 tid=795 in Object.wait()
java.lang.Thread.State: WAITING (on object monitor)
        at sun.misc.Unsafe.park(Native Method)
        at java.util.concurrent.locks.LockSupport.park(LockSupport.java:175)
        at java.util.concurrent.locks.AbstractQueuedSynchronizer$ConditionObject.await(AbstractQueuedSynchronizer.java:2039)
        at java.util.concurrent.ScheduledThreadPoolExecutor$DelayedWorkQueue.take(ScheduledThreadPoolExecutor.java:1088)
        at java.util.concurrent.ScheduledThreadPoolExecutor$DelayedWorkQueue.take(ScheduledThreadPoolExecutor.java:809)
        at java.util.concurrent.ThreadPoolExecutor.getTask(ThreadPoolExecutor.java:1074)
        at java.util.concurrent.ThreadPoolExecutor.runWorker(ThreadPoolExecutor.java:1134)
        at java.util.concurrent.ThreadPoolExecutor$Worker.run(ThreadPoolExecutor.java:624)
        at java.lang.Thread.run(Thread.java:750)
"Datanode ReportManager Thread - 2" daemon prio=5 tid=823 in Object.wait()
java.lang.Thread.State: WAITING (on object monitor)
        at sun.misc.Unsafe.park(Native Method)
        at java.util.concurrent.locks.LockSupport.park(LockSupport.java:175)
        at java.util.concurrent.locks.AbstractQueuedSynchronizer$ConditionObject.await(AbstractQueuedSynchronizer.java:2039)
        at java.util.concurrent.ScheduledThreadPoolExecutor$DelayedWorkQueue.take(ScheduledThreadPoolExecutor.java:1088)
        at java.util.concurrent.ScheduledThreadPoolExecutor$DelayedWorkQueue.take(ScheduledThreadPoolExecutor.java:809)
        at java.util.concurrent.ThreadPoolExecutor.getTask(ThreadPoolExecutor.java:1074)
        at java.util.concurrent.ThreadPoolExecutor.runWorker(ThreadPoolExecutor.java:1134)
        at java.util.concurrent.ThreadPoolExecutor$Worker.run(ThreadPoolExecutor.java:624)
        at java.lang.Thread.run(Thread.java:750)
"FullTableCache Cleanup Thread - 0" daemon prio=5 tid=1173 in Object.wait()
java.lang.Thread.State: WAITING (on object monitor)
        at sun.misc.Unsafe.park(Native Method)
        at java.util.concurrent.locks.LockSupport.park(LockSupport.java:175)
        at java.util.concurrent.locks.AbstractQueuedSynchronizer$ConditionObject.await(AbstractQueuedSynchronizer.java:2039)
        at java.util.concurrent.LinkedBlockingQueue.take(LinkedBlockingQueue.java:442)
        at java.util.concurrent.ThreadPoolExecutor.getTask(ThreadPoolExecutor.java:1074)
        at java.util.concurrent.ThreadPoolExecutor.runWorker(ThreadPoolExecutor.java:1134)
        at java.util.concurrent.ThreadPoolExecutor$Worker.run(ThreadPoolExecutor.java:624)
        at java.lang.Thread.run(Thread.java:750)
"Datanode ReportManager Thread - 3" daemon prio=5 tid=864 in Object.wait()
java.lang.Thread.State: WAITING (on object monitor)
        at sun.misc.Unsafe.park(Native Method)
        at java.util.concurrent.locks.LockSupport.park(LockSupport.java:175)
        at java.util.concurrent.locks.AbstractQueuedSynchronizer$ConditionObject.await(AbstractQueuedSynchronizer.java:2039)
        at java.util.concurrent.ScheduledThreadPoolExecutor$DelayedWorkQueue.take(ScheduledThreadPoolExecutor.java:1088)
        at java.util.concurrent.ScheduledThreadPoolExecutor$DelayedWorkQueue.take(ScheduledThreadPoolExecutor.java:809)
        at java.util.concurrent.ThreadPoolExecutor.getTask(ThreadPoolExecutor.java:1074)
        at java.util.concurrent.ThreadPoolExecutor.runWorker(ThreadPoolExecutor.java:1134)
        at java.util.concurrent.ThreadPoolExecutor$Worker.run(ThreadPoolExecutor.java:624)
        at java.lang.Thread.run(Thread.java:750)
"Datanode ReportManager Thread - 3" daemon prio=5 tid=824 timed_waiting
java.lang.Thread.State: TIMED_WAITING
        at sun.misc.Unsafe.park(Native Method)
        at java.util.concurrent.locks.LockSupport.parkNanos(LockSupport.java:215)
        at java.util.concurrent.locks.AbstractQueuedSynchronizer$ConditionObject.awaitNanos(AbstractQueuedSynchronizer.java:2078)
        at java.util.concurrent.ScheduledThreadPoolExecutor$DelayedWorkQueue.take(ScheduledThreadPoolExecutor.java:1093)
        at java.util.concurrent.ScheduledThreadPoolExecutor$DelayedWorkQueue.take(ScheduledThreadPoolExecutor.java:809)
        at java.util.concurrent.ThreadPoolExecutor.getTask(ThreadPoolExecutor.java:1074)
        at java.util.concurrent.ThreadPoolExecutor.runWorker(ThreadPoolExecutor.java:1134)
        at java.util.concurrent.ThreadPoolExecutor$Worker.run(ThreadPoolExecutor.java:624)
        at java.lang.Thread.run(Thread.java:750)
"Datanode ReportManager Thread - 1" daemon prio=5 tid=822 in Object.wait()
java.lang.Thread.State: WAITING (on object monitor)
        at sun.misc.Unsafe.park(Native Method)
        at java.util.concurrent.locks.LockSupport.park(LockSupport.java:175)
        at java.util.concurrent.locks.AbstractQueuedSynchronizer$ConditionObject.await(AbstractQueuedSynchronizer.java:2039)
        at java.util.concurrent.ScheduledThreadPoolExecutor$DelayedWorkQueue.take(ScheduledThreadPoolExecutor.java:1088)
        at java.util.concurrent.ScheduledThreadPoolExecutor$DelayedWorkQueue.take(ScheduledThreadPoolExecutor.java:809)
        at java.util.concurrent.ThreadPoolExecutor.getTask(ThreadPoolExecutor.java:1074)
        at java.util.concurrent.ThreadPoolExecutor.runWorker(ThreadPoolExecutor.java:1134)
        at java.util.concurrent.ThreadPoolExecutor$Worker.run(ThreadPoolExecutor.java:624)
        at java.lang.Thread.run(Thread.java:750)
"ExpiredContainerReplicaOpScrubberThread" daemon prio=5 tid=32 timed_waiting
java.lang.Thread.State: TIMED_WAITING
        at java.lang.Object.wait(Native Method)
        at org.apache.hadoop.hdds.scm.ha.BackgroundSCMService.run(BackgroundSCMService.java:105)
        at org.apache.hadoop.hdds.scm.ha.BackgroundSCMService$$Lambda$668/613084075.run(Unknown Source)
        at java.lang.Thread.run(Thread.java:750)
"SSL Certificates Store Monitor" daemon prio=5 tid=597 in Object.wait()
java.lang.Thread.State: WAITING (on object monitor)
        at java.lang.Object.wait(Native Method)
        at java.lang.Object.wait(Object.java:502)
        at java.util.TimerThread.mainLoop(Timer.java:526)
        at java.util.TimerThread.run(Timer.java:505)
"IPC Parameter Sending Thread #0" daemon prio=5 tid=266 timed_waiting
java.lang.Thread.State: TIMED_WAITING
        at sun.misc.Unsafe.park(Native Method)
        at java.util.concurrent.locks.LockSupport.parkNanos(LockSupport.java:215)
        at java.util.concurrent.SynchronousQueue$TransferStack.awaitFulfill(SynchronousQueue.java:460)
        at java.util.concurrent.SynchronousQueue$TransferStack.transfer(SynchronousQueue.java:362)
        at java.util.concurrent.SynchronousQueue.poll(SynchronousQueue.java:941)
        at java.util.concurrent.ThreadPoolExecutor.getTask(ThreadPoolExecutor.java:1073)
        at java.util.concurrent.ThreadPoolExecutor.runWorker(ThreadPoolExecutor.java:1134)
        at java.util.concurrent.ThreadPoolExecutor$Worker.run(ThreadPoolExecutor.java:624)
        at java.lang.Thread.run(Thread.java:750)
"EndpointStateMachine task thread for /127.0.0.1:40207 - 0 "  prio=5 tid=896 in Object.wait()
java.lang.Thread.State: WAITING (on object monitor)
        at sun.misc.Unsafe.park(Native Method)
        at java.util.concurrent.locks.LockSupport.park(LockSupport.java:175)
        at java.util.concurrent.locks.AbstractQueuedSynchronizer$ConditionObject.await(AbstractQueuedSynchronizer.java:2039)
        at java.util.concurrent.LinkedBlockingQueue.take(LinkedBlockingQueue.java:442)
        at java.util.concurrent.ThreadPoolExecutor.getTask(ThreadPoolExecutor.java:1074)
        at java.util.concurrent.ThreadPoolExecutor.runWorker(ThreadPoolExecutor.java:1134)
        at java.util.concurrent.ThreadPoolExecutor$Worker.run(ThreadPoolExecutor.java:624)
        at java.lang.Thread.run(Thread.java:750)
"EndpointStateMachine task thread for /127.0.0.1:35577 - 0 "  prio=5 tid=915 timed_waiting
java.lang.Thread.State: TIMED_WAITING
        at java.lang.Thread.sleep(Native Method)
        at org.apache.hadoop.ipc.Client$Connection.handleConnectionFailure(Client.java:972)
        at org.apache.hadoop.ipc.Client$Connection.setupConnection(Client.java:724)
        at org.apache.hadoop.ipc.Client$Connection.setupIOstreams(Client.java:822)
        at org.apache.hadoop.ipc.Client$Connection.access$3800(Client.java:414)
        at org.apache.hadoop.ipc.Client.getConnection(Client.java:1647)
        at org.apache.hadoop.ipc.Client.call(Client.java:1463)
        at org.apache.hadoop.ipc.Client.call(Client.java:1416)
        at org.apache.hadoop.ipc.ProtobufRpcEngine$Invoker.invoke(ProtobufRpcEngine.java:236)
        at org.apache.hadoop.ipc.ProtobufRpcEngine$Invoker.invoke(ProtobufRpcEngine.java:123)
        at com.sun.proxy.$Proxy51.submitRequest(Unknown Source)
        at org.apache.hadoop.ozone.protocolPB.StorageContainerDatanodeProtocolClientSideTranslatorPB.submitRequest(StorageContainerDatanodeProtocolClientSideTranslatorPB.java:117)
        at org.apache.hadoop.ozone.protocolPB.StorageContainerDatanodeProtocolClientSideTranslatorPB.sendHeartbeat(StorageContainerDatanodeProtocolClientSideTranslatorPB.java:149)
        at org.apache.hadoop.ozone.container.common.states.endpoint.HeartbeatEndpointTask.call(HeartbeatEndpointTask.java:183)
        at org.apache.hadoop.ozone.container.common.states.endpoint.HeartbeatEndpointTask.call(HeartbeatEndpointTask.java:85)
        at java.util.concurrent.FutureTask.run(FutureTask.java:266)
        at java.util.concurrent.ThreadPoolExecutor.runWorker(ThreadPoolExecutor.java:1149)
        at java.util.concurrent.ThreadPoolExecutor$Worker.run(ThreadPoolExecutor.java:624)
        at java.lang.Thread.run(Thread.java:750)
"Datanode ReportManager Thread - 3" daemon prio=5 tid=798 in Object.wait()
java.lang.Thread.State: WAITING (on object monitor)
        at sun.misc.Unsafe.park(Native Method)
        at java.util.concurrent.locks.LockSupport.park(LockSupport.java:175)
        at java.util.concurrent.locks.AbstractQueuedSynchronizer$ConditionObject.await(AbstractQueuedSynchronizer.java:2039)
        at java.util.concurrent.ScheduledThreadPoolExecutor$DelayedWorkQueue.take(ScheduledThreadPoolExecutor.java:1088)
        at java.util.concurrent.ScheduledThreadPoolExecutor$DelayedWorkQueue.take(ScheduledThreadPoolExecutor.java:809)
        at java.util.concurrent.ThreadPoolExecutor.getTask(ThreadPoolExecutor.java:1074)
        at java.util.concurrent.ThreadPoolExecutor.runWorker(ThreadPoolExecutor.java:1134)
        at java.util.concurrent.ThreadPoolExecutor$Worker.run(ThreadPoolExecutor.java:624)
        at java.lang.Thread.run(Thread.java:750)
"Datanode ReportManager Thread - 1" daemon prio=5 tid=794 in Object.wait()
java.lang.Thread.State: WAITING (on object monitor)
        at sun.misc.Unsafe.park(Native Method)
        at java.util.concurrent.locks.LockSupport.park(LockSupport.java:175)
        at java.util.concurrent.locks.AbstractQueuedSynchronizer$ConditionObject.await(AbstractQueuedSynchronizer.java:2039)
        at java.util.concurrent.ScheduledThreadPoolExecutor$DelayedWorkQueue.take(ScheduledThreadPoolExecutor.java:1088)
        at java.util.concurrent.ScheduledThreadPoolExecutor$DelayedWorkQueue.take(ScheduledThreadPoolExecutor.java:809)
        at java.util.concurrent.ThreadPoolExecutor.getTask(ThreadPoolExecutor.java:1074)
        at java.util.concurrent.ThreadPoolExecutor.runWorker(ThreadPoolExecutor.java:1134)
        at java.util.concurrent.ThreadPoolExecutor$Worker.run(ThreadPoolExecutor.java:624)
        at java.lang.Thread.run(Thread.java:750)
"SSL Certificates Store Monitor" daemon prio=5 tid=652 in Object.wait()
java.lang.Thread.State: WAITING (on object monitor)
        at java.lang.Object.wait(Native Method)
        at java.lang.Object.wait(Object.java:502)
        at java.util.TimerThread.mainLoop(Timer.java:526)
        at java.util.TimerThread.run(Timer.java:505)
"java.util.concurrent.ThreadPoolExecutor$Worker@3ec8bbb7[State = -1, empty queue]" daemon prio=5 tid=1043 timed_waiting
java.lang.Thread.State: TIMED_WAITING
        at sun.misc.Unsafe.park(Native Method)
        at java.util.concurrent.locks.LockSupport.parkNanos(LockSupport.java:215)
        at java.util.concurrent.locks.AbstractQueuedSynchronizer$ConditionObject.awaitNanos(AbstractQueuedSynchronizer.java:2078)
        at java.util.concurrent.ScheduledThreadPoolExecutor$DelayedWorkQueue.take(ScheduledThreadPoolExecutor.java:1093)
        at java.util.concurrent.ScheduledThreadPoolExecutor$DelayedWorkQueue.take(ScheduledThreadPoolExecutor.java:809)
        at java.util.concurrent.ThreadPoolExecutor.getTask(ThreadPoolExecutor.java:1074)
        at java.util.concurrent.ThreadPoolExecutor.runWorker(ThreadPoolExecutor.java:1134)
        at java.util.concurrent.ThreadPoolExecutor$Worker.run(ThreadPoolExecutor.java:624)
        at java.lang.Thread.run(Thread.java:750)
"FullTableCache Cleanup Thread - 0" daemon prio=5 tid=1171 in Object.wait()
java.lang.Thread.State: WAITING (on object monitor)
        at sun.misc.Unsafe.park(Native Method)
        at java.util.concurrent.locks.LockSupport.park(LockSupport.java:175)
        at java.util.concurrent.locks.AbstractQueuedSynchronizer$ConditionObject.await(AbstractQueuedSynchronizer.java:2039)
        at java.util.concurrent.LinkedBlockingQueue.take(LinkedBlockingQueue.java:442)
        at java.util.concurrent.ThreadPoolExecutor.getTask(ThreadPoolExecutor.java:1074)
        at java.util.concurrent.ThreadPoolExecutor.runWorker(ThreadPoolExecutor.java:1134)
        at java.util.concurrent.ThreadPoolExecutor$Worker.run(ThreadPoolExecutor.java:624)
        at java.lang.Thread.run(Thread.java:750)
"Finalizer" daemon prio=8 tid=3 in Object.wait()
java.lang.Thread.State: WAITING (on object monitor)
        at java.lang.Object.wait(Native Method)
        at java.lang.ref.ReferenceQueue.remove(ReferenceQueue.java:144)
        at java.lang.ref.ReferenceQueue.remove(ReferenceQueue.java:165)
        at java.lang.ref.Finalizer$FinalizerThread.run(Finalizer.java:216)
"ExpiredContainerReplicaOpScrubberThread" daemon prio=5 tid=378 timed_waiting
java.lang.Thread.State: TIMED_WAITING
        at java.lang.Object.wait(Native Method)
        at org.apache.hadoop.hdds.scm.ha.BackgroundSCMService.run(BackgroundSCMService.java:105)
        at org.apache.hadoop.hdds.scm.ha.BackgroundSCMService$$Lambda$668/613084075.run(Unknown Source)
        at java.lang.Thread.run(Thread.java:750)
"ExpiredContainerReplicaOpScrubberThread" daemon prio=5 tid=491 timed_waiting
java.lang.Thread.State: TIMED_WAITING
        at java.lang.Object.wait(Native Method)
        at org.apache.hadoop.hdds.scm.ha.BackgroundSCMService.run(BackgroundSCMService.java:105)
        at org.apache.hadoop.hdds.scm.ha.BackgroundSCMService$$Lambda$668/613084075.run(Unknown Source)
        at java.lang.Thread.run(Thread.java:750)
"process reaper" daemon prio=10 tid=13 timed_waiting
java.lang.Thread.State: TIMED_WAITING
        at sun.misc.Unsafe.park(Native Method)
        at java.util.concurrent.locks.LockSupport.parkNanos(LockSupport.java:215)
        at java.util.concurrent.SynchronousQueue$TransferStack.awaitFulfill(SynchronousQueue.java:460)
        at java.util.concurrent.SynchronousQueue$TransferStack.transfer(SynchronousQueue.java:362)
        at java.util.concurrent.SynchronousQueue.poll(SynchronousQueue.java:941)
        at java.util.concurrent.ThreadPoolExecutor.getTask(ThreadPoolExecutor.java:1073)
        at java.util.concurrent.ThreadPoolExecutor.runWorker(ThreadPoolExecutor.java:1134)
        at java.util.concurrent.ThreadPoolExecutor$Worker.run(ThreadPoolExecutor.java:624)
        at java.lang.Thread.run(Thread.java:750)
"SSL Certificates Store Monitor" daemon prio=5 tid=708 in Object.wait()
java.lang.Thread.State: WAITING (on object monitor)
        at java.lang.Object.wait(Native Method)
        at java.lang.Object.wait(Object.java:502)
        at java.util.TimerThread.mainLoop(Timer.java:526)
        at java.util.TimerThread.run(Timer.java:505)
"org.apache.hadoop.ozone.container.common.statemachine.commandhandler.DeleteBlocksCommandHandler$DeleteCmdWorker@1d18a00f" daemon prio=5 tid=849 runnable
java.lang.Thread.State: RUNNABLE
        at java.lang.Thread.sleep(Native Method)
        at org.apache.hadoop.ozone.container.common.statemachine.commandhandler.DeleteBlocksCommandHandler$DeleteCmdWorker.run(DeleteBlocksCommandHandler.java:185)
        at java.lang.Thread.run(Thread.java:750)
"EndpointStateMachine task thread for /127.0.0.1:35577 - 0 "  prio=5 tid=876 in Object.wait()
java.lang.Thread.State: WAITING (on object monitor)
        at sun.misc.Unsafe.park(Native Method)
        at java.util.concurrent.locks.LockSupport.park(LockSupport.java:175)
        at java.util.concurrent.locks.AbstractQueuedSynchronizer$ConditionObject.await(AbstractQueuedSynchronizer.java:2039)
        at java.util.concurrent.LinkedBlockingQueue.take(LinkedBlockingQueue.java:442)
        at java.util.concurrent.ThreadPoolExecutor.getTask(ThreadPoolExecutor.java:1074)
        at java.util.concurrent.ThreadPoolExecutor.runWorker(ThreadPoolExecutor.java:1134)
        at java.util.concurrent.ThreadPoolExecutor$Worker.run(ThreadPoolExecutor.java:624)
        at java.lang.Thread.run(Thread.java:750)
"Datanode ReportManager Thread - 2" daemon prio=5 tid=863 in Object.wait()
java.lang.Thread.State: WAITING (on object monitor)
        at sun.misc.Unsafe.park(Native Method)
        at java.util.concurrent.locks.LockSupport.park(LockSupport.java:175)
        at java.util.concurrent.locks.AbstractQueuedSynchronizer$ConditionObject.await(AbstractQueuedSynchronizer.java:2039)
        at java.util.concurrent.ScheduledThreadPoolExecutor$DelayedWorkQueue.take(ScheduledThreadPoolExecutor.java:1088)
        at java.util.concurrent.ScheduledThreadPoolExecutor$DelayedWorkQueue.take(ScheduledThreadPoolExecutor.java:809)
        at java.util.concurrent.ThreadPoolExecutor.getTask(ThreadPoolExecutor.java:1074)
        at java.util.concurrent.ThreadPoolExecutor.runWorker(ThreadPoolExecutor.java:1134)
        at java.util.concurrent.ThreadPoolExecutor$Worker.run(ThreadPoolExecutor.java:624)
        at java.lang.Thread.run(Thread.java:750)
"FullTableCache Cleanup Thread - 0" daemon prio=5 tid=1168 in Object.wait()
java.lang.Thread.State: WAITING (on object monitor)
        at sun.misc.Unsafe.park(Native Method)
        at java.util.concurrent.locks.LockSupport.park(LockSupport.java:175)
        at java.util.concurrent.locks.AbstractQueuedSynchronizer$ConditionObject.await(AbstractQueuedSynchronizer.java:2039)
        at java.util.concurrent.LinkedBlockingQueue.take(LinkedBlockingQueue.java:442)
        at java.util.concurrent.ThreadPoolExecutor.getTask(ThreadPoolExecutor.java:1074)
        at java.util.concurrent.ThreadPoolExecutor.runWorker(ThreadPoolExecutor.java:1134)
        at java.util.concurrent.ThreadPoolExecutor$Worker.run(ThreadPoolExecutor.java:624)
        at java.lang.Thread.run(Thread.java:750)
"FullTableCache Cleanup Thread - 0" daemon prio=5 tid=1166 in Object.wait()
java.lang.Thread.State: WAITING (on object monitor)
        at sun.misc.Unsafe.park(Native Method)
        at java.util.concurrent.locks.LockSupport.park(LockSupport.java:175)
        at java.util.concurrent.locks.AbstractQueuedSynchronizer$ConditionObject.await(AbstractQueuedSynchronizer.java:2039)
        at java.util.concurrent.LinkedBlockingQueue.take(LinkedBlockingQueue.java:442)
        at java.util.concurrent.ThreadPoolExecutor.getTask(ThreadPoolExecutor.java:1074)
        at java.util.concurrent.ThreadPoolExecutor.runWorker(ThreadPoolExecutor.java:1134)
        at java.util.concurrent.ThreadPoolExecutor$Worker.run(ThreadPoolExecutor.java:624)
        at java.lang.Thread.run(Thread.java:750)
"Datanode ReportManager Thread - 0" daemon prio=5 tid=793 timed_waiting
java.lang.Thread.State: TIMED_WAITING
        at sun.misc.Unsafe.park(Native Method)
        at java.util.concurrent.locks.LockSupport.parkNanos(LockSupport.java:215)
        at java.util.concurrent.locks.AbstractQueuedSynchronizer$ConditionObject.awaitNanos(AbstractQueuedSynchronizer.java:2078)
        at java.util.concurrent.ScheduledThreadPoolExecutor$DelayedWorkQueue.take(ScheduledThreadPoolExecutor.java:1093)
        at java.util.concurrent.ScheduledThreadPoolExecutor$DelayedWorkQueue.take(ScheduledThreadPoolExecutor.java:809)
        at java.util.concurrent.ThreadPoolExecutor.getTask(ThreadPoolExecutor.java:1074)
        at java.util.concurrent.ThreadPoolExecutor.runWorker(ThreadPoolExecutor.java:1134)
        at java.util.concurrent.ThreadPoolExecutor$Worker.run(ThreadPoolExecutor.java:624)
        at java.lang.Thread.run(Thread.java:750)
"EndpointStateMachine task thread for /127.0.0.1:42779 - 0 "  prio=5 tid=878 in Object.wait()
java.lang.Thread.State: WAITING (on object monitor)
        at sun.misc.Unsafe.park(Native Method)
        at java.util.concurrent.locks.LockSupport.park(LockSupport.java:175)
        at java.util.concurrent.locks.AbstractQueuedSynchronizer$ConditionObject.await(AbstractQueuedSynchronizer.java:2039)
        at java.util.concurrent.LinkedBlockingQueue.take(LinkedBlockingQueue.java:442)
        at java.util.concurrent.ThreadPoolExecutor.getTask(ThreadPoolExecutor.java:1074)
        at java.util.concurrent.ThreadPoolExecutor.runWorker(ThreadPoolExecutor.java:1134)
        at java.util.concurrent.ThreadPoolExecutor$Worker.run(ThreadPoolExecutor.java:624)
        at java.lang.Thread.run(Thread.java:750)
"Datanode ReportManager Thread - 4" daemon prio=5 tid=865 timed_waiting
java.lang.Thread.State: TIMED_WAITING
        at sun.misc.Unsafe.park(Native Method)
        at java.util.concurrent.locks.LockSupport.parkNanos(LockSupport.java:215)
        at java.util.concurrent.locks.AbstractQueuedSynchronizer$ConditionObject.awaitNanos(AbstractQueuedSynchronizer.java:2078)
        at java.util.concurrent.ScheduledThreadPoolExecutor$DelayedWorkQueue.take(ScheduledThreadPoolExecutor.java:1093)
        at java.util.concurrent.ScheduledThreadPoolExecutor$DelayedWorkQueue.take(ScheduledThreadPoolExecutor.java:809)
        at java.util.concurrent.ThreadPoolExecutor.getTask(ThreadPoolExecutor.java:1074)
        at java.util.concurrent.ThreadPoolExecutor.runWorker(ThreadPoolExecutor.java:1134)
        at java.util.concurrent.ThreadPoolExecutor$Worker.run(ThreadPoolExecutor.java:624)
        at java.lang.Thread.run(Thread.java:750)
"Listener at 127.0.0.1/45261" daemon prio=5 tid=12 runnable
java.lang.Thread.State: RUNNABLE
        at java.lang.Thread.dumpThreads(Native Method)
        at java.lang.Thread.getAllStackTraces(Thread.java:1615)
        at org.apache.ozone.test.TimedOutTestsListener.buildThreadDump(TimedOutTestsListener.java:93)
        at org.apache.ozone.test.TimedOutTestsListener.buildThreadDiagnosticString(TimedOutTestsListener.java:79)
        at org.apache.ozone.test.GenericTestUtils.waitFor(GenericTestUtils.java:226)
        at org.apache.hadoop.ozone.parser.TestOzoneHARatisLogParser.testRatisLogParsing(TestOzoneHARatisLogParser.java:129)
        at sun.reflect.NativeMethodAccessorImpl.invoke0(Native Method)
        at sun.reflect.NativeMethodAccessorImpl.invoke(NativeMethodAccessorImpl.java:62)
        at sun.reflect.DelegatingMethodAccessorImpl.invoke(DelegatingMethodAccessorImpl.java:43)
        at java.lang.reflect.Method.invoke(Method.java:498)
        at org.junit.runners.model.FrameworkMethod$1.runReflectiveCall(FrameworkMethod.java:59)
        at org.junit.internal.runners.model.ReflectiveCallable.run(ReflectiveCallable.java:12)
        at org.junit.runners.model.FrameworkMethod.invokeExplosively(FrameworkMethod.java:56)
        at org.junit.internal.runners.statements.InvokeMethod.evaluate(InvokeMethod.java:17)
        at org.junit.internal.runners.statements.RunBefores.evaluate(RunBefores.java:26)
        at org.junit.internal.runners.statements.RunAfters.evaluate(RunAfters.java:27)
        at org.junit.internal.runners.statements.FailOnTimeout$CallableStatement.call(FailOnTimeout.java:288)
        at org.junit.internal.runners.statements.FailOnTimeout$CallableStatement.call(FailOnTimeout.java:282)
        at java.util.concurrent.FutureTask.run(FutureTask.java:266)
        at java.lang.Thread.run(Thread.java:750)
"Signal Dispatcher" daemon prio=9 tid=4 runnable
java.lang.Thread.State: RUNNABLE
"EndpointStateMachine task thread for /127.0.0.1:35577 - 0 "  prio=5 tid=897 in Object.wait()
java.lang.Thread.State: WAITING (on object monitor)
        at sun.misc.Unsafe.park(Native Method)
        at java.util.concurrent.locks.LockSupport.park(LockSupport.java:175)
        at java.util.concurrent.locks.AbstractQueuedSynchronizer$ConditionObject.await(AbstractQueuedSynchronizer.java:2039)
        at java.util.concurrent.LinkedBlockingQueue.take(LinkedBlockingQueue.java:442)
        at java.util.concurrent.ThreadPoolExecutor.getTask(ThreadPoolExecutor.java:1074)
        at java.util.concurrent.ThreadPoolExecutor.runWorker(ThreadPoolExecutor.java:1134)
        at java.util.concurrent.ThreadPoolExecutor$Worker.run(ThreadPoolExecutor.java:624)
        at java.lang.Thread.run(Thread.java:750)
"IPC Parameter Sending Thread #2" daemon prio=5 tid=955 timed_waiting
java.lang.Thread.State: TIMED_WAITING
        at sun.misc.Unsafe.park(Native Method)
        at java.util.concurrent.locks.LockSupport.parkNanos(LockSupport.java:215)
        at java.util.concurrent.SynchronousQueue$TransferStack.awaitFulfill(SynchronousQueue.java:460)
        at java.util.concurrent.SynchronousQueue$TransferStack.transfer(SynchronousQueue.java:362)
        at java.util.concurrent.SynchronousQueue.poll(SynchronousQueue.java:941)
        at java.util.concurrent.ThreadPoolExecutor.getTask(ThreadPoolExecutor.java:1073)
        at java.util.concurrent.ThreadPoolExecutor.runWorker(ThreadPoolExecutor.java:1134)
        at java.util.concurrent.ThreadPoolExecutor$Worker.run(ThreadPoolExecutor.java:624)
        at java.lang.Thread.run(Thread.java:750)
"EndpointStateMachine task thread for /127.0.0.1:42779 - 0 "  prio=5 tid=898 in Object.wait()
java.lang.Thread.State: WAITING (on object monitor)
        at sun.misc.Unsafe.park(Native Method)
        at java.util.concurrent.locks.LockSupport.park(LockSupport.java:175)
        at java.util.concurrent.locks.AbstractQueuedSynchronizer$ConditionObject.await(AbstractQueuedSynchronizer.java:2039)
        at java.util.concurrent.LinkedBlockingQueue.take(LinkedBlockingQueue.java:442)
        at java.util.concurrent.ThreadPoolExecutor.getTask(ThreadPoolExecutor.java:1074)
        at java.util.concurrent.ThreadPoolExecutor.runWorker(ThreadPoolExecutor.java:1134)
        at java.util.concurrent.ThreadPoolExecutor$Worker.run(ThreadPoolExecutor.java:624)
        at java.lang.Thread.run(Thread.java:750)
"FullTableCache Cleanup Thread - 0" daemon prio=5 tid=1167 in Object.wait()
java.lang.Thread.State: WAITING (on object monitor)
        at sun.misc.Unsafe.park(Native Method)
        at java.util.concurrent.locks.LockSupport.park(LockSupport.java:175)
        at java.util.concurrent.locks.AbstractQueuedSynchronizer$ConditionObject.await(AbstractQueuedSynchronizer.java:2039)
        at java.util.concurrent.LinkedBlockingQueue.take(LinkedBlockingQueue.java:442)
        at java.util.concurrent.ThreadPoolExecutor.getTask(ThreadPoolExecutor.java:1074)
        at java.util.concurrent.ThreadPoolExecutor.runWorker(ThreadPoolExecutor.java:1134)
        at java.util.concurrent.ThreadPoolExecutor$Worker.run(ThreadPoolExecutor.java:624)
        at java.lang.Thread.run(Thread.java:750)
"EndpointStateMachine task thread for /127.0.0.1:42779 - 0 "  prio=5 tid=916 timed_waiting
java.lang.Thread.State: TIMED_WAITING
        at java.lang.Thread.sleep(Native Method)
        at org.apache.hadoop.ipc.Client$Connection.handleConnectionFailure(Client.java:972)
        at org.apache.hadoop.ipc.Client$Connection.setupConnection(Client.java:724)
        at org.apache.hadoop.ipc.Client$Connection.setupIOstreams(Client.java:822)
        at org.apache.hadoop.ipc.Client$Connection.access$3800(Client.java:414)
        at org.apache.hadoop.ipc.Client.getConnection(Client.java:1647)
        at org.apache.hadoop.ipc.Client.call(Client.java:1463)
        at org.apache.hadoop.ipc.Client.call(Client.java:1416)
        at org.apache.hadoop.ipc.ProtobufRpcEngine$Invoker.invoke(ProtobufRpcEngine.java:236)
        at org.apache.hadoop.ipc.ProtobufRpcEngine$Invoker.invoke(ProtobufRpcEngine.java:123)
        at com.sun.proxy.$Proxy51.submitRequest(Unknown Source)
        at org.apache.hadoop.ozone.protocolPB.StorageContainerDatanodeProtocolClientSideTranslatorPB.submitRequest(StorageContainerDatanodeProtocolClientSideTranslatorPB.java:117)
        at org.apache.hadoop.ozone.protocolPB.StorageContainerDatanodeProtocolClientSideTranslatorPB.sendHeartbeat(StorageContainerDatanodeProtocolClientSideTranslatorPB.java:149)
        at org.apache.hadoop.ozone.container.common.states.endpoint.HeartbeatEndpointTask.call(HeartbeatEndpointTask.java:183)
        at org.apache.hadoop.ozone.container.common.states.endpoint.HeartbeatEndpointTask.call(HeartbeatEndpointTask.java:85)
        at java.util.concurrent.FutureTask.run(FutureTask.java:266)
        at java.util.concurrent.ThreadPoolExecutor.runWorker(ThreadPoolExecutor.java:1149)
        at java.util.concurrent.ThreadPoolExecutor$Worker.run(ThreadPoolExecutor.java:624)
        at java.lang.Thread.run(Thread.java:750)
"surefire-forkedjvm-command-thread" daemon prio=5 tid=10 runnable
java.lang.Thread.State: RUNNABLE
        at java.io.FileInputStream.readBytes(Native Method)
        at java.io.FileInputStream.read(FileInputStream.java:255)
        at java.io.BufferedInputStream.read1(BufferedInputStream.java:284)
        at java.io.BufferedInputStream.read(BufferedInputStream.java:345)
        at java.io.BufferedInputStream.fill(BufferedInputStream.java:246)
        at java.io.BufferedInputStream.read1(BufferedInputStream.java:286)
        at java.io.BufferedInputStream.read(BufferedInputStream.java:345)
        at org.apache.maven.surefire.api.util.internal.Channels$3.readImpl(Channels.java:214)
        at org.apache.maven.surefire.api.util.internal.AbstractNoninterruptibleReadableChannel.read(AbstractNoninterruptibleReadableChannel.java:54)
        at org.apache.maven.surefire.booter.spi.LegacyMasterProcessChannelDecoder.decode(LegacyMasterProcessChannelDecoder.java:80)
        at org.apache.maven.surefire.booter.CommandReader$CommandRunnable.run(CommandReader.java:343)
        at java.lang.Thread.run(Thread.java:750)
"Datanode ReportManager Thread - 4" daemon prio=5 tid=799 in Object.wait()
java.lang.Thread.State: WAITING (on object monitor)
        at sun.misc.Unsafe.park(Native Method)
        at java.util.concurrent.locks.LockSupport.park(LockSupport.java:175)
        at java.util.concurrent.locks.AbstractQueuedSynchronizer$ConditionObject.await(AbstractQueuedSynchronizer.java:2039)
        at java.util.concurrent.ScheduledThreadPoolExecutor$DelayedWorkQueue.take(ScheduledThreadPoolExecutor.java:1088)
        at java.util.concurrent.ScheduledThreadPoolExecutor$DelayedWorkQueue.take(ScheduledThreadPoolExecutor.java:809)
        at java.util.concurrent.ThreadPoolExecutor.getTask(ThreadPoolExecutor.java:1074)
        at java.util.concurrent.ThreadPoolExecutor.runWorker(ThreadPoolExecutor.java:1134)
        at java.util.concurrent.ThreadPoolExecutor$Worker.run(ThreadPoolExecutor.java:624)
        at java.lang.Thread.run(Thread.java:750)
"EndpointStateMachine task thread for /127.0.0.1:40207 - 0 "  prio=5 tid=914 timed_waiting
java.lang.Thread.State: TIMED_WAITING
        at java.lang.Thread.sleep(Native Method)
        at org.apache.hadoop.ipc.Client$Connection.handleConnectionFailure(Client.java:972)
        at org.apache.hadoop.ipc.Client$Connection.setupConnection(Client.java:724)
        at org.apache.hadoop.ipc.Client$Connection.setupIOstreams(Client.java:822)
        at org.apache.hadoop.ipc.Client$Connection.access$3800(Client.java:414)
        at org.apache.hadoop.ipc.Client.getConnection(Client.java:1647)
        at org.apache.hadoop.ipc.Client.call(Client.java:1463)
        at org.apache.hadoop.ipc.Client.call(Client.java:1416)
        at org.apache.hadoop.ipc.ProtobufRpcEngine$Invoker.invoke(ProtobufRpcEngine.java:236)
        at org.apache.hadoop.ipc.ProtobufRpcEngine$Invoker.invoke(ProtobufRpcEngine.java:123)
        at com.sun.proxy.$Proxy51.submitRequest(Unknown Source)
        at org.apache.hadoop.ozone.protocolPB.StorageContainerDatanodeProtocolClientSideTranslatorPB.submitRequest(StorageContainerDatanodeProtocolClientSideTranslatorPB.java:117)
        at org.apache.hadoop.ozone.protocolPB.StorageContainerDatanodeProtocolClientSideTranslatorPB.sendHeartbeat(StorageContainerDatanodeProtocolClientSideTranslatorPB.java:149)
        at org.apache.hadoop.ozone.container.common.states.endpoint.HeartbeatEndpointTask.call(HeartbeatEndpointTask.java:183)
        at org.apache.hadoop.ozone.container.common.states.endpoint.HeartbeatEndpointTask.call(HeartbeatEndpointTask.java:85)
        at java.util.concurrent.FutureTask.run(FutureTask.java:266)
        at java.util.concurrent.ThreadPoolExecutor.runWorker(ThreadPoolExecutor.java:1149)
        at java.util.concurrent.ThreadPoolExecutor$Worker.run(ThreadPoolExecutor.java:624)
        at java.lang.Thread.run(Thread.java:750)
"IPC Parameter Sending Thread #1" daemon prio=5 tid=882 timed_waiting
java.lang.Thread.State: TIMED_WAITING
        at sun.misc.Unsafe.park(Native Method)
        at java.util.concurrent.locks.LockSupport.parkNanos(LockSupport.java:215)
        at java.util.concurrent.SynchronousQueue$TransferStack.awaitFulfill(SynchronousQueue.java:460)
        at java.util.concurrent.SynchronousQueue$TransferStack.transfer(SynchronousQueue.java:362)
        at java.util.concurrent.SynchronousQueue.poll(SynchronousQueue.java:941)
        at java.util.concurrent.ThreadPoolExecutor.getTask(ThreadPoolExecutor.java:1073)
        at java.util.concurrent.ThreadPoolExecutor.runWorker(ThreadPoolExecutor.java:1134)
        at java.util.concurrent.ThreadPoolExecutor$Worker.run(ThreadPoolExecutor.java:624)
        at java.lang.Thread.run(Thread.java:750)
"Datanode ReportManager Thread - 0" daemon prio=5 tid=821 in Object.wait()
java.lang.Thread.State: WAITING (on object monitor)
        at sun.misc.Unsafe.park(Native Method)
        at java.util.concurrent.locks.LockSupport.park(LockSupport.java:175)
        at java.util.concurrent.locks.AbstractQueuedSynchronizer$ConditionObject.await(AbstractQueuedSynchronizer.java:2039)
        at java.util.concurrent.ScheduledThreadPoolExecutor$DelayedWorkQueue.take(ScheduledThreadPoolExecutor.java:1088)
        at java.util.concurrent.ScheduledThreadPoolExecutor$DelayedWorkQueue.take(ScheduledThreadPoolExecutor.java:809)
        at java.util.concurrent.ThreadPoolExecutor.getTask(ThreadPoolExecutor.java:1074)
        at java.util.concurrent.ThreadPoolExecutor.runWorker(ThreadPoolExecutor.java:1134)
        at java.util.concurrent.ThreadPoolExecutor$Worker.run(ThreadPoolExecutor.java:624)
        at java.lang.Thread.run(Thread.java:750)
"Datanode ReportManager Thread - 4" daemon prio=5 tid=825 in Object.wait()
java.lang.Thread.State: WAITING (on object monitor)
        at sun.misc.Unsafe.park(Native Method)
        at java.util.concurrent.locks.LockSupport.park(LockSupport.java:175)
        at java.util.concurrent.locks.AbstractQueuedSynchronizer$ConditionObject.await(AbstractQueuedSynchronizer.java:2039)
        at java.util.concurrent.ScheduledThreadPoolExecutor$DelayedWorkQueue.take(ScheduledThreadPoolExecutor.java:1088)
        at java.util.concurrent.ScheduledThreadPoolExecutor$DelayedWorkQueue.take(ScheduledThreadPoolExecutor.java:809)
        at java.util.concurrent.ThreadPoolExecutor.getTask(ThreadPoolExecutor.java:1074)
        at java.util.concurrent.ThreadPoolExecutor.runWorker(ThreadPoolExecutor.java:1134)
        at java.util.concurrent.ThreadPoolExecutor$Worker.run(ThreadPoolExecutor.java:624)
        at java.lang.Thread.run(Thread.java:750)
"org.apache.hadoop.ozone.container.common.statemachine.commandhandler.DeleteBlocksCommandHandler$DeleteCmdWorker@76aa137d" daemon prio=5 tid=809 runnable
java.lang.Thread.State: RUNNABLE
        at java.lang.Thread.sleep(Native Method)
        at org.apache.hadoop.ozone.container.common.statemachine.commandhandler.DeleteBlocksCommandHandler$DeleteCmdWorker.run(DeleteBlocksCommandHandler.java:185)
        at java.lang.Thread.run(Thread.java:750)
"Datanode ReportManager Thread - 0" daemon prio=5 tid=861 in Object.wait()
java.lang.Thread.State: WAITING (on object monitor)
        at sun.misc.Unsafe.park(Native Method)
        at java.util.concurrent.locks.LockSupport.park(LockSupport.java:175)
        at java.util.concurrent.locks.AbstractQueuedSynchronizer$ConditionObject.await(AbstractQueuedSynchronizer.java:2039)
        at java.util.concurrent.ScheduledThreadPoolExecutor$DelayedWorkQueue.take(ScheduledThreadPoolExecutor.java:1088)
        at java.util.concurrent.ScheduledThreadPoolExecutor$DelayedWorkQueue.take(ScheduledThreadPoolExecutor.java:809)
        at java.util.concurrent.ThreadPoolExecutor.getTask(ThreadPoolExecutor.java:1074)
        at java.util.concurrent.ThreadPoolExecutor.runWorker(ThreadPoolExecutor.java:1134)
        at java.util.concurrent.ThreadPoolExecutor$Worker.run(ThreadPoolExecutor.java:624)
        at java.lang.Thread.run(Thread.java:750)
"Datanode ReportManager Thread - 1" daemon prio=5 tid=862 in Object.wait()
java.lang.Thread.State: WAITING (on object monitor)
        at sun.misc.Unsafe.park(Native Method)
        at java.util.concurrent.locks.LockSupport.park(LockSupport.java:175)
        at java.util.concurrent.locks.AbstractQueuedSynchronizer$ConditionObject.await(AbstractQueuedSynchronizer.java:2039)
        at java.util.concurrent.ScheduledThreadPoolExecutor$DelayedWorkQueue.take(ScheduledThreadPoolExecutor.java:1088)
        at java.util.concurrent.ScheduledThreadPoolExecutor$DelayedWorkQueue.take(ScheduledThreadPoolExecutor.java:809)
        at java.util.concurrent.ThreadPoolExecutor.getTask(ThreadPoolExecutor.java:1074)
        at java.util.concurrent.ThreadPoolExecutor.runWorker(ThreadPoolExecutor.java:1134)
        at java.util.concurrent.ThreadPoolExecutor$Worker.run(ThreadPoolExecutor.java:624)
        at java.lang.Thread.run(Thread.java:750)


	at org.apache.ozone.test.GenericTestUtils.waitFor(GenericTestUtils.java:226)
	at org.apache.hadoop.ozone.parser.TestOzoneHARatisLogParser.testRatisLogParsing(TestOzoneHARatisLogParser.java:129)
	at sun.reflect.NativeMethodAccessorImpl.invoke0(Native Method)
	at sun.reflect.NativeMethodAccessorImpl.invoke(NativeMethodAccessorImpl.java:62)
	at sun.reflect.DelegatingMethodAccessorImpl.invoke(DelegatingMethodAccessorImpl.java:43)
	at java.lang.reflect.Method.invoke(Method.java:498)
	at org.junit.runners.model.FrameworkMethod$1.runReflectiveCall(FrameworkMethod.java:59)
	at org.junit.internal.runners.model.ReflectiveCallable.run(ReflectiveCallable.java:12)
	at org.junit.runners.model.FrameworkMethod.invokeExplosively(FrameworkMethod.java:56)
	at org.junit.internal.runners.statements.InvokeMethod.evaluate(InvokeMethod.java:17)
	at org.junit.internal.runners.statements.RunBefores.evaluate(RunBefores.java:26)
	at org.junit.internal.runners.statements.RunAfters.evaluate(RunAfters.java:27)
	at org.junit.internal.runners.statements.FailOnTimeout$CallableStatement.call(FailOnTimeout.java:288)
	at org.junit.internal.runners.statements.FailOnTimeout$CallableStatement.call(FailOnTimeout.java:282)
	at java.util.concurrent.FutureTask.run(FutureTask.java:266)
	at java.lang.Thread.run(Thread.java:750)

[INFO] Running org.apache.hadoop.ozone.TestContainerBalancerOperations
[WARNING] Tests run: 1, Failures: 0, Errors: 0, Skipped: 1, Time elapsed: 0.014 s - in org.apache.hadoop.ozone.TestContainerBalancerOperations
[INFO] Running org.apache.hadoop.ozone.shell.TestOzoneDatanodeShell
[INFO] Tests run: 2, Failures: 0, Errors: 0, Skipped: 0, Time elapsed: 0.639 s - in org.apache.hadoop.ozone.shell.TestOzoneDatanodeShell
[INFO] Running org.apache.hadoop.ozone.shell.TestOzoneTenantShell
[INFO] Tests run: 6, Failures: 0, Errors: 0, Skipped: 0, Time elapsed: 14.56 s - in org.apache.hadoop.ozone.shell.TestOzoneTenantShell
[INFO] Running org.apache.hadoop.ozone.shell.TestNSSummaryAdmin
[INFO] Tests run: 3, Failures: 0, Errors: 0, Skipped: 0, Time elapsed: 13.407 s - in org.apache.hadoop.ozone.shell.TestNSSummaryAdmin
[INFO] Running org.apache.hadoop.ozone.shell.TestOzoneShellHA
[INFO] Tests run: 13, Failures: 0, Errors: 0, Skipped: 0, Time elapsed: 82.543 s - in org.apache.hadoop.ozone.shell.TestOzoneShellHA
[INFO] Running org.apache.hadoop.ozone.shell.TestScmAdminHA
[INFO] Tests run: 1, Failures: 0, Errors: 0, Skipped: 0, Time elapsed: 53.871 s - in org.apache.hadoop.ozone.shell.TestScmAdminHA
[INFO] Running org.apache.hadoop.ozone.shell.TestOzoneShellHAWithFSO
[INFO] Tests run: 13, Failures: 0, Errors: 0, Skipped: 0, Time elapsed: 73.217 s - in org.apache.hadoop.ozone.shell.TestOzoneShellHAWithFSO
[INFO] Running org.apache.hadoop.ozone.TestContainerOperations
[INFO] Tests run: 3, Failures: 0, Errors: 0, Skipped: 0, Time elapsed: 41.872 s - in org.apache.hadoop.ozone.TestContainerOperations
[INFO] Running org.apache.hadoop.ozone.fsck.TestContainerMapper
[INFO] Tests run: 1, Failures: 0, Errors: 0, Skipped: 0, Time elapsed: 65.577 s - in org.apache.hadoop.ozone.fsck.TestContainerMapper
[INFO] Running org.apache.hadoop.ozone.TestContainerStateMachineIdempotency
[INFO] Tests run: 1, Failures: 0, Errors: 0, Skipped: 0, Time elapsed: 46.475 s - in org.apache.hadoop.ozone.TestContainerStateMachineIdempotency
[INFO] Running org.apache.hadoop.ozone.recon.TestReconTasks
[INFO] Tests run: 1, Failures: 0, Errors: 0, Skipped: 0, Time elapsed: 69.03 s - in org.apache.hadoop.ozone.recon.TestReconTasks
[INFO] Running org.apache.hadoop.ozone.recon.TestReconScmSnapshot
[INFO] Tests run: 1, Failures: 0, Errors: 0, Skipped: 0, Time elapsed: 51.531 s - in org.apache.hadoop.ozone.recon.TestReconScmSnapshot
[INFO] Running org.apache.hadoop.ozone.recon.TestReconAsPassiveScm
[INFO] Tests run: 2, Failures: 0, Errors: 0, Skipped: 0, Time elapsed: 112.521 s - in org.apache.hadoop.ozone.recon.TestReconAsPassiveScm
[INFO] Running org.apache.hadoop.ozone.recon.TestReconWithOzoneManager
[INFO] Tests run: 1, Failures: 0, Errors: 0, Skipped: 0, Time elapsed: 31.897 s - in org.apache.hadoop.ozone.recon.TestReconWithOzoneManager
[INFO] Running org.apache.hadoop.ozone.recon.TestReconWithOzoneManagerFSO
[INFO] Tests run: 1, Failures: 0, Errors: 0, Skipped: 0, Time elapsed: 42.764 s - in org.apache.hadoop.ozone.recon.TestReconWithOzoneManagerFSO
[INFO] Running org.apache.hadoop.ozone.recon.TestReconWithOzoneManagerHA
[INFO] Tests run: 1, Failures: 0, Errors: 0, Skipped: 0, Time elapsed: 45.095 s - in org.apache.hadoop.ozone.recon.TestReconWithOzoneManagerHA
[INFO] Running org.apache.hadoop.ozone.recon.TestReconScmHASnapshot
[INFO] Tests run: 1, Failures: 0, Errors: 0, Skipped: 0, Time elapsed: 61.641 s - in org.apache.hadoop.ozone.recon.TestReconScmHASnapshot
[INFO] Running org.apache.hadoop.ozone.dn.scrubber.TestDataScrubber
[INFO] Tests run: 1, Failures: 0, Errors: 0, Skipped: 0, Time elapsed: 51.418 s - in org.apache.hadoop.ozone.dn.scrubber.TestDataScrubber
[INFO] Running org.apache.hadoop.ozone.dn.ratis.TestDnRatisLogParser
[INFO] Tests run: 1, Failures: 0, Errors: 0, Skipped: 0, Time elapsed: 25.369 s - in org.apache.hadoop.ozone.dn.ratis.TestDnRatisLogParser
[INFO] Running org.apache.hadoop.ozone.dn.volume.TestDatanodeHddsVolumeFailureToleration
[INFO] Tests run: 1, Failures: 0, Errors: 0, Skipped: 0, Time elapsed: 43.373 s - in org.apache.hadoop.ozone.dn.volume.TestDatanodeHddsVolumeFailureToleration
[INFO] Running org.apache.hadoop.ozone.dn.volume.TestDatanodeHddsVolumeFailureDetection
[INFO] Tests run: 3, Failures: 0, Errors: 0, Skipped: 0, Time elapsed: 84.557 s - in org.apache.hadoop.ozone.dn.volume.TestDatanodeHddsVolumeFailureDetection
[INFO] Running org.apache.hadoop.ozone.TestOzoneConfigurationFields
[INFO] Tests run: 4, Failures: 0, Errors: 0, Skipped: 0, Time elapsed: 0.399 s - in org.apache.hadoop.ozone.TestOzoneConfigurationFields
[INFO] Running org.apache.hadoop.ozone.container.ozoneimpl.TestOzoneContainer
[INFO] Tests run: 7, Failures: 0, Errors: 0, Skipped: 0, Time elapsed: 124.914 s - in org.apache.hadoop.ozone.container.ozoneimpl.TestOzoneContainer
[INFO] Running org.apache.hadoop.ozone.container.ozoneimpl.TestSecureOzoneContainer
[INFO] Tests run: 5, Failures: 0, Errors: 0, Skipped: 0, Time elapsed: 17.266 s - in org.apache.hadoop.ozone.container.ozoneimpl.TestSecureOzoneContainer
[INFO] Running org.apache.hadoop.ozone.container.metrics.TestContainerMetrics
[INFO] Tests run: 1, Failures: 0, Errors: 0, Skipped: 0, Time elapsed: 8.975 s - in org.apache.hadoop.ozone.container.metrics.TestContainerMetrics
[INFO] Running org.apache.hadoop.ozone.container.TestContainerReplication
[INFO] Tests run: 3, Failures: 0, Errors: 0, Skipped: 0, Time elapsed: 167.374 s - in org.apache.hadoop.ozone.container.TestContainerReplication
[INFO] Running org.apache.hadoop.ozone.container.server.TestSecureContainerServer
[INFO] Tests run: 2, Failures: 0, Errors: 0, Skipped: 0, Time elapsed: 29.289 s - in org.apache.hadoop.ozone.container.server.TestSecureContainerServer
[INFO] Running org.apache.hadoop.ozone.container.common.statemachine.commandhandler.TestDeleteContainerHandler
[INFO] Tests run: 2, Failures: 0, Errors: 0, Skipped: 0, Time elapsed: 52.948 s - in org.apache.hadoop.ozone.container.common.statemachine.commandhandler.TestDeleteContainerHandler
[INFO] Running org.apache.hadoop.ozone.container.common.statemachine.commandhandler.TestRefreshVolumeUsageHandler
[INFO] Tests run: 1, Failures: 0, Errors: 0, Skipped: 0, Time elapsed: 44.051 s - in org.apache.hadoop.ozone.container.common.statemachine.commandhandler.TestRefreshVolumeUsageHandler
[INFO] Running org.apache.hadoop.ozone.container.common.statemachine.commandhandler.TestBlockDeletion
[INFO] Tests run: 3, Failures: 0, Errors: 0, Skipped: 0, Time elapsed: 201.636 s - in org.apache.hadoop.ozone.container.common.statemachine.commandhandler.TestBlockDeletion
[INFO] Running org.apache.hadoop.ozone.container.common.statemachine.commandhandler.TestCloseContainerHandler
[INFO] Tests run: 1, Failures: 0, Errors: 0, Skipped: 0, Time elapsed: 34.463 s - in org.apache.hadoop.ozone.container.common.statemachine.commandhandler.TestCloseContainerHandler
[INFO] Running org.apache.hadoop.ozone.container.common.transport.server.ratis.TestCSMMetrics
[INFO] Tests run: 1, Failures: 0, Errors: 0, Skipped: 0, Time elapsed: 13.906 s - in org.apache.hadoop.ozone.container.common.transport.server.ratis.TestCSMMetrics
[INFO] Running org.apache.hadoop.ozone.TestMiniOzoneCluster
[INFO] Tests run: 3, Failures: 0, Errors: 0, Skipped: 0, Time elapsed: 50.669 s - in org.apache.hadoop.ozone.TestMiniOzoneCluster
[INFO] Running org.apache.hadoop.ozone.TestDelegationToken
[INFO] Tests run: 1, Failures: 0, Errors: 0, Skipped: 0, Time elapsed: 15.92 s - in org.apache.hadoop.ozone.TestDelegationToken
[INFO] 
[INFO] Results:
[INFO] 
[ERROR] Errors: 
[ERROR]   TestOzoneHARatisLogParser.testRatisLogParsing:129  Timeout Timed out waiting ...
[INFO] 
[ERROR] Tests run: 137, Failures: 0, Errors: 1, Skipped: 2
[INFO] 
[INFO] 
[INFO] ------------------------------------------------------------------------
[INFO] Skipping Apache Ozone Mini Ozone Chaos Tests
[INFO] This project has been banned from the build due to previous failures.
[INFO] ------------------------------------------------------------------------
[INFO] ------------------------------------------------------------------------
[INFO] Reactor Summary for Apache Ozone Integration Tests 1.3.0-SNAPSHOT:
[INFO] 
[INFO] Apache Ozone Integration Tests ..................... FAILURE [54:22 min]
[INFO] Apache Ozone Mini Ozone Chaos Tests ................ SKIPPED
[INFO] ------------------------------------------------------------------------
[INFO] BUILD FAILURE
[INFO] ------------------------------------------------------------------------
[INFO] Total time:  54:23 min
[INFO] Finished at: 2022-06-08T20:05:11Z
[INFO] ------------------------------------------------------------------------
[ERROR] Failed to execute goal org.apache.maven.plugins:maven-surefire-plugin:3.0.0-M5:test (default-test) on project ozone-integration-test: There are test failures.
[ERROR] 
[ERROR] Please refer to /home/runner/work/ozone/ozone/hadoop-ozone/integration-test/target/surefire-reports for the individual test results.
[ERROR] Please refer to dump files (if any exist) [date].dump, [date]-jvmRun[N].dump and [date].dumpstream.
[ERROR] -> [Help 1]
[ERROR] 
[ERROR] To see the full stack trace of the errors, re-run Maven with the -e switch.
[ERROR] Re-run Maven using the -X switch to enable full debug logging.
[ERROR] 
[ERROR] For more information about the errors and possible solutions, please read the following articles:
[ERROR] [Help 1] http://cwiki.apache.org/confluence/display/MAVEN/MojoFailureException
