[INFO] Scanning for projects...
[INFO] ------------------------------------------------------------------------
[INFO] Detecting the operating system and CPU architecture
[INFO] ------------------------------------------------------------------------
[INFO] os.detected.name: linux
[INFO] os.detected.arch: x86_64
[INFO] os.detected.version: 5.4
[INFO] os.detected.version.major: 5
[INFO] os.detected.version.minor: 4
[INFO] os.detected.release: ubuntu
[INFO] os.detected.release.version: 18.04
[INFO] os.detected.release.like.ubuntu: true
[INFO] os.detected.release.like.debian: true
[INFO] os.detected.classifier: linux-x86_64
[INFO] ------------------------------------------------------------------------
[INFO] Reactor Build Order:
[INFO] 
[INFO] Apache Ozone Integration Tests                                     [jar]
[INFO] Apache Ozone Mini Ozone Chaos Tests                                [jar]
[INFO] 
[INFO] --------------< org.apache.ozone:ozone-integration-test >---------------
[INFO] Building Apache Ozone Integration Tests 1.2.0-SNAPSHOT             [1/2]
[INFO] --------------------------------[ jar ]---------------------------------
[INFO] 
[INFO] --- maven-antrun-plugin:1.3:run (create-testdirs) @ ozone-integration-test ---
[INFO] Executing tasks
[INFO] Executed tasks
[INFO] 
[INFO] --- jacoco-maven-plugin:0.8.5:prepare-agent (default-prepare-agent) @ ozone-integration-test ---
[INFO] argLine set to -javaagent:/home/runner/.m2/repository/org/jacoco/org.jacoco.agent/0.8.5/org.jacoco.agent-0.8.5-runtime.jar=destfile=/home/runner/work/ozone/ozone/hadoop-ozone/integration-test/target/jacoco.exec,includes=org.apache.hadoop.hdds.*:org.apache.hadoop.ozone.*:org.apache.hadoop.fs.ozone.*
[INFO] 
[INFO] --- maven-remote-resources-plugin:1.5:process (default) @ ozone-integration-test ---
[INFO] 
[INFO] --- maven-resources-plugin:3.1.0:resources (default-resources) @ ozone-integration-test ---
[INFO] Using 'UTF-8' encoding to copy filtered resources.
[INFO] skip non existing resourceDirectory /home/runner/work/ozone/ozone/hadoop-ozone/integration-test/src/main/resources
[INFO] Copying 2 resources
[INFO] 
[INFO] --- maven-compiler-plugin:3.1:compile (default-compile) @ ozone-integration-test ---
[INFO] No sources to compile
[INFO] 
[INFO] --- maven-resources-plugin:3.1.0:testResources (default-testResources) @ ozone-integration-test ---
[INFO] Using 'UTF-8' encoding to copy filtered resources.
[INFO] Copying 21 resources
[INFO] Copying 2 resources
[INFO] 
[INFO] --- maven-compiler-plugin:3.1:testCompile (default-testCompile) @ ozone-integration-test ---
[INFO] Compiling 11 source files to /home/runner/work/ozone/ozone/hadoop-ozone/integration-test/target/test-classes
[INFO] 
[INFO] --- maven-surefire-plugin:3.0.0-M1:test (default-test) @ ozone-integration-test ---
[INFO] 
[INFO] -------------------------------------------------------
[INFO]  T E S T S
[INFO] -------------------------------------------------------
[INFO] Running org.apache.hadoop.ozone.TestContainerOperations
[INFO] Tests run: 2, Failures: 0, Errors: 0, Skipped: 0, Time elapsed: 39.46 s - in org.apache.hadoop.ozone.TestContainerOperations
[INFO] Running org.apache.hadoop.ozone.container.server.TestSecureContainerServer
[INFO] Tests run: 2, Failures: 0, Errors: 0, Skipped: 0, Time elapsed: 32.701 s - in org.apache.hadoop.ozone.container.server.TestSecureContainerServer
[INFO] Running org.apache.hadoop.ozone.container.server.TestContainerServer
[WARNING] Tests run: 1, Failures: 0, Errors: 0, Skipped: 1, Time elapsed: 0.002 s - in org.apache.hadoop.ozone.container.server.TestContainerServer
[INFO] Running org.apache.hadoop.ozone.container.common.transport.server.ratis.TestCSMMetrics
[INFO] Tests run: 1, Failures: 0, Errors: 0, Skipped: 0, Time elapsed: 14.932 s - in org.apache.hadoop.ozone.container.common.transport.server.ratis.TestCSMMetrics
[INFO] Running org.apache.hadoop.ozone.container.common.statemachine.commandhandler.TestBlockDeletion
[INFO] Tests run: 3, Failures: 0, Errors: 0, Skipped: 0, Time elapsed: 206.014 s - in org.apache.hadoop.ozone.container.common.statemachine.commandhandler.TestBlockDeletion
[INFO] Running org.apache.hadoop.ozone.container.common.statemachine.commandhandler.TestDeleteContainerHandler
[INFO] Tests run: 2, Failures: 0, Errors: 0, Skipped: 0, Time elapsed: 33.452 s - in org.apache.hadoop.ozone.container.common.statemachine.commandhandler.TestDeleteContainerHandler
[INFO] Running org.apache.hadoop.ozone.container.common.statemachine.commandhandler.TestCloseContainerHandler
[INFO] Tests run: 1, Failures: 0, Errors: 0, Skipped: 0, Time elapsed: 24.612 s - in org.apache.hadoop.ozone.container.common.statemachine.commandhandler.TestCloseContainerHandler
[INFO] Running org.apache.hadoop.ozone.container.common.statemachine.commandhandler.TestCloseContainerByPipeline
[WARNING] Tests run: 1, Failures: 0, Errors: 0, Skipped: 1, Time elapsed: 0.002 s - in org.apache.hadoop.ozone.container.common.statemachine.commandhandler.TestCloseContainerByPipeline
[INFO] Running org.apache.hadoop.ozone.container.TestContainerReplication
[INFO] Tests run: 3, Failures: 0, Errors: 0, Skipped: 0, Time elapsed: 145.228 s - in org.apache.hadoop.ozone.container.TestContainerReplication
[INFO] Running org.apache.hadoop.ozone.container.metrics.TestContainerMetrics
[INFO] Tests run: 1, Failures: 0, Errors: 0, Skipped: 0, Time elapsed: 6.47 s - in org.apache.hadoop.ozone.container.metrics.TestContainerMetrics
[INFO] Running org.apache.hadoop.ozone.container.ozoneimpl.TestOzoneContainer
[WARNING] Tests run: 1, Failures: 0, Errors: 0, Skipped: 1, Time elapsed: 0.002 s - in org.apache.hadoop.ozone.container.ozoneimpl.TestOzoneContainer
[INFO] Running org.apache.hadoop.ozone.container.ozoneimpl.TestSecureOzoneContainer
[INFO] Tests run: 5, Failures: 0, Errors: 0, Skipped: 0, Time elapsed: 6.258 s - in org.apache.hadoop.ozone.container.ozoneimpl.TestSecureOzoneContainer
[INFO] Running org.apache.hadoop.ozone.container.ozoneimpl.TestOzoneContainerWithTLS
[WARNING] Tests run: 1, Failures: 0, Errors: 0, Skipped: 1, Time elapsed: 0.002 s - in org.apache.hadoop.ozone.container.ozoneimpl.TestOzoneContainerWithTLS
[INFO] Running org.apache.hadoop.ozone.TestContainerBalancerOperations
[WARNING] Tests run: 1, Failures: 0, Errors: 0, Skipped: 1, Time elapsed: 0.007 s - in org.apache.hadoop.ozone.TestContainerBalancerOperations
[INFO] Running org.apache.hadoop.ozone.shell.TestScmAdminHA
[INFO] Tests run: 1, Failures: 0, Errors: 0, Skipped: 0, Time elapsed: 40.613 s - in org.apache.hadoop.ozone.shell.TestScmAdminHA
[INFO] Running org.apache.hadoop.ozone.shell.TestOzoneDatanodeShell
[INFO] Tests run: 2, Failures: 0, Errors: 0, Skipped: 0, Time elapsed: 0.486 s - in org.apache.hadoop.ozone.shell.TestOzoneDatanodeShell
[INFO] Running org.apache.hadoop.ozone.shell.TestOzoneShellHA
[INFO] Tests run: 6, Failures: 0, Errors: 0, Skipped: 0, Time elapsed: 55.214 s - in org.apache.hadoop.ozone.shell.TestOzoneShellHA
[INFO] Running org.apache.hadoop.ozone.shell.TestNSSummaryAdmin
[INFO] Tests run: 1, Failures: 0, Errors: 0, Skipped: 0, Time elapsed: 9.603 s - in org.apache.hadoop.ozone.shell.TestNSSummaryAdmin
[INFO] Running org.apache.hadoop.ozone.TestSecureOzoneCluster
[INFO] Tests run: 11, Failures: 0, Errors: 0, Skipped: 0, Time elapsed: 63.869 s - in org.apache.hadoop.ozone.TestSecureOzoneCluster
[INFO] Running org.apache.hadoop.ozone.TestMiniOzoneCluster
[INFO] Tests run: 5, Failures: 0, Errors: 0, Skipped: 0, Time elapsed: 132.944 s - in org.apache.hadoop.ozone.TestMiniOzoneCluster
[INFO] Running org.apache.hadoop.ozone.om.TestOmLDBCli
[INFO] Tests run: 1, Failures: 0, Errors: 0, Skipped: 0, Time elapsed: 0.792 s - in org.apache.hadoop.ozone.om.TestOmLDBCli
[INFO] Running org.apache.hadoop.ozone.om.TestOMEpochForNonRatis
[INFO] Tests run: 2, Failures: 0, Errors: 0, Skipped: 0, Time elapsed: 39.144 s - in org.apache.hadoop.ozone.om.TestOMEpochForNonRatis
[INFO] Running org.apache.hadoop.ozone.om.TestOzoneManagerHAMetadataOnly
[WARNING] Tests run: 10, Failures: 0, Errors: 0, Skipped: 2, Time elapsed: 90.294 s - in org.apache.hadoop.ozone.om.TestOzoneManagerHAMetadataOnly
[INFO] Running org.apache.hadoop.ozone.om.TestOmInit
[INFO] Tests run: 1, Failures: 0, Errors: 0, Skipped: 0, Time elapsed: 39.852 s - in org.apache.hadoop.ozone.om.TestOmInit
[INFO] Running org.apache.hadoop.ozone.om.TestOzoneManagerRestart
[INFO] Tests run: 3, Failures: 0, Errors: 0, Skipped: 0, Time elapsed: 50.363 s - in org.apache.hadoop.ozone.om.TestOzoneManagerRestart
[INFO] Running org.apache.hadoop.ozone.om.TestOMUpgradeFinalization
[WARNING] Tests run: 2, Failures: 0, Errors: 0, Skipped: 2, Time elapsed: 0.074 s - in org.apache.hadoop.ozone.om.TestOMUpgradeFinalization
[INFO] Running org.apache.hadoop.ozone.om.TestOzoneManagerPrepare
[WARNING] Tests run: 6, Failures: 0, Errors: 0, Skipped: 1, Time elapsed: 137.073 s - in org.apache.hadoop.ozone.om.TestOzoneManagerPrepare
[INFO] Running org.apache.hadoop.ozone.om.TestKeyManagerImpl
[INFO] Tests run: 20, Failures: 0, Errors: 0, Skipped: 0, Time elapsed: 74.788 s - in org.apache.hadoop.ozone.om.TestKeyManagerImpl
[INFO] Running org.apache.hadoop.ozone.om.ratis.TestOzoneManagerRatisRequest
[INFO] Tests run: 1, Failures: 0, Errors: 0, Skipped: 0, Time elapsed: 2.831 s - in org.apache.hadoop.ozone.om.ratis.TestOzoneManagerRatisRequest
[INFO] Running org.apache.hadoop.ozone.om.TestOzoneManagerHAWithFailover
[INFO] Tests run: 1, Failures: 0, Errors: 0, Skipped: 0, Time elapsed: 47.077 s - in org.apache.hadoop.ozone.om.TestOzoneManagerHAWithFailover
[INFO] Running org.apache.hadoop.ozone.om.snapshot.TestOzoneManagerSnapshotProvider
[INFO] Tests run: 1, Failures: 0, Errors: 0, Skipped: 0, Time elapsed: 35.486 s - in org.apache.hadoop.ozone.om.snapshot.TestOzoneManagerSnapshotProvider
[INFO] Running org.apache.hadoop.ozone.om.TestOmBlockVersioning
[INFO] Tests run: 2, Failures: 0, Errors: 0, Skipped: 0, Time elapsed: 36.162 s - in org.apache.hadoop.ozone.om.TestOmBlockVersioning
[INFO] Running org.apache.hadoop.ozone.om.TestOmAcls
[INFO] Tests run: 2, Failures: 0, Errors: 0, Skipped: 0, Time elapsed: 39.322 s - in org.apache.hadoop.ozone.om.TestOmAcls
[INFO] Running org.apache.hadoop.ozone.om.TestRecursiveAclWithFSO
[INFO] Tests run: 1, Failures: 0, Errors: 0, Skipped: 0, Time elapsed: 41.265 s - in org.apache.hadoop.ozone.om.TestRecursiveAclWithFSO
[INFO] Running org.apache.hadoop.ozone.om.TestOzoneManagerRocksDBLogging
[INFO] Tests run: 1, Failures: 0, Errors: 0, Skipped: 0, Time elapsed: 40.697 s - in org.apache.hadoop.ozone.om.TestOzoneManagerRocksDBLogging
[INFO] Running org.apache.hadoop.ozone.om.TestOmStartupSlvLessThanMlv
[INFO] Tests run: 1, Failures: 0, Errors: 0, Skipped: 0, Time elapsed: 2.922 s - in org.apache.hadoop.ozone.om.TestOmStartupSlvLessThanMlv
[INFO] Running org.apache.hadoop.ozone.om.TestOzoneManagerHAKeyDeletion
[INFO] Tests run: 1, Failures: 0, Errors: 0, Skipped: 0, Time elapsed: 57.15 s - in org.apache.hadoop.ozone.om.TestOzoneManagerHAKeyDeletion
[INFO] Running org.apache.hadoop.ozone.om.parser.TestOMRatisLogParser
[INFO] Tests run: 1, Failures: 0, Errors: 0, Skipped: 0, Time elapsed: 35.748 s - in org.apache.hadoop.ozone.om.parser.TestOMRatisLogParser
[INFO] Running org.apache.hadoop.ozone.om.TestObjectStoreWithFSO
[INFO] Tests run: 8, Failures: 0, Errors: 0, Skipped: 0, Time elapsed: 46.763 s - in org.apache.hadoop.ozone.om.TestObjectStoreWithFSO
[INFO] Running org.apache.hadoop.ozone.om.TestOzoneManagerConfiguration
[INFO] Tests run: 9, Failures: 0, Errors: 0, Skipped: 0, Time elapsed: 45.274 s - in org.apache.hadoop.ozone.om.TestOzoneManagerConfiguration
[INFO] Running org.apache.hadoop.ozone.om.TestOMRatisSnapshots
[INFO] Tests run: 3, Failures: 0, Errors: 0, Skipped: 0, Time elapsed: 143.84 s - in org.apache.hadoop.ozone.om.TestOMRatisSnapshots
[INFO] Running org.apache.hadoop.ozone.om.TestScmSafeMode
[WARNING] Tests run: 1, Failures: 0, Errors: 0, Skipped: 1, Time elapsed: 0.001 s - in org.apache.hadoop.ozone.om.TestScmSafeMode
[INFO] Running org.apache.hadoop.ozone.om.TestOzoneManagerHAWithData
[ERROR] Tests run: 7, Failures: 0, Errors: 1, Skipped: 1, Time elapsed: 420.643 s <<< FAILURE! - in org.apache.hadoop.ozone.om.TestOzoneManagerHAWithData
[ERROR] testOMRatisSnapshot  Time elapsed: 300.024 s  <<< ERROR!
org.junit.runners.model.TestTimedOutException: test timed out after 300 seconds
	at java.lang.Object.wait(Native Method)
	at java.lang.Object.wait(Object.java:502)
	at org.apache.hadoop.util.concurrent.AsyncGet$Util.wait(AsyncGet.java:59)
	at org.apache.hadoop.ipc.Client.getRpcResponse(Client.java:1561)
	at org.apache.hadoop.ipc.Client.call(Client.java:1519)
	at org.apache.hadoop.ipc.Client.call(Client.java:1416)
	at org.apache.hadoop.ipc.ProtobufRpcEngine$Invoker.invoke(ProtobufRpcEngine.java:236)
	at org.apache.hadoop.ipc.ProtobufRpcEngine$Invoker.invoke(ProtobufRpcEngine.java:123)
	at com.sun.proxy.$Proxy51.submitRequest(Unknown Source)
	at sun.reflect.GeneratedMethodAccessor42.invoke(Unknown Source)
	at sun.reflect.DelegatingMethodAccessorImpl.invoke(DelegatingMethodAccessorImpl.java:43)
	at java.lang.reflect.Method.invoke(Method.java:498)
	at org.apache.hadoop.io.retry.RetryInvocationHandler.invokeMethod(RetryInvocationHandler.java:422)
	at org.apache.hadoop.io.retry.RetryInvocationHandler$Call.invokeMethod(RetryInvocationHandler.java:165)
	at org.apache.hadoop.io.retry.RetryInvocationHandler$Call.invoke(RetryInvocationHandler.java:157)
	at org.apache.hadoop.io.retry.RetryInvocationHandler$Call.invokeOnce(RetryInvocationHandler.java:95)
	at org.apache.hadoop.io.retry.RetryInvocationHandler.invoke(RetryInvocationHandler.java:359)
	at com.sun.proxy.$Proxy51.submitRequest(Unknown Source)
	at org.apache.hadoop.ozone.om.protocolPB.Hadoop3OmTransport.submitRequest(Hadoop3OmTransport.java:80)
	at org.apache.hadoop.ozone.om.protocolPB.OzoneManagerProtocolClientSideTranslatorPB.submitRequest(OzoneManagerProtocolClientSideTranslatorPB.java:230)
	at org.apache.hadoop.ozone.om.protocolPB.OzoneManagerProtocolClientSideTranslatorPB.openKey(OzoneManagerProtocolClientSideTranslatorPB.java:604)
	at org.apache.hadoop.ozone.client.rpc.RpcClient.createKey(RpcClient.java:801)
	at org.apache.hadoop.ozone.client.rpc.RpcClient.createKey(RpcClient.java:758)
	at org.apache.hadoop.ozone.client.OzoneBucket.createKey(OzoneBucket.java:511)
	at org.apache.hadoop.ozone.om.TestOzoneManagerHA.createKey(TestOzoneManagerHA.java:219)
	at org.apache.hadoop.ozone.om.TestOzoneManagerHAWithData.testOMRatisSnapshot(TestOzoneManagerHAWithData.java:377)
	at sun.reflect.NativeMethodAccessorImpl.invoke0(Native Method)
	at sun.reflect.NativeMethodAccessorImpl.invoke(NativeMethodAccessorImpl.java:62)
	at sun.reflect.DelegatingMethodAccessorImpl.invoke(DelegatingMethodAccessorImpl.java:43)
	at java.lang.reflect.Method.invoke(Method.java:498)
	at org.junit.runners.model.FrameworkMethod$1.runReflectiveCall(FrameworkMethod.java:59)
	at org.junit.internal.runners.model.ReflectiveCallable.run(ReflectiveCallable.java:12)
	at org.junit.runners.model.FrameworkMethod.invokeExplosively(FrameworkMethod.java:56)
	at org.junit.internal.runners.statements.InvokeMethod.evaluate(InvokeMethod.java:17)
	at org.junit.internal.runners.statements.RunAfters.evaluate(RunAfters.java:27)
	at org.junit.rules.ExpectedException$ExpectedExceptionStatement.evaluate(ExpectedException.java:258)
	at org.junit.internal.runners.statements.FailOnTimeout$CallableStatement.call(FailOnTimeout.java:288)
	at org.junit.internal.runners.statements.FailOnTimeout$CallableStatement.call(FailOnTimeout.java:282)
	at java.util.concurrent.FutureTask.run(FutureTask.java:266)
	at java.lang.Thread.run(Thread.java:748)

[INFO] Running org.apache.hadoop.ozone.om.TestOMDbCheckpointServlet
[INFO] Tests run: 3, Failures: 0, Errors: 0, Skipped: 0, Time elapsed: 41.07 s - in org.apache.hadoop.ozone.om.TestOMDbCheckpointServlet
[INFO] Running org.apache.hadoop.ozone.om.TestOzoneManagerRestInterface
[INFO] Tests run: 1, Failures: 0, Errors: 0, Skipped: 0, Time elapsed: 35.974 s - in org.apache.hadoop.ozone.om.TestOzoneManagerRestInterface
[INFO] Running org.apache.hadoop.ozone.om.TestSecureOzoneManager
[INFO] Tests run: 2, Failures: 0, Errors: 0, Skipped: 0, Time elapsed: 2.024 s - in org.apache.hadoop.ozone.om.TestSecureOzoneManager
[INFO] Running org.apache.hadoop.ozone.om.TestOzoneManagerHAWithACL
[INFO] Tests run: 1, Failures: 0, Errors: 0, Skipped: 0, Time elapsed: 39.297 s - in org.apache.hadoop.ozone.om.TestOzoneManagerHAWithACL
[INFO] Running org.apache.hadoop.ozone.om.TestOmMetrics
[INFO] Tests run: 5, Failures: 0, Errors: 0, Skipped: 0, Time elapsed: 45.072 s - in org.apache.hadoop.ozone.om.TestOmMetrics
[INFO] Running org.apache.hadoop.ozone.om.TestKeyPurging
[INFO] Tests run: 1, Failures: 0, Errors: 0, Skipped: 0, Time elapsed: 41.989 s - in org.apache.hadoop.ozone.om.TestKeyPurging
[INFO] Running org.apache.hadoop.ozone.om.TestOzoneManagerBootstrap
[INFO] Tests run: 3, Failures: 0, Errors: 0, Skipped: 0, Time elapsed: 160.09 s - in org.apache.hadoop.ozone.om.TestOzoneManagerBootstrap
[INFO] Running org.apache.hadoop.ozone.om.TestContainerReportWithKeys
[INFO] Tests run: 1, Failures: 0, Errors: 0, Skipped: 0, Time elapsed: 40.379 s - in org.apache.hadoop.ozone.om.TestContainerReportWithKeys
[INFO] Running org.apache.hadoop.ozone.om.TestOzoneManagerListVolumes
[INFO] Tests run: 6, Failures: 0, Errors: 0, Skipped: 0, Time elapsed: 20.375 s - in org.apache.hadoop.ozone.om.TestOzoneManagerListVolumes
[INFO] Running org.apache.hadoop.ozone.TestOzoneConfigurationFields
[INFO] Tests run: 4, Failures: 0, Errors: 0, Skipped: 0, Time elapsed: 0.327 s - in org.apache.hadoop.ozone.TestOzoneConfigurationFields
[INFO] Running org.apache.hadoop.ozone.TestMiniOzoneOMHACluster
[INFO] Tests run: 1, Failures: 0, Errors: 0, Skipped: 0, Time elapsed: 35.43 s - in org.apache.hadoop.ozone.TestMiniOzoneOMHACluster
[INFO] Running org.apache.hadoop.ozone.TestContainerStateMachineIdempotency
[INFO] Tests run: 1, Failures: 0, Errors: 0, Skipped: 0, Time elapsed: 42.37 s - in org.apache.hadoop.ozone.TestContainerStateMachineIdempotency
[INFO] Running org.apache.hadoop.ozone.dn.ratis.TestDnRatisLogParser
[INFO] Tests run: 1, Failures: 0, Errors: 0, Skipped: 0, Time elapsed: 21.206 s - in org.apache.hadoop.ozone.dn.ratis.TestDnRatisLogParser
[INFO] Running org.apache.hadoop.ozone.dn.scrubber.TestDataScrubber
[INFO] Tests run: 1, Failures: 0, Errors: 0, Skipped: 0, Time elapsed: 33.412 s - in org.apache.hadoop.ozone.dn.scrubber.TestDataScrubber
[INFO] Running org.apache.hadoop.ozone.dn.volume.TestDatanodeHddsVolumeFailureDetection
[INFO] Tests run: 3, Failures: 0, Errors: 0, Skipped: 0, Time elapsed: 57.9 s - in org.apache.hadoop.ozone.dn.volume.TestDatanodeHddsVolumeFailureDetection
[INFO] Running org.apache.hadoop.ozone.dn.volume.TestDatanodeHddsVolumeFailureToleration
[INFO] Tests run: 1, Failures: 0, Errors: 0, Skipped: 0, Time elapsed: 37.006 s - in org.apache.hadoop.ozone.dn.volume.TestDatanodeHddsVolumeFailureToleration
[INFO] Running org.apache.hadoop.ozone.recon.TestReconTasks
[INFO] Tests run: 1, Failures: 0, Errors: 0, Skipped: 0, Time elapsed: 71.451 s - in org.apache.hadoop.ozone.recon.TestReconTasks
[INFO] Running org.apache.hadoop.ozone.recon.TestReconWithOzoneManager
[INFO] Tests run: 1, Failures: 0, Errors: 0, Skipped: 0, Time elapsed: 26.367 s - in org.apache.hadoop.ozone.recon.TestReconWithOzoneManager
[INFO] Running org.apache.hadoop.ozone.recon.TestReconAsPassiveScm
[INFO] Tests run: 2, Failures: 0, Errors: 0, Skipped: 0, Time elapsed: 87.625 s - in org.apache.hadoop.ozone.recon.TestReconAsPassiveScm
[INFO] Running org.apache.hadoop.ozone.recon.TestReconWithOzoneManagerFSO
[INFO] Tests run: 1, Failures: 0, Errors: 0, Skipped: 0, Time elapsed: 27.018 s - in org.apache.hadoop.ozone.recon.TestReconWithOzoneManagerFSO
[INFO] Running org.apache.hadoop.ozone.recon.TestReconWithOzoneManagerHA
[INFO] Tests run: 1, Failures: 0, Errors: 0, Skipped: 0, Time elapsed: 41.701 s - in org.apache.hadoop.ozone.recon.TestReconWithOzoneManagerHA
[INFO] Running org.apache.hadoop.ozone.fsck.TestContainerMapper
[INFO] Tests run: 1, Failures: 0, Errors: 0, Skipped: 0, Time elapsed: 37.042 s - in org.apache.hadoop.ozone.fsck.TestContainerMapper
[INFO] Running org.apache.hadoop.ozone.TestDelegationToken
[INFO] Tests run: 1, Failures: 0, Errors: 0, Skipped: 0, Time elapsed: 15.392 s - in org.apache.hadoop.ozone.TestDelegationToken
[INFO] Running org.apache.hadoop.ozone.freon.TestDataValidateWithSafeByteOperations
[INFO] Tests run: 2, Failures: 0, Errors: 0, Skipped: 0, Time elapsed: 63.174 s - in org.apache.hadoop.ozone.freon.TestDataValidateWithSafeByteOperations
[INFO] Running org.apache.hadoop.ozone.freon.TestHadoopDirTreeGeneratorWithFSO
[INFO] Tests run: 1, Failures: 0, Errors: 0, Skipped: 0, Time elapsed: 82.671 s - in org.apache.hadoop.ozone.freon.TestHadoopDirTreeGeneratorWithFSO
[INFO] Running org.apache.hadoop.ozone.freon.TestHadoopDirTreeGenerator
[INFO] Tests run: 1, Failures: 0, Errors: 0, Skipped: 0, Time elapsed: 80.689 s - in org.apache.hadoop.ozone.freon.TestHadoopDirTreeGenerator
[INFO] Running org.apache.hadoop.ozone.freon.TestDataValidateWithDummyContainers
[INFO] Tests run: 2, Failures: 0, Errors: 0, Skipped: 0, Time elapsed: 78.202 s - in org.apache.hadoop.ozone.freon.TestDataValidateWithDummyContainers
[INFO] Running org.apache.hadoop.ozone.freon.TestDataValidateWithUnsafeByteOperations
[INFO] Tests run: 2, Failures: 0, Errors: 0, Skipped: 0, Time elapsed: 56.42 s - in org.apache.hadoop.ozone.freon.TestDataValidateWithUnsafeByteOperations
[INFO] Running org.apache.hadoop.ozone.freon.TestRandomKeyGenerator
[INFO] Tests run: 7, Failures: 0, Errors: 0, Skipped: 0, Time elapsed: 217.341 s - in org.apache.hadoop.ozone.freon.TestRandomKeyGenerator
[INFO] Running org.apache.hadoop.ozone.freon.TestFreonWithPipelineDestroy
[INFO] Tests run: 1, Failures: 0, Errors: 0, Skipped: 0, Time elapsed: 49.679 s - in org.apache.hadoop.ozone.freon.TestFreonWithPipelineDestroy
[INFO] Running org.apache.hadoop.ozone.freon.TestHadoopNestedDirGenerator
[INFO] Tests run: 1, Failures: 0, Errors: 0, Skipped: 0, Time elapsed: 49.161 s - in org.apache.hadoop.ozone.freon.TestHadoopNestedDirGenerator
[INFO] Running org.apache.hadoop.ozone.freon.TestFreonWithDatanodeFastRestart
[WARNING] Tests run: 1, Failures: 0, Errors: 0, Skipped: 1, Time elapsed: 0.007 s - in org.apache.hadoop.ozone.freon.TestFreonWithDatanodeFastRestart
[INFO] Running org.apache.hadoop.ozone.scm.TestSCMMXBean
[INFO] Tests run: 2, Failures: 0, Errors: 0, Skipped: 0, Time elapsed: 35.206 s - in org.apache.hadoop.ozone.scm.TestSCMMXBean
[INFO] Running org.apache.hadoop.ozone.scm.pipeline.TestSCMPipelineBytesWrittenMetrics
[INFO] Tests run: 1, Failures: 0, Errors: 0, Skipped: 0, Time elapsed: 61.475 s - in org.apache.hadoop.ozone.scm.pipeline.TestSCMPipelineBytesWrittenMetrics
[INFO] Running org.apache.hadoop.ozone.scm.pipeline.TestSCMPipelineMetrics
[INFO] Tests run: 3, Failures: 0, Errors: 0, Skipped: 0, Time elapsed: 108.822 s - in org.apache.hadoop.ozone.scm.pipeline.TestSCMPipelineMetrics
[INFO] Running org.apache.hadoop.ozone.scm.pipeline.TestPipelineManagerMXBean
[INFO] Tests run: 1, Failures: 0, Errors: 0, Skipped: 0, Time elapsed: 38.971 s - in org.apache.hadoop.ozone.scm.pipeline.TestPipelineManagerMXBean
[INFO] Running org.apache.hadoop.ozone.scm.TestXceiverClientGrpc
[INFO] Tests run: 4, Failures: 0, Errors: 0, Skipped: 0, Time elapsed: 1.439 s - in org.apache.hadoop.ozone.scm.TestXceiverClientGrpc
[INFO] Running org.apache.hadoop.ozone.scm.TestXceiverClientManager
[INFO] Tests run: 4, Failures: 0, Errors: 0, Skipped: 0, Time elapsed: 34.374 s - in org.apache.hadoop.ozone.scm.TestXceiverClientManager
[INFO] Running org.apache.hadoop.ozone.scm.TestAllocateContainer
[INFO] Tests run: 2, Failures: 0, Errors: 0, Skipped: 0, Time elapsed: 45.065 s - in org.apache.hadoop.ozone.scm.TestAllocateContainer
[INFO] Running org.apache.hadoop.ozone.scm.TestXceiverClientMetrics
[INFO] Tests run: 1, Failures: 0, Errors: 0, Skipped: 0, Time elapsed: 36.951 s - in org.apache.hadoop.ozone.scm.TestXceiverClientMetrics
[INFO] Running org.apache.hadoop.ozone.scm.TestSCMInstallSnapshotWithHA
[INFO] Tests run: 3, Failures: 0, Errors: 0, Skipped: 0, Time elapsed: 169.455 s - in org.apache.hadoop.ozone.scm.TestSCMInstallSnapshotWithHA
[INFO] Running org.apache.hadoop.ozone.scm.node.TestDecommissionAndMaintenance
[INFO] Tests run: 8, Failures: 0, Errors: 0, Skipped: 0, Time elapsed: 337.749 s - in org.apache.hadoop.ozone.scm.node.TestDecommissionAndMaintenance
[INFO] Running org.apache.hadoop.ozone.scm.node.TestQueryNode
[WARNING] Tests run: 1, Failures: 0, Errors: 0, Skipped: 1, Time elapsed: 0.001 s - in org.apache.hadoop.ozone.scm.node.TestQueryNode
[INFO] Running org.apache.hadoop.ozone.scm.TestCloseContainer
[INFO] Tests run: 1, Failures: 0, Errors: 0, Skipped: 0, Time elapsed: 50.568 s - in org.apache.hadoop.ozone.scm.TestCloseContainer
[INFO] Running org.apache.hadoop.ozone.scm.TestFailoverWithSCMHA
[INFO] Tests run: 2, Failures: 0, Errors: 0, Skipped: 0, Time elapsed: 101.257 s - in org.apache.hadoop.ozone.scm.TestFailoverWithSCMHA
[INFO] Running org.apache.hadoop.ozone.scm.TestGetCommittedBlockLengthAndPutKey
[INFO] Tests run: 3, Failures: 0, Errors: 0, Skipped: 0, Time elapsed: 39.653 s - in org.apache.hadoop.ozone.scm.TestGetCommittedBlockLengthAndPutKey
[INFO] Running org.apache.hadoop.ozone.scm.TestStorageContainerManagerHA
[INFO] Tests run: 3, Failures: 0, Errors: 0, Skipped: 0, Time elapsed: 163.014 s - in org.apache.hadoop.ozone.scm.TestStorageContainerManagerHA
[INFO] Running org.apache.hadoop.ozone.scm.TestSCMContainerPlacementPolicyMetrics
[WARNING] Tests run: 1, Failures: 0, Errors: 0, Skipped: 1, Time elapsed: 0.001 s - in org.apache.hadoop.ozone.scm.TestSCMContainerPlacementPolicyMetrics
[INFO] Running org.apache.hadoop.ozone.scm.TestSCMNodeManagerMXBean
[INFO] Tests run: 2, Failures: 0, Errors: 0, Skipped: 0, Time elapsed: 40.223 s - in org.apache.hadoop.ozone.scm.TestSCMNodeManagerMXBean
[INFO] Running org.apache.hadoop.ozone.scm.TestContainerSmallFile
[INFO] Tests run: 4, Failures: 0, Errors: 0, Skipped: 0, Time elapsed: 39.544 s - in org.apache.hadoop.ozone.scm.TestContainerSmallFile
[INFO] Running org.apache.hadoop.ozone.TestStorageContainerManager
[INFO] Tests run: 12, Failures: 0, Errors: 0, Skipped: 0, Time elapsed: 352.211 s - in org.apache.hadoop.ozone.TestStorageContainerManager
[INFO] 
[INFO] Results:
[INFO] 
[ERROR] Errors: 
[ERROR]   TestOzoneManagerHAWithData.testOMRatisSnapshot:377->TestOzoneManagerHA.createKey:219->Object.wait:502->Object.wait:-2 » TestTimedOut
[INFO] 
[ERROR] Tests run: 255, Failures: 0, Errors: 1, Skipped: 15
[INFO] 
[INFO] 
[INFO] ------------------------------------------------------------------------
[INFO] Skipping Apache Ozone Mini Ozone Chaos Tests
[INFO] This project has been banned from the build due to previous failures.
[INFO] ------------------------------------------------------------------------
[INFO] ------------------------------------------------------------------------
[INFO] Reactor Summary for Apache Ozone Integration Tests 1.2.0-SNAPSHOT:
[INFO] 
[INFO] Apache Ozone Integration Tests ..................... FAILURE [  01:34 h]
[INFO] Apache Ozone Mini Ozone Chaos Tests ................ SKIPPED
[INFO] ------------------------------------------------------------------------
[INFO] BUILD FAILURE
[INFO] ------------------------------------------------------------------------
[INFO] Total time:  01:34 h
[INFO] Finished at: 2021-10-05T23:54:31Z
[INFO] ------------------------------------------------------------------------
[ERROR] Failed to execute goal org.apache.maven.plugins:maven-surefire-plugin:3.0.0-M1:test (default-test) on project ozone-integration-test: There are test failures.
[ERROR] 
[ERROR] Please refer to /home/runner/work/ozone/ozone/hadoop-ozone/integration-test/target/surefire-reports for the individual test results.
[ERROR] Please refer to dump files (if any exist) [date].dump, [date]-jvmRun[N].dump and [date].dumpstream.
[ERROR] -> [Help 1]
[ERROR] 
[ERROR] To see the full stack trace of the errors, re-run Maven with the -e switch.
[ERROR] Re-run Maven using the -X switch to enable full debug logging.
[ERROR] 
[ERROR] For more information about the errors and possible solutions, please read the following articles:
[ERROR] [Help 1] http://cwiki.apache.org/confluence/display/MAVEN/MojoFailureException
