[INFO] Scanning for projects...
[INFO] ------------------------------------------------------------------------
[INFO] Detecting the operating system and CPU architecture
[INFO] ------------------------------------------------------------------------
[INFO] os.detected.name: linux
[INFO] os.detected.arch: x86_64
[INFO] os.detected.version: 5.4
[INFO] os.detected.version.major: 5
[INFO] os.detected.version.minor: 4
[INFO] os.detected.release: ubuntu
[INFO] os.detected.release.version: 18.04
[INFO] os.detected.release.like.ubuntu: true
[INFO] os.detected.release.like.debian: true
[INFO] os.detected.classifier: linux-x86_64
[INFO] ------------------------------------------------------------------------
[INFO] Reactor Build Order:
[INFO] 
[INFO] Apache Ozone Integration Tests                                     [jar]
[INFO] Apache Ozone Mini Ozone Chaos Tests                                [jar]
[INFO] 
[INFO] --------------< org.apache.ozone:ozone-integration-test >---------------
[INFO] Building Apache Ozone Integration Tests 1.2.0-SNAPSHOT             [1/2]
[INFO] --------------------------------[ jar ]---------------------------------
[INFO] 
[INFO] --- maven-antrun-plugin:1.3:run (create-testdirs) @ ozone-integration-test ---
[INFO] Executing tasks
[INFO] Executed tasks
[INFO] 
[INFO] --- jacoco-maven-plugin:0.8.5:prepare-agent (default-prepare-agent) @ ozone-integration-test ---
[INFO] argLine set to -javaagent:/home/runner/.m2/repository/org/jacoco/org.jacoco.agent/0.8.5/org.jacoco.agent-0.8.5-runtime.jar=destfile=/home/runner/work/ozone/ozone/hadoop-ozone/integration-test/target/jacoco.exec,includes=org.apache.hadoop.hdds.*:org.apache.hadoop.ozone.*:org.apache.hadoop.fs.ozone.*
[INFO] 
[INFO] --- maven-remote-resources-plugin:1.5:process (default) @ ozone-integration-test ---
[INFO] 
[INFO] --- maven-resources-plugin:3.1.0:resources (default-resources) @ ozone-integration-test ---
[INFO] Using 'UTF-8' encoding to copy filtered resources.
[INFO] skip non existing resourceDirectory /home/runner/work/ozone/ozone/hadoop-ozone/integration-test/src/main/resources
[INFO] Copying 2 resources
[INFO] 
[INFO] --- maven-compiler-plugin:3.1:compile (default-compile) @ ozone-integration-test ---
[INFO] No sources to compile
[INFO] 
[INFO] --- maven-resources-plugin:3.1.0:testResources (default-testResources) @ ozone-integration-test ---
[INFO] Using 'UTF-8' encoding to copy filtered resources.
[INFO] Copying 21 resources
[INFO] Copying 2 resources
[INFO] 
[INFO] --- maven-compiler-plugin:3.1:testCompile (default-testCompile) @ ozone-integration-test ---
[INFO] Compiling 11 source files to /home/runner/work/ozone/ozone/hadoop-ozone/integration-test/target/test-classes
[INFO] 
[INFO] --- maven-surefire-plugin:3.0.0-M1:test (default-test) @ ozone-integration-test ---
[INFO] Downloading from central: https://repo.maven.apache.org/maven2/org/apache/maven/surefire/surefire-junit-platform/3.0.0-M1/surefire-junit-platform-3.0.0-M1.jar
[INFO] Downloaded from central: https://repo.maven.apache.org/maven2/org/apache/maven/surefire/surefire-junit-platform/3.0.0-M1/surefire-junit-platform-3.0.0-M1.jar (20 kB at 55 kB/s)
[INFO] Downloading from central: https://repo.maven.apache.org/maven2/org/apache/maven/surefire/surefire-junit-platform/3.0.0-M1/surefire-junit-platform-3.0.0-M1.pom
[INFO] Downloaded from central: https://repo.maven.apache.org/maven2/org/apache/maven/surefire/surefire-junit-platform/3.0.0-M1/surefire-junit-platform-3.0.0-M1.pom (5.5 kB at 98 kB/s)
[INFO] Downloading from central: https://repo.maven.apache.org/maven2/org/apache/maven/surefire/surefire-providers/3.0.0-M1/surefire-providers-3.0.0-M1.pom
[INFO] Downloaded from central: https://repo.maven.apache.org/maven2/org/apache/maven/surefire/surefire-providers/3.0.0-M1/surefire-providers-3.0.0-M1.pom (2.5 kB at 50 kB/s)
[INFO] Downloading from central: https://repo.maven.apache.org/maven2/org/apache/maven/surefire/common-java5/3.0.0-M1/common-java5-3.0.0-M1.pom
[INFO] Downloaded from central: https://repo.maven.apache.org/maven2/org/apache/maven/surefire/common-java5/3.0.0-M1/common-java5-3.0.0-M1.pom (3.1 kB at 55 kB/s)
[INFO] Downloading from central: https://repo.maven.apache.org/maven2/org/junit/platform/junit-platform-launcher/1.3.1/junit-platform-launcher-1.3.1.pom
[INFO] Downloaded from central: https://repo.maven.apache.org/maven2/org/junit/platform/junit-platform-launcher/1.3.1/junit-platform-launcher-1.3.1.pom (2.2 kB at 50 kB/s)
[INFO] Downloading from central: https://repo.maven.apache.org/maven2/org/apiguardian/apiguardian-api/1.0.0/apiguardian-api-1.0.0.pom
[INFO] Downloaded from central: https://repo.maven.apache.org/maven2/org/apiguardian/apiguardian-api/1.0.0/apiguardian-api-1.0.0.pom (1.2 kB at 25 kB/s)
[INFO] Downloading from central: https://repo.maven.apache.org/maven2/org/junit/platform/junit-platform-engine/1.3.1/junit-platform-engine-1.3.1.pom
[INFO] Downloaded from central: https://repo.maven.apache.org/maven2/org/junit/platform/junit-platform-engine/1.3.1/junit-platform-engine-1.3.1.pom (2.4 kB at 50 kB/s)
[INFO] Downloading from central: https://repo.maven.apache.org/maven2/org/junit/platform/junit-platform-commons/1.3.1/junit-platform-commons-1.3.1.pom
[INFO] Downloaded from central: https://repo.maven.apache.org/maven2/org/junit/platform/junit-platform-commons/1.3.1/junit-platform-commons-1.3.1.pom (2.0 kB at 39 kB/s)
[INFO] Downloading from central: https://repo.maven.apache.org/maven2/org/opentest4j/opentest4j/1.1.1/opentest4j-1.1.1.pom
[INFO] Downloaded from central: https://repo.maven.apache.org/maven2/org/opentest4j/opentest4j/1.1.1/opentest4j-1.1.1.pom (1.7 kB at 33 kB/s)
[INFO] Downloading from central: https://repo.maven.apache.org/maven2/org/apache/maven/surefire/common-java5/3.0.0-M1/common-java5-3.0.0-M1.jar
[INFO] Downloading from central: https://repo.maven.apache.org/maven2/org/junit/platform/junit-platform-launcher/1.3.1/junit-platform-launcher-1.3.1.jar
[INFO] Downloading from central: https://repo.maven.apache.org/maven2/org/apiguardian/apiguardian-api/1.0.0/apiguardian-api-1.0.0.jar
[INFO] Downloading from central: https://repo.maven.apache.org/maven2/org/junit/platform/junit-platform-engine/1.3.1/junit-platform-engine-1.3.1.jar
[INFO] Downloading from central: https://repo.maven.apache.org/maven2/org/junit/platform/junit-platform-commons/1.3.1/junit-platform-commons-1.3.1.jar
[INFO] Downloaded from central: https://repo.maven.apache.org/maven2/org/apiguardian/apiguardian-api/1.0.0/apiguardian-api-1.0.0.jar (2.2 kB at 12 kB/s)
[INFO] Downloading from central: https://repo.maven.apache.org/maven2/org/opentest4j/opentest4j/1.1.1/opentest4j-1.1.1.jar
[INFO] Downloaded from central: https://repo.maven.apache.org/maven2/org/junit/platform/junit-platform-launcher/1.3.1/junit-platform-launcher-1.3.1.jar (95 kB at 459 kB/s)
[INFO] Downloaded from central: https://repo.maven.apache.org/maven2/org/junit/platform/junit-platform-engine/1.3.1/junit-platform-engine-1.3.1.jar (135 kB at 608 kB/s)
[INFO] Downloaded from central: https://repo.maven.apache.org/maven2/org/junit/platform/junit-platform-commons/1.3.1/junit-platform-commons-1.3.1.jar (78 kB at 319 kB/s)
[INFO] Downloaded from central: https://repo.maven.apache.org/maven2/org/apache/maven/surefire/common-java5/3.0.0-M1/common-java5-3.0.0-M1.jar (32 kB at 119 kB/s)
[INFO] Downloaded from central: https://repo.maven.apache.org/maven2/org/opentest4j/opentest4j/1.1.1/opentest4j-1.1.1.jar (7.1 kB at 57 kB/s)
[INFO] 
[INFO] -------------------------------------------------------
[INFO]  T E S T S
[INFO] -------------------------------------------------------
[INFO] Running org.apache.hadoop.ozone.freon.TestFreonWithPipelineDestroy
[INFO] Tests run: 1, Failures: 0, Errors: 0, Skipped: 0, Time elapsed: 56.96 s - in org.apache.hadoop.ozone.freon.TestFreonWithPipelineDestroy
[INFO] Running org.apache.hadoop.ozone.freon.TestHadoopNestedDirGenerator
[INFO] Tests run: 1, Failures: 0, Errors: 0, Skipped: 0, Time elapsed: 49.842 s - in org.apache.hadoop.ozone.freon.TestHadoopNestedDirGenerator
[INFO] Running org.apache.hadoop.ozone.freon.TestDataValidateWithDummyContainers
[INFO] Tests run: 2, Failures: 0, Errors: 0, Skipped: 0, Time elapsed: 48.637 s - in org.apache.hadoop.ozone.freon.TestDataValidateWithDummyContainers
[INFO] Running org.apache.hadoop.ozone.freon.TestFreonWithDatanodeFastRestart
[WARNING] Tests run: 1, Failures: 0, Errors: 0, Skipped: 1, Time elapsed: 0.005 s - in org.apache.hadoop.ozone.freon.TestFreonWithDatanodeFastRestart
[INFO] Running org.apache.hadoop.ozone.freon.TestHadoopDirTreeGenerator
[INFO] Tests run: 1, Failures: 0, Errors: 0, Skipped: 0, Time elapsed: 73.072 s - in org.apache.hadoop.ozone.freon.TestHadoopDirTreeGenerator
[INFO] Running org.apache.hadoop.ozone.freon.TestDataValidateWithSafeByteOperations
[INFO] Tests run: 2, Failures: 0, Errors: 0, Skipped: 0, Time elapsed: 58.723 s - in org.apache.hadoop.ozone.freon.TestDataValidateWithSafeByteOperations
[INFO] Running org.apache.hadoop.ozone.freon.TestHadoopDirTreeGeneratorWithFSO
[INFO] Tests run: 1, Failures: 0, Errors: 0, Skipped: 0, Time elapsed: 77.148 s - in org.apache.hadoop.ozone.freon.TestHadoopDirTreeGeneratorWithFSO
[INFO] Running org.apache.hadoop.ozone.freon.TestRandomKeyGenerator
[WARNING] Tests run: 1, Failures: 0, Errors: 0, Skipped: 1, Time elapsed: 0.002 s - in org.apache.hadoop.ozone.freon.TestRandomKeyGenerator
[INFO] Running org.apache.hadoop.ozone.freon.TestDataValidateWithUnsafeByteOperations
[INFO] Tests run: 2, Failures: 0, Errors: 0, Skipped: 0, Time elapsed: 60.919 s - in org.apache.hadoop.ozone.freon.TestDataValidateWithUnsafeByteOperations
[INFO] Running org.apache.hadoop.ozone.recon.TestReconTasks
[INFO] Tests run: 1, Failures: 0, Errors: 0, Skipped: 0, Time elapsed: 71.396 s - in org.apache.hadoop.ozone.recon.TestReconTasks
[INFO] Running org.apache.hadoop.ozone.recon.TestReconAsPassiveScm
[INFO] Tests run: 2, Failures: 0, Errors: 0, Skipped: 0, Time elapsed: 78.102 s - in org.apache.hadoop.ozone.recon.TestReconAsPassiveScm
[INFO] Running org.apache.hadoop.ozone.recon.TestReconWithOzoneManager
[INFO] Tests run: 1, Failures: 0, Errors: 0, Skipped: 0, Time elapsed: 27.171 s - in org.apache.hadoop.ozone.recon.TestReconWithOzoneManager
[INFO] Running org.apache.hadoop.ozone.recon.TestReconWithOzoneManagerFSO
[INFO] Tests run: 1, Failures: 0, Errors: 0, Skipped: 0, Time elapsed: 27.623 s - in org.apache.hadoop.ozone.recon.TestReconWithOzoneManagerFSO
[INFO] Running org.apache.hadoop.ozone.recon.TestReconWithOzoneManagerHA
[INFO] Tests run: 1, Failures: 0, Errors: 0, Skipped: 0, Time elapsed: 36.469 s - in org.apache.hadoop.ozone.recon.TestReconWithOzoneManagerHA
[INFO] Running org.apache.hadoop.ozone.TestOzoneConfigurationFields
[INFO] Tests run: 4, Failures: 0, Errors: 0, Skipped: 0, Time elapsed: 0.282 s - in org.apache.hadoop.ozone.TestOzoneConfigurationFields
[INFO] Running org.apache.hadoop.ozone.TestContainerStateMachineIdempotency
[INFO] Tests run: 1, Failures: 0, Errors: 0, Skipped: 0, Time elapsed: 34.516 s - in org.apache.hadoop.ozone.TestContainerStateMachineIdempotency
[INFO] Running org.apache.hadoop.ozone.TestMiniOzoneOMHACluster
[INFO] Tests run: 1, Failures: 0, Errors: 0, Skipped: 0, Time elapsed: 35.445 s - in org.apache.hadoop.ozone.TestMiniOzoneOMHACluster
[INFO] Running org.apache.hadoop.ozone.TestContainerOperations
[INFO] Tests run: 2, Failures: 0, Errors: 0, Skipped: 0, Time elapsed: 34.338 s - in org.apache.hadoop.ozone.TestContainerOperations
[INFO] Running org.apache.hadoop.ozone.TestDelegationToken
[INFO] Tests run: 1, Failures: 0, Errors: 0, Skipped: 0, Time elapsed: 14.831 s - in org.apache.hadoop.ozone.TestDelegationToken
[INFO] Running org.apache.hadoop.ozone.om.parser.TestOMRatisLogParser
[INFO] Tests run: 1, Failures: 0, Errors: 0, Skipped: 0, Time elapsed: 36.148 s - in org.apache.hadoop.ozone.om.parser.TestOMRatisLogParser
[INFO] Running org.apache.hadoop.ozone.om.TestScmSafeMode
[WARNING] Tests run: 1, Failures: 0, Errors: 0, Skipped: 1, Time elapsed: 0.001 s - in org.apache.hadoop.ozone.om.TestScmSafeMode
[INFO] Running org.apache.hadoop.ozone.om.TestOMRatisSnapshots
[INFO] Tests run: 3, Failures: 0, Errors: 0, Skipped: 0, Time elapsed: 144.347 s - in org.apache.hadoop.ozone.om.TestOMRatisSnapshots
[INFO] Running org.apache.hadoop.ozone.om.TestOzoneManagerHAWithACL
[INFO] Tests run: 9, Failures: 0, Errors: 0, Skipped: 0, Time elapsed: 339.64 s - in org.apache.hadoop.ozone.om.TestOzoneManagerHAWithACL
[INFO] Running org.apache.hadoop.ozone.om.TestOzoneManagerRestart
[INFO] Tests run: 3, Failures: 0, Errors: 0, Skipped: 0, Time elapsed: 60.242 s - in org.apache.hadoop.ozone.om.TestOzoneManagerRestart
[INFO] Running org.apache.hadoop.ozone.om.TestOMDbCheckpointServlet
[INFO] Tests run: 3, Failures: 0, Errors: 0, Skipped: 0, Time elapsed: 42.424 s - in org.apache.hadoop.ozone.om.TestOMDbCheckpointServlet
[INFO] Running org.apache.hadoop.ozone.om.TestOzoneManagerListVolumes
[INFO] Tests run: 6, Failures: 0, Errors: 0, Skipped: 0, Time elapsed: 232.071 s - in org.apache.hadoop.ozone.om.TestOzoneManagerListVolumes
[INFO] Running org.apache.hadoop.ozone.om.TestOMEpochForNonRatis
[INFO] Tests run: 2, Failures: 0, Errors: 0, Skipped: 0, Time elapsed: 41.191 s - in org.apache.hadoop.ozone.om.TestOMEpochForNonRatis
[INFO] Running org.apache.hadoop.ozone.om.TestOzoneManagerRestInterface
[INFO] Tests run: 1, Failures: 0, Errors: 0, Skipped: 0, Time elapsed: 35.795 s - in org.apache.hadoop.ozone.om.TestOzoneManagerRestInterface
[INFO] Running org.apache.hadoop.ozone.om.snapshot.TestOzoneManagerSnapshotProvider
[INFO] Tests run: 1, Failures: 0, Errors: 0, Skipped: 0, Time elapsed: 37.45 s - in org.apache.hadoop.ozone.om.snapshot.TestOzoneManagerSnapshotProvider
[INFO] Running org.apache.hadoop.ozone.om.TestOzoneManagerRocksDBLogging
[INFO] Tests run: 1, Failures: 0, Errors: 0, Skipped: 0, Time elapsed: 80.959 s - in org.apache.hadoop.ozone.om.TestOzoneManagerRocksDBLogging
[INFO] Running org.apache.hadoop.ozone.om.TestOMUpgradeFinalization
[WARNING] Tests run: 2, Failures: 0, Errors: 0, Skipped: 2, Time elapsed: 0.125 s - in org.apache.hadoop.ozone.om.TestOMUpgradeFinalization
[INFO] Running org.apache.hadoop.ozone.om.TestObjectStoreWithFSO
[INFO] Tests run: 8, Failures: 0, Errors: 0, Skipped: 0, Time elapsed: 38.507 s - in org.apache.hadoop.ozone.om.TestObjectStoreWithFSO
[INFO] Running org.apache.hadoop.ozone.om.TestOzoneManagerHAWithData
[WARNING] Tests run: 12, Failures: 0, Errors: 0, Skipped: 1, Time elapsed: 502.37 s - in org.apache.hadoop.ozone.om.TestOzoneManagerHAWithData
[INFO] Running org.apache.hadoop.ozone.om.TestOmLDBCli
[INFO] Tests run: 1, Failures: 0, Errors: 0, Skipped: 0, Time elapsed: 0.86 s - in org.apache.hadoop.ozone.om.TestOmLDBCli
[INFO] Running org.apache.hadoop.ozone.om.TestSecureOzoneManager
[INFO] Tests run: 2, Failures: 0, Errors: 0, Skipped: 0, Time elapsed: 2.629 s - in org.apache.hadoop.ozone.om.TestSecureOzoneManager
[INFO] Running org.apache.hadoop.ozone.om.TestOmStartupSlvLessThanMlv
[INFO] Tests run: 1, Failures: 0, Errors: 0, Skipped: 0, Time elapsed: 3.377 s - in org.apache.hadoop.ozone.om.TestOmStartupSlvLessThanMlv
[INFO] Running org.apache.hadoop.ozone.om.TestOzoneManagerBootstrap
[ERROR] Tests run: 3, Failures: 0, Errors: 1, Skipped: 0, Time elapsed: 166.282 s <<< FAILURE! - in org.apache.hadoop.ozone.om.TestOzoneManagerBootstrap
[ERROR] testBootstrapTwoNewOMs  Time elapsed: 48.687 s  <<< ERROR!
java.io.IOException: Failed init RocksDB, db path : /home/runner/work/ozone/ozone/hadoop-ozone/integration-test/target/test-dir/MiniOzoneClusterImpl-c2709307-340b-4da9-b87e-bf8cdd64b120/omNode-bootstrap-1/om.db, exception :org.rocksdb.RocksDBException lock hold by current process, acquire time 1628580074 acquiring thread 139866645350144: /home/runner/work/ozone/ozone/hadoop-ozone/integration-test/target/test-dir/MiniOzoneClusterImpl-c2709307-340b-4da9-b87e-bf8cdd64b120/omNode-bootstrap-1/om.db/LOCK: No locks available; status : IOError; message : lock hold by current process, acquire time 1628580074 acquiring thread 139866645350144: /home/runner/work/ozone/ozone/hadoop-ozone/integration-test/target/test-dir/MiniOzoneClusterImpl-c2709307-340b-4da9-b87e-bf8cdd64b120/omNode-bootstrap-1/om.db/LOCK: No locks available
	at org.apache.hadoop.hdds.utils.HddsServerUtil.toIOException(HddsServerUtil.java:564)
	at org.apache.hadoop.hdds.utils.db.RDBStore.<init>(RDBStore.java:164)
	at org.apache.hadoop.hdds.utils.db.DBStoreBuilder.build(DBStoreBuilder.java:191)
	at org.apache.hadoop.ozone.om.OmMetadataManagerImpl.loadDB(OmMetadataManagerImpl.java:397)
	at org.apache.hadoop.ozone.om.OmMetadataManagerImpl.loadDB(OmMetadataManagerImpl.java:387)
	at org.apache.hadoop.ozone.om.OmMetadataManagerImpl.start(OmMetadataManagerImpl.java:379)
	at org.apache.hadoop.ozone.om.OmMetadataManagerImpl.<init>(OmMetadataManagerImpl.java:246)
	at org.apache.hadoop.ozone.om.OzoneManager.instantiateServices(OzoneManager.java:579)
	at org.apache.hadoop.ozone.om.OzoneManager.<init>(OzoneManager.java:503)
	at org.apache.hadoop.ozone.om.OzoneManager.createOm(OzoneManager.java:550)
	at org.apache.hadoop.ozone.MiniOzoneHAClusterImpl.bootstrapNewOM(MiniOzoneHAClusterImpl.java:791)
	at org.apache.hadoop.ozone.MiniOzoneHAClusterImpl.bootstrapOzoneManager(MiniOzoneHAClusterImpl.java:706)
	at org.apache.hadoop.ozone.om.TestOzoneManagerBootstrap.testBootstrapOMs(TestOzoneManagerBootstrap.java:156)
	at org.apache.hadoop.ozone.om.TestOzoneManagerBootstrap.testBootstrapTwoNewOMs(TestOzoneManagerBootstrap.java:180)
	at sun.reflect.NativeMethodAccessorImpl.invoke0(Native Method)
	at sun.reflect.NativeMethodAccessorImpl.invoke(NativeMethodAccessorImpl.java:62)
	at sun.reflect.DelegatingMethodAccessorImpl.invoke(DelegatingMethodAccessorImpl.java:43)
	at java.lang.reflect.Method.invoke(Method.java:498)
	at org.junit.runners.model.FrameworkMethod$1.runReflectiveCall(FrameworkMethod.java:59)
	at org.junit.internal.runners.model.ReflectiveCallable.run(ReflectiveCallable.java:12)
	at org.junit.runners.model.FrameworkMethod.invokeExplosively(FrameworkMethod.java:56)
	at org.junit.internal.runners.statements.InvokeMethod.evaluate(InvokeMethod.java:17)
	at org.junit.internal.runners.statements.RunAfters.evaluate(RunAfters.java:27)
	at org.junit.rules.ExpectedException$ExpectedExceptionStatement.evaluate(ExpectedException.java:258)
	at org.junit.internal.runners.statements.FailOnTimeout$CallableStatement.call(FailOnTimeout.java:288)
	at org.junit.internal.runners.statements.FailOnTimeout$CallableStatement.call(FailOnTimeout.java:282)
	at java.util.concurrent.FutureTask.run(FutureTask.java:266)
	at java.lang.Thread.run(Thread.java:748)
Caused by: org.rocksdb.RocksDBException: lock hold by current process, acquire time 1628580074 acquiring thread 139866645350144: /home/runner/work/ozone/ozone/hadoop-ozone/integration-test/target/test-dir/MiniOzoneClusterImpl-c2709307-340b-4da9-b87e-bf8cdd64b120/omNode-bootstrap-1/om.db/LOCK: No locks available
	at org.rocksdb.RocksDB.open(Native Method)
	at org.rocksdb.RocksDB.open(RocksDB.java:306)
	at org.apache.hadoop.hdds.utils.db.RDBStore.<init>(RDBStore.java:119)
	... 26 more

[INFO] Running org.apache.hadoop.ozone.om.TestOmBlockVersioning
[INFO] Tests run: 2, Failures: 0, Errors: 0, Skipped: 0, Time elapsed: 36.86 s - in org.apache.hadoop.ozone.om.TestOmBlockVersioning
[INFO] Running org.apache.hadoop.ozone.om.TestKeyManagerImpl
[INFO] Tests run: 20, Failures: 0, Errors: 0, Skipped: 0, Time elapsed: 70.948 s - in org.apache.hadoop.ozone.om.TestKeyManagerImpl
[INFO] Running org.apache.hadoop.ozone.om.TestOzoneManagerHAKeyDeletion
[INFO] Tests run: 1, Failures: 0, Errors: 0, Skipped: 0, Time elapsed: 57.585 s - in org.apache.hadoop.ozone.om.TestOzoneManagerHAKeyDeletion
[INFO] Running org.apache.hadoop.ozone.om.TestOzoneManagerPrepare
[WARNING] Tests run: 6, Failures: 0, Errors: 0, Skipped: 1, Time elapsed: 250.762 s - in org.apache.hadoop.ozone.om.TestOzoneManagerPrepare
[INFO] Running org.apache.hadoop.ozone.om.TestOmMetrics
[INFO] Tests run: 5, Failures: 0, Errors: 0, Skipped: 0, Time elapsed: 181.9 s - in org.apache.hadoop.ozone.om.TestOmMetrics
[INFO] Running org.apache.hadoop.ozone.om.TestOmAcls
[INFO] Tests run: 2, Failures: 0, Errors: 0, Skipped: 0, Time elapsed: 40.869 s - in org.apache.hadoop.ozone.om.TestOmAcls
[INFO] Running org.apache.hadoop.ozone.om.TestContainerReportWithKeys
[INFO] Tests run: 1, Failures: 0, Errors: 0, Skipped: 0, Time elapsed: 36.201 s - in org.apache.hadoop.ozone.om.TestContainerReportWithKeys
[INFO] Running org.apache.hadoop.ozone.om.TestOmInit
[INFO] Tests run: 1, Failures: 0, Errors: 0, Skipped: 0, Time elapsed: 44.529 s - in org.apache.hadoop.ozone.om.TestOmInit
[INFO] Running org.apache.hadoop.ozone.om.TestKeyPurging
[INFO] Tests run: 1, Failures: 0, Errors: 0, Skipped: 0, Time elapsed: 37.251 s - in org.apache.hadoop.ozone.om.TestKeyPurging
[INFO] Running org.apache.hadoop.ozone.om.TestRecursiveAclWithFSO
[INFO] Tests run: 1, Failures: 0, Errors: 0, Skipped: 0, Time elapsed: 36.624 s - in org.apache.hadoop.ozone.om.TestRecursiveAclWithFSO
[INFO] Running org.apache.hadoop.ozone.om.TestOzoneManagerConfiguration
[INFO] Tests run: 9, Failures: 0, Errors: 0, Skipped: 0, Time elapsed: 269.059 s - in org.apache.hadoop.ozone.om.TestOzoneManagerConfiguration
[INFO] Running org.apache.hadoop.ozone.om.TestOzoneManagerHAMetadataOnly
[WARNING] Tests run: 10, Failures: 0, Errors: 0, Skipped: 2, Time elapsed: 331.377 s - in org.apache.hadoop.ozone.om.TestOzoneManagerHAMetadataOnly
[INFO] Running org.apache.hadoop.ozone.TestSecureOzoneCluster
[INFO] Tests run: 11, Failures: 0, Errors: 0, Skipped: 0, Time elapsed: 64.982 s - in org.apache.hadoop.ozone.TestSecureOzoneCluster
[INFO] Running org.apache.hadoop.ozone.TestMiniOzoneCluster
[INFO] Tests run: 5, Failures: 0, Errors: 0, Skipped: 0, Time elapsed: 153.416 s - in org.apache.hadoop.ozone.TestMiniOzoneCluster
[INFO] Running org.apache.hadoop.ozone.container.common.transport.server.ratis.TestCSMMetrics
[INFO] Tests run: 1, Failures: 0, Errors: 0, Skipped: 0, Time elapsed: 16.803 s - in org.apache.hadoop.ozone.container.common.transport.server.ratis.TestCSMMetrics
[INFO] Running org.apache.hadoop.ozone.container.common.statemachine.commandhandler.TestCloseContainerByPipeline
[WARNING] Tests run: 1, Failures: 0, Errors: 0, Skipped: 1, Time elapsed: 0.002 s - in org.apache.hadoop.ozone.container.common.statemachine.commandhandler.TestCloseContainerByPipeline
[INFO] Running org.apache.hadoop.ozone.container.common.statemachine.commandhandler.TestCloseContainerHandler
[INFO] Tests run: 1, Failures: 0, Errors: 0, Skipped: 0, Time elapsed: 24.77 s - in org.apache.hadoop.ozone.container.common.statemachine.commandhandler.TestCloseContainerHandler
[INFO] Running org.apache.hadoop.ozone.container.common.statemachine.commandhandler.TestBlockDeletion
[ERROR] Tests run: 3, Failures: 1, Errors: 0, Skipped: 0, Time elapsed: 257.772 s <<< FAILURE! - in org.apache.hadoop.ozone.container.common.statemachine.commandhandler.TestBlockDeletion
[ERROR] testContainerStatisticsAfterDelete  Time elapsed: 75.328 s  <<< FAILURE!
java.lang.AssertionError: expected:<DELETED> but was:<DELETING>
	at org.junit.Assert.fail(Assert.java:89)
	at org.junit.Assert.failNotEquals(Assert.java:835)
	at org.junit.Assert.assertEquals(Assert.java:120)
	at org.junit.Assert.assertEquals(Assert.java:146)
	at org.apache.hadoop.ozone.container.common.statemachine.commandhandler.TestBlockDeletion.lambda$testContainerStatisticsAfterDelete$13(TestBlockDeletion.java:374)
	at java.util.ArrayList$ArrayListSpliterator.forEachRemaining(ArrayList.java:1384)
	at java.util.stream.ReferencePipeline$Head.forEach(ReferencePipeline.java:647)
	at org.apache.hadoop.ozone.container.common.statemachine.commandhandler.TestBlockDeletion.testContainerStatisticsAfterDelete(TestBlockDeletion.java:373)
	at sun.reflect.NativeMethodAccessorImpl.invoke0(Native Method)
	at sun.reflect.NativeMethodAccessorImpl.invoke(NativeMethodAccessorImpl.java:62)
	at sun.reflect.DelegatingMethodAccessorImpl.invoke(DelegatingMethodAccessorImpl.java:43)
	at java.lang.reflect.Method.invoke(Method.java:498)
	at org.junit.runners.model.FrameworkMethod$1.runReflectiveCall(FrameworkMethod.java:59)
	at org.junit.internal.runners.model.ReflectiveCallable.run(ReflectiveCallable.java:12)
	at org.junit.runners.model.FrameworkMethod.invokeExplosively(FrameworkMethod.java:56)
	at org.junit.internal.runners.statements.InvokeMethod.evaluate(InvokeMethod.java:17)
	at org.junit.internal.runners.statements.RunBefores.evaluate(RunBefores.java:26)
	at org.junit.internal.runners.statements.RunAfters.evaluate(RunAfters.java:27)
	at org.junit.runners.ParentRunner$3.evaluate(ParentRunner.java:306)
	at org.junit.runners.BlockJUnit4ClassRunner$1.evaluate(BlockJUnit4ClassRunner.java:100)
	at org.junit.runners.ParentRunner.runLeaf(ParentRunner.java:366)
	at org.junit.runners.BlockJUnit4ClassRunner.runChild(BlockJUnit4ClassRunner.java:103)
	at org.junit.runners.BlockJUnit4ClassRunner.runChild(BlockJUnit4ClassRunner.java:63)
	at org.junit.runners.ParentRunner$4.run(ParentRunner.java:331)
	at org.junit.runners.ParentRunner$1.schedule(ParentRunner.java:79)
	at org.junit.runners.ParentRunner.runChildren(ParentRunner.java:329)
	at org.junit.runners.ParentRunner.access$100(ParentRunner.java:66)
	at org.junit.runners.ParentRunner$2.evaluate(ParentRunner.java:293)
	at org.junit.runners.ParentRunner$3.evaluate(ParentRunner.java:306)
	at org.junit.runners.ParentRunner.run(ParentRunner.java:413)
	at org.junit.runner.JUnitCore.run(JUnitCore.java:137)
	at org.junit.runner.JUnitCore.run(JUnitCore.java:115)
	at org.junit.vintage.engine.execution.RunnerExecutor.execute(RunnerExecutor.java:43)
	at java.util.stream.ForEachOps$ForEachOp$OfRef.accept(ForEachOps.java:183)
	at java.util.stream.ReferencePipeline$3$1.accept(ReferencePipeline.java:193)
	at java.util.Iterator.forEachRemaining(Iterator.java:116)
	at java.util.Spliterators$IteratorSpliterator.forEachRemaining(Spliterators.java:1801)
	at java.util.stream.AbstractPipeline.copyInto(AbstractPipeline.java:482)
	at java.util.stream.AbstractPipeline.wrapAndCopyInto(AbstractPipeline.java:472)
	at java.util.stream.ForEachOps$ForEachOp.evaluateSequential(ForEachOps.java:150)
	at java.util.stream.ForEachOps$ForEachOp$OfRef.evaluateSequential(ForEachOps.java:173)
	at java.util.stream.AbstractPipeline.evaluate(AbstractPipeline.java:234)
	at java.util.stream.ReferencePipeline.forEach(ReferencePipeline.java:485)
	at org.junit.vintage.engine.VintageTestEngine.executeAllChildren(VintageTestEngine.java:82)
	at org.junit.vintage.engine.VintageTestEngine.execute(VintageTestEngine.java:73)
	at org.junit.platform.launcher.core.EngineExecutionOrchestrator.execute(EngineExecutionOrchestrator.java:108)
	at org.junit.platform.launcher.core.EngineExecutionOrchestrator.execute(EngineExecutionOrchestrator.java:88)
	at org.junit.platform.launcher.core.EngineExecutionOrchestrator.lambda$execute$0(EngineExecutionOrchestrator.java:54)
	at org.junit.platform.launcher.core.EngineExecutionOrchestrator.withInterceptedStreams(EngineExecutionOrchestrator.java:67)
	at org.junit.platform.launcher.core.EngineExecutionOrchestrator.execute(EngineExecutionOrchestrator.java:52)
	at org.junit.platform.launcher.core.DefaultLauncher.execute(DefaultLauncher.java:96)
	at org.junit.platform.launcher.core.DefaultLauncher.execute(DefaultLauncher.java:75)
	at org.apache.maven.surefire.junitplatform.JUnitPlatformProvider.invokeAllTests(JUnitPlatformProvider.java:142)
	at org.apache.maven.surefire.junitplatform.JUnitPlatformProvider.invoke(JUnitPlatformProvider.java:113)
	at org.apache.maven.surefire.booter.ForkedBooter.invokeProviderInSameClassLoader(ForkedBooter.java:384)
	at org.apache.maven.surefire.booter.ForkedBooter.runSuitesInProcess(ForkedBooter.java:345)
	at org.apache.maven.surefire.booter.ForkedBooter.execute(ForkedBooter.java:126)
	at org.apache.maven.surefire.booter.ForkedBooter.main(ForkedBooter.java:418)

[INFO] Running org.apache.hadoop.ozone.container.common.statemachine.commandhandler.TestDeleteContainerHandler
[INFO] Tests run: 2, Failures: 0, Errors: 0, Skipped: 0, Time elapsed: 32.533 s - in org.apache.hadoop.ozone.container.common.statemachine.commandhandler.TestDeleteContainerHandler
[INFO] Running org.apache.hadoop.ozone.container.ozoneimpl.TestSecureOzoneContainer
[INFO] Tests run: 5, Failures: 0, Errors: 0, Skipped: 0, Time elapsed: 8.082 s - in org.apache.hadoop.ozone.container.ozoneimpl.TestSecureOzoneContainer
[INFO] Running org.apache.hadoop.ozone.container.ozoneimpl.TestOzoneContainer
[WARNING] Tests run: 1, Failures: 0, Errors: 0, Skipped: 1, Time elapsed: 0.002 s - in org.apache.hadoop.ozone.container.ozoneimpl.TestOzoneContainer
[INFO] Running org.apache.hadoop.ozone.container.ozoneimpl.TestOzoneContainerWithTLS
[WARNING] Tests run: 1, Failures: 0, Errors: 0, Skipped: 1, Time elapsed: 0.001 s - in org.apache.hadoop.ozone.container.ozoneimpl.TestOzoneContainerWithTLS
[INFO] Running org.apache.hadoop.ozone.container.TestContainerReplication
[INFO] Tests run: 6, Failures: 0, Errors: 0, Skipped: 0, Time elapsed: 374.301 s - in org.apache.hadoop.ozone.container.TestContainerReplication
[INFO] Running org.apache.hadoop.ozone.container.server.TestContainerServer
[WARNING] Tests run: 1, Failures: 0, Errors: 0, Skipped: 1, Time elapsed: 0.002 s - in org.apache.hadoop.ozone.container.server.TestContainerServer
[INFO] Running org.apache.hadoop.ozone.container.server.TestSecureContainerServer
[INFO] Tests run: 2, Failures: 0, Errors: 0, Skipped: 0, Time elapsed: 28.615 s - in org.apache.hadoop.ozone.container.server.TestSecureContainerServer
[INFO] Running org.apache.hadoop.ozone.container.metrics.TestContainerMetrics
[INFO] Tests run: 1, Failures: 0, Errors: 0, Skipped: 0, Time elapsed: 6.758 s - in org.apache.hadoop.ozone.container.metrics.TestContainerMetrics
[INFO] Running org.apache.hadoop.ozone.shell.TestOzoneDatanodeShell
[INFO] Tests run: 2, Failures: 0, Errors: 0, Skipped: 0, Time elapsed: 0.605 s - in org.apache.hadoop.ozone.shell.TestOzoneDatanodeShell
[INFO] Running org.apache.hadoop.ozone.shell.TestScmAdminHA
[INFO] Tests run: 1, Failures: 0, Errors: 0, Skipped: 0, Time elapsed: 41.748 s - in org.apache.hadoop.ozone.shell.TestScmAdminHA
[INFO] Running org.apache.hadoop.ozone.shell.TestOzoneShellHA
[INFO] Tests run: 6, Failures: 0, Errors: 0, Skipped: 0, Time elapsed: 57.614 s - in org.apache.hadoop.ozone.shell.TestOzoneShellHA
[INFO] Running org.apache.hadoop.ozone.scm.TestXceiverClientGrpc
[INFO] Tests run: 4, Failures: 0, Errors: 0, Skipped: 0, Time elapsed: 1.535 s - in org.apache.hadoop.ozone.scm.TestXceiverClientGrpc
[INFO] Running org.apache.hadoop.ozone.scm.TestSCMContainerPlacementPolicyMetrics
[WARNING] Tests run: 1, Failures: 0, Errors: 0, Skipped: 1, Time elapsed: 0.002 s - in org.apache.hadoop.ozone.scm.TestSCMContainerPlacementPolicyMetrics
[INFO] Running org.apache.hadoop.ozone.scm.TestXceiverClientManager
[INFO] Tests run: 4, Failures: 0, Errors: 0, Skipped: 0, Time elapsed: 154.11 s - in org.apache.hadoop.ozone.scm.TestXceiverClientManager
[INFO] Running org.apache.hadoop.ozone.scm.node.TestDecommissionAndMaintenance
[INFO] Tests run: 11, Failures: 0, Errors: 0, Skipped: 0, Time elapsed: 805.739 s - in org.apache.hadoop.ozone.scm.node.TestDecommissionAndMaintenance
[INFO] Running org.apache.hadoop.ozone.scm.node.TestQueryNode
[WARNING] Tests run: 1, Failures: 0, Errors: 0, Skipped: 1, Time elapsed: 0.002 s - in org.apache.hadoop.ozone.scm.node.TestQueryNode
[INFO] Running org.apache.hadoop.ozone.scm.TestFailoverWithSCMHA
[INFO] Tests run: 1, Failures: 0, Errors: 0, Skipped: 0, Time elapsed: 54.551 s - in org.apache.hadoop.ozone.scm.TestFailoverWithSCMHA
[INFO] Running org.apache.hadoop.ozone.scm.TestStorageContainerManagerHA
[INFO] Tests run: 3, Failures: 0, Errors: 0, Skipped: 0, Time elapsed: 172.81 s - in org.apache.hadoop.ozone.scm.TestStorageContainerManagerHA
[INFO] Running org.apache.hadoop.ozone.scm.TestAllocateContainer
[INFO] Tests run: 2, Failures: 0, Errors: 0, Skipped: 0, Time elapsed: 43.976 s - in org.apache.hadoop.ozone.scm.TestAllocateContainer
[INFO] Running org.apache.hadoop.ozone.scm.TestGetCommittedBlockLengthAndPutKey
[INFO] Tests run: 3, Failures: 0, Errors: 0, Skipped: 0, Time elapsed: 35.766 s - in org.apache.hadoop.ozone.scm.TestGetCommittedBlockLengthAndPutKey
[INFO] Running org.apache.hadoop.ozone.scm.TestXceiverClientMetrics
[INFO] Tests run: 1, Failures: 0, Errors: 0, Skipped: 0, Time elapsed: 42.147 s - in org.apache.hadoop.ozone.scm.TestXceiverClientMetrics
[INFO] Running org.apache.hadoop.ozone.scm.TestCloseContainer
[INFO] Tests run: 1, Failures: 0, Errors: 0, Skipped: 0, Time elapsed: 45.572 s - in org.apache.hadoop.ozone.scm.TestCloseContainer
[INFO] Running org.apache.hadoop.ozone.scm.TestContainerSmallFile
[INFO] Tests run: 4, Failures: 0, Errors: 0, Skipped: 0, Time elapsed: 40.229 s - in org.apache.hadoop.ozone.scm.TestContainerSmallFile
[INFO] Running org.apache.hadoop.ozone.scm.TestSCMInstallSnapshotWithHA
[INFO] Tests run: 3, Failures: 0, Errors: 0, Skipped: 0, Time elapsed: 176.568 s - in org.apache.hadoop.ozone.scm.TestSCMInstallSnapshotWithHA
[INFO] Running org.apache.hadoop.ozone.scm.TestSCMMXBean
[INFO] Tests run: 2, Failures: 0, Errors: 0, Skipped: 0, Time elapsed: 34.209 s - in org.apache.hadoop.ozone.scm.TestSCMMXBean
[INFO] Running org.apache.hadoop.ozone.scm.pipeline.TestPipelineManagerMXBean
[INFO] Tests run: 1, Failures: 0, Errors: 0, Skipped: 0, Time elapsed: 39.079 s - in org.apache.hadoop.ozone.scm.pipeline.TestPipelineManagerMXBean
[INFO] Running org.apache.hadoop.ozone.scm.pipeline.TestSCMPipelineMetrics
[INFO] Tests run: 3, Failures: 0, Errors: 0, Skipped: 0, Time elapsed: 105.044 s - in org.apache.hadoop.ozone.scm.pipeline.TestSCMPipelineMetrics
[INFO] Running org.apache.hadoop.ozone.scm.pipeline.TestSCMPipelineBytesWrittenMetrics
[INFO] Tests run: 1, Failures: 0, Errors: 0, Skipped: 0, Time elapsed: 73.112 s - in org.apache.hadoop.ozone.scm.pipeline.TestSCMPipelineBytesWrittenMetrics
[INFO] Running org.apache.hadoop.ozone.scm.TestSCMNodeManagerMXBean
[INFO] Tests run: 2, Failures: 0, Errors: 0, Skipped: 0, Time elapsed: 35.124 s - in org.apache.hadoop.ozone.scm.TestSCMNodeManagerMXBean
[INFO] Running org.apache.hadoop.ozone.TestStorageContainerManager
[INFO] Tests run: 12, Failures: 0, Errors: 0, Skipped: 0, Time elapsed: 353.224 s - in org.apache.hadoop.ozone.TestStorageContainerManager
[INFO] Running org.apache.hadoop.ozone.fsck.TestContainerMapper
[INFO] Tests run: 1, Failures: 0, Errors: 0, Skipped: 0, Time elapsed: 39.507 s - in org.apache.hadoop.ozone.fsck.TestContainerMapper
[INFO] Running org.apache.hadoop.ozone.dn.ratis.TestDnRatisLogParser
[INFO] Tests run: 1, Failures: 0, Errors: 0, Skipped: 0, Time elapsed: 21.864 s - in org.apache.hadoop.ozone.dn.ratis.TestDnRatisLogParser
[INFO] Running org.apache.hadoop.ozone.dn.volume.TestDatanodeHddsVolumeFailureToleration
[INFO] Tests run: 2, Failures: 0, Errors: 0, Skipped: 0, Time elapsed: 238.705 s - in org.apache.hadoop.ozone.dn.volume.TestDatanodeHddsVolumeFailureToleration
[INFO] Running org.apache.hadoop.ozone.dn.volume.TestDatanodeHddsVolumeFailureDetection
[INFO] Tests run: 3, Failures: 0, Errors: 0, Skipped: 0, Time elapsed: 58.193 s - in org.apache.hadoop.ozone.dn.volume.TestDatanodeHddsVolumeFailureDetection
[INFO] Running org.apache.hadoop.ozone.dn.scrubber.TestDataScrubber
[INFO] Tests run: 1, Failures: 0, Errors: 0, Skipped: 0, Time elapsed: 33.148 s - in org.apache.hadoop.ozone.dn.scrubber.TestDataScrubber
[INFO] Running org.apache.hadoop.ozone.dn.TestDatanodeLayoutUpgradeTool
[INFO] Tests run: 1, Failures: 0, Errors: 0, Skipped: 0, Time elapsed: 45.303 s - in org.apache.hadoop.ozone.dn.TestDatanodeLayoutUpgradeTool
[INFO] Running org.apache.hadoop.ozone.TestContainerBalancerOperations
[INFO] Tests run: 1, Failures: 0, Errors: 0, Skipped: 0, Time elapsed: 35.555 s - in org.apache.hadoop.ozone.TestContainerBalancerOperations
[INFO] 
[INFO] Results:
[INFO] 
[ERROR] Failures: 
[ERROR]   TestBlockDeletion.testContainerStatisticsAfterDelete:373->lambda$testContainerStatisticsAfterDelete$13:374 expected:<DELETED> but was:<DELETING>
[ERROR] Errors: 
[ERROR]   TestOzoneManagerBootstrap.testBootstrapTwoNewOMs:180->testBootstrapOMs:156 » IO
[INFO] 
[ERROR] Tests run: 266, Failures: 1, Errors: 1, Skipped: 15
[INFO] 
[INFO] 
[INFO] ------------------------------------------------------------------------
[INFO] Skipping Apache Ozone Mini Ozone Chaos Tests
[INFO] This project has been banned from the build due to previous failures.
[INFO] ------------------------------------------------------------------------
[INFO] ------------------------------------------------------------------------
[INFO] Reactor Summary for Apache Ozone Integration Tests 1.2.0-SNAPSHOT:
[INFO] 
[INFO] Apache Ozone Integration Tests ..................... FAILURE [  02:10 h]
[INFO] Apache Ozone Mini Ozone Chaos Tests ................ SKIPPED
[INFO] ------------------------------------------------------------------------
[INFO] BUILD FAILURE
[INFO] ------------------------------------------------------------------------
[INFO] Total time:  02:10 h
[INFO] Finished at: 2021-08-10T08:50:43Z
[INFO] ------------------------------------------------------------------------
[ERROR] Failed to execute goal org.apache.maven.plugins:maven-surefire-plugin:3.0.0-M1:test (default-test) on project ozone-integration-test: There are test failures.
[ERROR] 
[ERROR] Please refer to /home/runner/work/ozone/ozone/hadoop-ozone/integration-test/target/surefire-reports for the individual test results.
[ERROR] Please refer to dump files (if any exist) [date].dump, [date]-jvmRun[N].dump and [date].dumpstream.
[ERROR] -> [Help 1]
[ERROR] 
[ERROR] To see the full stack trace of the errors, re-run Maven with the -e switch.
[ERROR] Re-run Maven using the -X switch to enable full debug logging.
[ERROR] 
[ERROR] For more information about the errors and possible solutions, please read the following articles:
[ERROR] [Help 1] http://cwiki.apache.org/confluence/display/MAVEN/MojoFailureException
